player_id,hs_athletic_background,skill_1,skill_1_rating,skill_2,skill_2_rating,skill_3,skill_3_rating,skill_4,skill_4_rating,skill_5,skill_5_rating,skill_6,skill_6_rating,skill_7,skill_7_rating,skill_8,skill_8_rating
202001616,"2022 (JUNIOR): Missed the first three games of the season while recovering from a knee injury before playing in four straight games then reinjuring the same knee … Played in four games, rushing for 43 yards on eight carries … Ran for 32 yards on five touches in his first action of the season vs. Texas A&M (Sept. 24) … Carried twice for 11 yards vs. Alabama (Oct. 1).2021 (SOPHOMORE): Played in all 13 games with six starts … According to Pro Football Focus, appeared in 320 snaps, primarily at running back … Finished fourth on the team with 575 yards on the ground … Totaled a team-best seven rushing touchdowns … Finished with seven receptions for 71 yards and one touchdown … Recorded 70-plus rushing yards in four different games … Averaged 44.2 rushing yards per game and 5.5 receiving yards per game … Rushed four times for 16 yards with a three-yard touchdown in season-opening win over Rice (Sept. 4) … Carried the ball six times for 44 yards with a five-yard touchdown run in win against Texas (Sept. 11) … Registered 72 yards on five carries and a touchdown in win against Georgia Southern (Sept. 18), including a 48-yard sprint … Added six carries for 19 yards in win against Texas A&M (Sept. 25) … Carried the ball four times for 19 yards at Ole Miss (Oct. 9), also hauling in one reception for 11 yards against the Rebels … Rushed six times for 42 yards with a 10-yard touchdown and totaled two receptions for 16 yards against Auburn (Oct. 16) in his first career start … Recorded six carries for 91 yards, including a 34-yard sprint, against UAPB (Oct. 23) … Logged 17 carries for a career-high 107 yards while adding a career-best two touchdowns against Mississippi State (Nov. 6), including the game winner, with one reception for seven yards … Hauled in two receptions for 40 yards and a touchdown while also posting 40 yards on the ground at LSU (Nov. 13) … Rushed nine times for 23 yards and one touchdown at Alabama (Nov. 20) … Ran six times for 11 yards in win against Missouri (Nov. 26) … Filed 77 yards on 11 carries and finished with one reception against Penn State (Jan. 1) in the Outback Bowl victory.2020 (FRESHMAN): Played in seven games, primarily seeing action on special teams … Did not record any statistics … According to Pro Football Focus, saw action in 59 special teams plays, predominately on kickoff return and coverage units, and two offensive plays … Played one offensive snap against Mississippi State (Oct. 3) and Ole Miss (Oct. 17).HIGH SCHOOL: Three-star prospect by Rivals, 247Sports and ESPN … Three-year varsity letterwinner at Crowley High School in Crowley, Texas … Guided the Eagles to a 9-2 overall record in 2019, including a first-round appearance in the Texas state 5A playoffs … Earned All-District honors after his junior season … Rushed for 1,109 yards and 15 touchdowns in 2018, helping the Eagles to a 7-4 record and a berth in the 5A playoffs … Rushed for over 100 yards in six games, including a season-high 231 yards and three touchdowns against Brewer HS on Sept. 20 … CHOSE ARKANSAS OVER: Missouri and others.PERSONAL: Son of Naquisha Gipson … Born May 24, 2002.",,,,,,,,,,,,,,,,
202001617,"2022: Appeared in 11 games during sophomore campaign ... Did not record any stat as a member of special teams unit ... Named co-Special Teams Player-of-the-Year alongside Jack Powers at ECU's annual end of the year banquet ... Earned ECU Honor Roll accolades in the spring of 2023.2021: Played in final six games of the season in a reserve role and on special teams ... Did not record any stats.2020: Did not experience game-day action as a true freshman … Spend year on developmental roster and provided strong reps on various scout teams … Officially enrolled at ECU in January after signing with the Pirates on December 18, 2019.",,,,,,,,,,,,,,,,
202001618,"Payten Singletary is a Tight End from Thomasville, GA.",,,,,,,,,,,,,,,,
202001619,"Tevin Griffey is a 5-10, 160-pound Cornerback from Orlando, FL.",,,,,,,,,,,,,,,,
202001620,"Cameron Kinnie is a 6-3, 265-pound Strong-Side Defensive End from Suwanee, GA.",,,,,,,,,,,,,,,,
202001621,"Jecoryan Davis-Hamilton is a 6-1, 185-pound Athlete from Apopka, FL.",,,,,,,,,,,,,,,,
202001622,"6-4 280 is a 6-4, 280-pound Offensive Guard from Tampa, FL.",,,,,,,,,,,,,,,,
202001623,"Faybian Marks is a Cornerback from Richmond, TX.",,,,,,,,,,,,,,,,
202001624,"Jordan Davis is a 6-4, 225-pound Tight End from Sanford, FL. He has committed to UCF Knights.",,,,,,,,,,,,,,,,
202001625,"Desmond Daniels is a 6-4, 220-pound Strong-Side Defensive End from Fairburn, GA.",,,,,,,,,,,,,,,,
202001626,Plays football and throws shot put and discus.2018: First-team all-district selection at DE as a junior. Helped Liberty Hill to a 13-2 record and Texas Class 4A Division I state runner-up finish.,,,,,,,,,,,,,,,,
202001627,"Jeremiah Batiste is a 6-0, 175-pound Wide Receiver from Chattanooga, TN.",,,,,,,,,,,,,,,,
202001628,"J.J. Roberts is a 6-0, 165-pound Cornerback from Ona, WV.",,,,,,,,,,,,,,,,
202001629,"Cameron Horsley is a Defensive Tackle from Riverton, NJ.",,,,,,,,,,,,,,,,
202001630,"Adrian Spellman is a 6-5, 225-pound Weak-Side Defensive End from Elizabeth City, NC.",,,,,,,,,,,,,,,,
202001631,2018: Started at safety for 14-1 West Monroe team that reached the Louisiana Class 5A state championship game.,,,,,,,,,,,,,,,,
202001632,"Justin Hodges is a 6-2, 182-pound Cornerback/Safety from Fort Lauderdale, FL.",,,,,,,,,,,,,,,,
202001633,"Shane Kady is a 6-3, 210-pound Weak-Side Defensive End from Mililani, HI.",,,,,,,,,,,,,,,,
202001634,2017: Was a first-team all-district fullback and a second-team OLB as a sophomore,,,,,,,,,,,,,,,,
202001635,"Football and track and field athlete: 200 meters (22.79), high jump (5-10), long jump (22-10.5), 4x100 relay, 4x200 relay.",,,,,,,,,,,,,,,,
202001636,"Emmanuel Johnson is a 6-5, 252-pound Strong-Side Defensive End from North Charleston, SC.",,,,,,,,,,,,,,,,
202001637,"Isaiah Tupou is a 6-3, 315-pound Offensive Guard from Sacramento, CA.",,,,,,,,,,,,,,,,
202001638,2018: Helped West Brook to a 13-3 record and Texas Class 6A Division II runner-up finish.,,,,,,,,,,,,,,,,
202001639,Signed with North Carolina out of high school as part of the 2020 class. Went the prep route and enrolled at Fork Union to reclassify as a 2021 recruit.,,,,,,,,,,,,,,,,
202001640,2018: Helped North Little Rock to a 12-1 record and Arkansas Class 7A state runner-up finish.,,,,,,,,,,,,,,,,
202001641,"Quinton McCoy is a 6-3, 265-pound Defensive Tackle from Valrico, FL.",,,,,,,,,,,,,,,,
202001642,"Ahmad Jackson is a 6-2, 194-pound Wide Receiver from Tyrone, GA.",,,,,,,,,,,,,,,,
202001643,"Braylin Johnson is a 6-0, 170-pound Wide Receiver from Duncan, SC.",,,,,,,,,,,,,,,,
202001644,"Chandler Durham is a 6-3, 266-pound Offensive Tackle from McDonough, GA. He has 6 Offers.",,,,,,,,,,,,,,,,
202001645,"Deshawn Pace is a Safety from Cincinnati, OH.",,,,,,,,,,,,,,,,
202001646,"Jay Higgins is a Linebacker from Indianapolis, IN.",,,,,,,,,,,,,,,,
202001647,"John Williams is a 6-5, 310-pound Offensive Tackle from Bolingbrook, IL.",,,,,,,,,,,,,,,,
202001648,Football and track and field athlete.,,,,,,,,,,,,,,,,
202001651,"Justin Ibieta is a 6-5, 215-pound Pro-Style Quarterback from Metairie, LA.",,,,,,,,,,,,,,,,
202001652,"Wati Huggins is a 6-2, 205-pound Weak-Side Defensive End from Miami, FL.",,,,,,,,,,,,,,,,
202001653,"Tyler Kirkwood is a 6-1, 190-pound Wide Receiver from New Orleans, LA.",,,,,,,,,,,,,,,,
202001654,2018: Helped Ascension Catholic to a 12-2 record and the Louisiana Division IV state title game (smallest playoff classification for private/select schools in the state).,,,,,,,,,,,,,,,,
202001655,"Keegan Wilburn is a 5-10, 183-pound Athlete from Nelsonville, OH. He has committed to Ohio Bobcats.",,,,,,,,,,,,,,,,
202001656,"Rontarius Wiggins is a 6-0, 170-pound Running Back from Jacksonville, AL.",,,,,,,,,,,,,,,,
202001657,"Jaylon Armstead is a Running Back from Los Angeles, CA.",,,,,,,,,,,,,,,,
202001658,"Jalen White is a Running Back from Daleville, AL.",,,,,,,,,,,,,,,,
202001659,"Frank Peasant is a Linebacker from Pensacola, FL.",,,,,,,,,,,,,,,,
202001660,"Ben Knox is a 6-2, 173-pound Cornerback from Deland, FL. He has committed to USF Bulls.",,,,,,,,,,,,,,,,
202001661,"Shi Keem Laister is a 6-2, 177-pound Safety from Clanton, AL.",,,,,,,,,,,,,,,,
202001662,"Alijah Martin is a Dual-Threat Quarterback from Summit, MS.",,,,,,,,,,,,,,,,
202001663,"Justin Sistrunk is a 6-2, 214-pound Outside Linebacker from Munford, AL.",,,,,,,,,,,,,,,,
202001664,Donavon Johnson is a 2020 WR/TE from Plano (Texas) John Paul II.,,,,,,,,,,,,,,,,
202001665,"Jaylon Jones is a 6-4, 260-pound Strong-Side Defensive End from Valdosta, GA.",,,,,,,,,,,,,,,,
202001666,"Gary Osby is a 5-11, 220-pound Running Back from Valdosta, GA.",,,,,,,,,,,,,,,,
202001667,"Nikale Davis is a 6-3, 230-pound Weak-Side Defensive End from Oklahoma City, OK.",,,,,,,,,,,,,,,,
202001668,"Larry Stephens is a 6-1, 170-pound Wide Receiver from Springfield, OH.",,,,,,,,,,,,,,,,
202001669,"Cash Devaughn is a 6-0.5, 310-pound Defensive Tackle from Apex, NC.",,,,,,,,,,,,,,,,
202001670,Issiah Nixon is a 2020 running back from Fort Bend (Texas) Elkins.,,,,,,,,,,,,,,,,
202001671,Father Jeff Kopp was a sixth round draft pick out of USC and played five years in the NFL. Older sister Makenzi is on the track team at Georgia.,,,,,,,,,,,,,,,,
202001672,"Grant Starck is a 6-5, 280-pound Offensive Tackle from Springfield, OR.",,,,,,,,,,,,,,,,
202001673,"Career: Three-year letterman who has appeared in 34 career games making 13 starts (2/’21, 7/’22, 4/’23) … Booked 99 stops (63 solo) to go along with 6.5 TFLs (-15 yards) and 0.5 sacks (-4 yards) … Registered at least one stop in 31 of 34 games (multiple 21 times) … Forced three fumbles (all in 2021) … Picked off two career passes returning them for a total of six yards …. Credited with eight pass breakups and one quarterback hurry.2023: Started four games during fourth year with the program (at Michigan, Marshall, at Appalachian State, at Rice) before suffering season-ending injury … Booked total 10 tops (six solo) … Tallied season-high six tackles against Marshall (three solo) … Picked off second career pass at Rice (no return) … Credited with two pass breakups (Michigan and Marshall) … Registered multiple tackles in a game twice (6/Marshall, 2/Rice).2022: Started seven of 13 games for the Pirates … Logged 520 total snaps (472 defense, 48 special teams) … Stood fifth on the team with 55 stops (36 solo) … Registered with 2.5 TFLs (-3 yards) … Credited with five pass breakups which was tied for second on the squad … Recorded a career-high with 10 tackles against Temple (four solo) and BYU (six) … Booked at least one tackle 11 of 13 contests (multiple nine times) … Also added nine-tackle performances against NC State and Campbell … Credited with TFLs against NC State (1.0/-1 yard), Campbell (1.0/-1 yard), BYU (0.5/-1 yard) … Recorded pass breakups against NC State (2), Campbell (1), Cincinnati (1), Temple (1) …2021: Appeared in 11 games making a pair of starts (Temple, Memphis) … Tallied 24 stops (16 solo) … Credited with 2.5 TFLs (-8 yards) and a half sack (-4 yards) … Booked at least one tackle in 10 of 11 games (multiple six times) … Tallied career-best five stops (four solo) against South Florida … Forced three fumbles on the season to lead the team (Marshall, Houston, South Florida) … Credited with a pass breakup against Temple and a quarterback hurry versus Tulane … First career interception came against South Florida (6-yard return).2020: Appeared in seven of nine ECU games during the pandemic-shortened season … Made collegiate debut at Georgia State registering one stop (assisted) … Recorded 10 stops (five solo) with 1.5 TFLs (-4 yards) … Tallied at least one stop in six of seven games (multiple three times) … Booked career-best three tackles (one solo) with a half TFL (-3 yards) at Tulane ... Credited with first career TFL (-1 yard) at USF … Nine of 10 tackles have come on rushing plays in 2020.High School: A three-time all-state selection as a prep standout for the Bulldogs … Netted 17 career interceptions at Berwick Area High School (22 overall, including five as a freshman at Southern Columbia Area High School) … Key member of Frank Sheptock’s program that rolled to a 9-3 mark (3-1 conference) in 2019 … Played on both sides of the ball as a senior free safety and wide receiver … Defensively, Berwick allowed just 139 points in 12 contests (11.6 ppg) … Picked off seven passes, one of which was returned for a touchdown, as a junior to help Bulldogs to a 9-3 ledger and a defensive scoring average of 11.7 points per outing) … Offensively, had 23 receptions for 214 yards and 2 TDs, and added 197 rushing yards and five ground scores … Topped the Wyoming Valley Conference (WVC) with seven interceptions as a sophomore during first full season in Berwick’s program … Contributed to the Bulldogs’ 10-3 campaign in 2017 as a split end on offense, a free safety on defense and as a returner on special teams (scored on a punt return) … Also returned two interceptions for touchdowns during Berwick’s season that was capped by a PIAA (Class 4A) playoff appearance … Two-way performer for coach James Roth at Southern Columbia Area High School as a freshman … Helped Tigers post a 15-1 overall record (5-0 conference), which included a deep Class 2A postseason run against South Williamsport (W/49-21), Schuylkill Haven (W/20-5), Ligonier Valley (W/31-27) and Steel Valley (L/49-7) … Defensively, stood second on unit with 115 tackles (46 solo) and added 4.0 TFLs while playing in all 16 contests … Booked 10 or more stops in four games - 18 vs. Schuykill Haven, 13 vs. South Williamsport, 11 vs. Mount Carmel and 10 vs. Hughesville - and had at least three hits in all 16 outings … Also credited with a half sack, netted five interceptions (one touchdown return), nine pass breakups, two forced fumbles and one recovery …  Offensively, had three carries for 10 yards, while on special teams, returned two kickoffs for 38 yards … A three-star prospect according to 247Sports.com, Rivals.com and ESPN.com … Stood among the Top 25 (overall) recruits in the state of Pennsylvania per all three recruiting outlets (highest was No. 8 by Rivals.com) … Reportedly had 25-plus offers, which included Air Force, Army, Iowa State and Old Dominion, and was also recruited by Michigan State and Syracuse among others.Personal: Father Aaron also transferred into Coach Sheptock's Berwick Area High School program (from Shamokin High School in 1991) … Sister attends ECU and two aunts reside in the Raleigh-Durham area ... Earned undergraduate degree in business management from East Carolina (spring 2023) ... Currently enrolled in recreation & parks management program at ECU ... Committed to East Carolina on June 21, 2019 … Early enrollee in January of 2020 … Named to 2020 AAC All-Academic Team … Earned inclusion on fall 2022 ECU Director of Athletics Honor Roll.",,,,,,,,,,,,,,,,
202001674,"Samuel Peacock is a 6-6, 265-pound Offensive Tackle from Gig Harbor, WA.",,,,,,,,,,,,,,,,
202001675,"Michael Frogge is a 6-4, 215-pound Tight End from Greensboro, NC.",,,,,,,,,,,,,,,,
202001676,"Kaden Moore is a 6-3, 305-pound Offensive Tackle from Bethlehem, PA.",,,,,,,,,,,,,,,,
202001677,"Todd Bumphis is a Safety from Toledo, OH.",,,,,,,,,,,,,,,,
202001678,Dontae Fleming is a 2020 receiver from Reserve  (La.) East St. John.,,,,,,,,,,,,,,,,
202001679,"Mac Harris is a 6-0, 199-pound Safety from The Villages, FL.",,,,,,,,,,,,,,,,
202001680,2017: Was a second-team all-district selection at TE as a sophomore at Houston LamarPERSONAL: Is the son of former Texas A&M and Detroit Lions LB Reggie Brown,,,,,,,,,,,,,,,,
202001681,"Luke Floriea is a Wide Receiver from Mentor, OH.",,,,,,,,,,,,,,,,
202001682,"Ryan Brandt is a 6-1, 202-pound Safety from Angola, IN.",,,,,,,,,,,,,,,,
202001683,2018: Was a unanimous first-team all-district selection as a junior,,,,,,,,,,,,,,,,
202001684,"Tyrece Edwards is a Defensive End from Knoxville, TN.",,,,,,,,,,,,,,,,
202001685,"Sammy Solomon is a 6-3, 290-pound Defensive Tackle from Exeter, PA.",,,,,,,,,,,,,,,,
202001686,"Christopher Townsel is a Cornerback from Deerfield Beach, FL.",,,,,,,,,,,,,,,,
202001687,"Corey Thornton is a Cornerback from Miami, FL.",,,,,,,,,,,,,,,,
202001688,"Justin Pinkney is a 5-11, 170-pound Athlete from Gardena, CA.",,,,,,,,,,,,,,,,
202001689,"Keyshawn Woodyard is a 6-1, 173-pound Wide Receiver from Mobile, AL.",,,,,,,,,,,,,,,,
202001690,"Joseph Perkins is a 6-0, 180-pound Safety from Madison, MS.",,,,,,,,,,,,,,,,
202001691,Cauren Lynch is a 2020 RB from Parish Episcopal School in Dallas.,,,,,,,,,,,,,,,,
202001692,"David Laney is a 6-0, 170-pound Athlete from Highland Springs, VA.",,,,,,,,,,,,,,,,
202001693,"Quadric Bullard is a 6-0, 161-pound Cornerback from Hollywood, FL. He has committed to UCF Knights.",,,,,,,,,,,,,,,,
202001694,"Patrick Barnett is a 6-6, 305-pound Offensive Tackle from Key West, FL. He has committed to UCF Knights.",,,,,,,,,,,,,,,,
202001695,"Luke Akers is a 6-2, 170-pound Kicker from Brentwood, TN.",,,,,,,,,,,,,,,,
202001696,"Nathaniel James is a 6-0, 250-pound Defensive Tackle from Avon, IN.",,,,,,,,,,,,,,,,
202001697,"Keyshawn Hunter is a Defensive Tackle from Washington, DC.",,,,,,,,,,,,,,,,
202001698,"Devin Chandler is a 6-foot, 171-pound Wide Receiver from Arlington, TN.",,,,,,,,,,,,,,,,
202001699,"Tyler Beverett is a 6-2, 195-pound Pro-Style Quarterback from Scottsdale, AZ.",,,,,,,,,,,,,,,,
202001700,"Chancellor Bright is a Wide Receiver from Shelbyville, TN.",,,,,,,,,,,,,,,,
202001701,"Kyle Arnoldi is a 6-4, 270-pound Offensive Guard from Commerce Township, MI.",,,,,,,,,,,,,,,,
202001702,"Football and track and field athlete (200 meters, long jump, triple jump, relays).",,,,,,,,,,,,,,,,
202001703,2018: Was a TSWA Class 4A second-team all-state selection as a junior,,,,,,,,,,,,,,,,
202001704,"Ralph Donaldson is a 6-1, 180-pound Safety from Franklin, MI.",,,,,,,,,,,,,,,,
202001705,"Fiva Tulafale is a 6-3, 215-pound Inside Linebacker from Waipahu, HI.",,,,,,,,,,,,,,,,
202001706,"Ugonna Nnanna is a 6-4, 265-pound Offensive Tackle from Arlington, TX.",,,,,,,,,,,,,,,,
202001707,Played at Mesquite (Texas) Horn prior to his senior season.,,,,,,,,,,,,,,,,
202001708,2018: Second-team all-district selection as a junior.,,,,,,,,,,,,,,,,
202001709,"Marquese Allen-Patmon is a 6-2, 180-pound Safety from San Diego, CA.",,,,,,,,,,,,,,,,
202001710,"Luke Marion is a Safety from Tualatin, OR.  Father, Brock Marion, played safety in the NFL",,,,,,,,,,,,,,,,
202001711,"HIGH SCHOOL: Four-year varsity letterwinner, played his senior season at Joe T. Robinson High School in Little Rock, Arkansas … Led the team with a whopping 171 total tackles as a senior in 2019, producing 105 solo stops and 47 tackles for loss, including 11 sacks … Also forced four fumbles and recovered another, while rushing for 107 yards, passing for 60 and catching a pass for 14 yards on the offensive side of the ball … Helped the Senators to a 14-1 record and No. 7 ranking in the state, rolling to the 2019 4A State Championship behind a 56-28 victory in the title game … Played quarterback at Glen Rose High School, completing 84-of-190 passes as a junior for 1,331 yards and 11 touchdowns, while rushing 124 times for 735 yards and 14 touchdowns … Led the Beavers to a 9-2 record and a second round berth in the 2018 Texas State 3A tournament … CHOSE ARKANSAS OVER: Army, Oklahoma, Memphis, Navy, Texas Tech and others.PERSONAL: JT Towers … Born July 4, 2001 … Son of Christy & Roger Rasico and Melanie & Jim Towers … Brother to Ty.",,,,,,,,,,,,,,,,
202001712,"Caelen Carson is a Cornerback from Waldorf, MD.",,,,,,,,,,,,,,,,
202001713,Won the 2019 Kansas 3A/2A/1A wrestling championship in the 285-pound weight class.,,,,,,,,,,,,,,,,
202001714,"Ra'Mello Dotson is a Cornerback from Daytona Beach, FL.",,,,,,,,,,,,,,,,
202001715,"Tahjay Moore is a 6-6, 215-pound Tight End from New Brunswick, NJ.",,,,,,,,,,,,,,,,
202001716,"Richard Agyekum is a 5-9, 155-pound Cornerback from Netherlands, NETH.",,,,,,,,,,,,,,,,
202001717,"Adam Chaney is a 6-2, 211-pound Athlete from Saraland, AL.",,,,,,,,,,,,,,,,
202001718,"Jack Olsen is a Kicker from Wheaton, IL.",,,,,,,,,,,,,,,,
202001719,Started his career at quarterback before moving to wide receiver. Entered the portal after the 2022 season.,,,,,,,,,,,,,,,,
202001720,Started at ODU as a three-star signee before transferring to Independence CC in Kansas for the 2023 class. Three years of eligibility remaining. Competed in a limited capacity in track and field in high school.,,,,,,,,,,,,,,,,
202001721,"Riley Keller is a 6-0, 185-pound Pro-Style Quarterback from Toledo, OH.",,,,,,,,,,,,,,,,
202001722,Connor Finucane is a 2020 DT from Baton Rouge (La.) Catholic.,,,,,,,,,,,,,,,,
202001723,"Davonte Brown is a 6-2, 160-pound Cornerback from Fort Lauderdale, FL. He is the son of former Miami cornerback Selwyn Brown.",,,,,,,,,,,,,,,,
202001724,"Justin Abraham is a 6-1, 233-pound Inside Linebacker from Hartsville, SC.",,,,,,,,,,,,,,,,
202001725,"Plays football and competes in track and field (100m, 200m, 4x100 relay, long jump).2018: Played his junior season at Bullard (Texas) Brook Hill School.2017: Played as a sophomore at Tyler (Texas) Chapel Hill.",,,,,,,,,,,,,,,,
202001726,"Micah Soliai Howlett is a 6-3, 295-pound guard from Kahuku, HI.",,,,,,,,,,,,,,,,
202001727,"Spring 2018: Recorded a personal best 6-foot, 2-inch high jump.",,,,,,,,,,,,,,,,
202001728,"Levontae Camiel is a 6-3, 215-pound Outside Linebacker from Lake City, FL.",,,,,,,,,,,,,,,,
202001729,"Josh Wilson is a 6-0, 205-pound Outside Linebacker from Draper, UT. His brother, Zachary, is the starting quarterback at BYU and his father, Mike, played defensive tackle at Utah in the mid 1990s.",,,,,,,,,,,,,,,,
202001730,"Dahlin Mesake is a Outside Linebacker from Henderson, NV.",,,,,,,,,,,,,,,,
202001731,"Brian Battie is a 5-6, 159-pound Running Back from Bradenton, FL.",,,,,,,,,,,,,,,,
202001732,"Shon Brown is a 6-2, 220-pound Outside Linebacker from Clover, SC.",,,,,,,,,,,,,,,,
202001733,Chris Hightower is a 2020 athlete from Little Rock (Ark.) Christian Academy.,,,,,,,,,,,,,,,,
202001734,2018: Was named the District 7-2A-I MVP as a junior; Was a third-team Class 2A TSWA all-state selection at QB,,,,,,,,,,,,,,,,
202001735,"Bryce Johnson-Maith is a 6-5, 200-pound Weak-Side Defensive End from Bethesda, MD.",,,,,,,,,,,,,,,,
202001736,"Trayvon Rudolph is an Athlete from Crete, IL.",,,,,,,,,,,,,,,,
202001737,"Michael West is a 6-5, 210-pound Weak-Side Defensive End from Saint Louis, MO.",,,,,,,,,,,,,,,,
202001738,"Markell Samuel is an Athlete from Fayetteville, NC.",,,,,,,,,,,,,,,,
202001739,Varisty basketball,,,,,,,,,,,,,,,,
202001740,"James Bomba is a 6-5, 225-pound Tight End from Bloomington, IN.",,,,,,,,,,,,,,,,
202001741,Monte Williams is a 2020 offensive lineman from Mesquite (Texas) Horn.,,,,,,,,,,,,,,,,
202001742,Trey Phillippi is a 2020 offensive tackle from Montgomery (Texas) High School.,,,,,,,,,,,,,,,,
202001743,"Quincy Vaughn is a 6-3.5, 225-pound Pro-Style Quarterback from Ontario, OR.",,,,,,,,,,,,,,,,
202001744,"Rico Small is a 6-0, 170-pound Wide Receiver from Willoughby, OH. He is ranked No. 1848 in the country by 247Sports.Small is the No. 67 recruit in Willoughby, OH (44094) State and is the No. 240 Wide Receiver in the nation.Small has a 247Sports rating of 82, making him a 3-star prospect.He has committed to Eastern Michigan Eagles.",,,,,,,,,,,,,,,,
202001745,"Amore Morrison is a Defensive End from Virginia Beach, VA.",,,,,,,,,,,,,,,,
202001747,"Codey Martin is a 5-11, 175-pound Cornerback from Hoover, AL.",,,,,,,,,,,,,,,,
202001748,"Quavon Matthews is a 5-11, 165-pound Wide Receiver from Largo, FL.",,,,,,,,,,,,,,,,
202001751,"Shawn Collins is a 6-5, 205-pound Tight End from Montclair, NJ.",,,,,,,,,,,,,,,,
202001752,"Randy Anderson is a 5-11, 171-pound Athlete from Oxford, MS.",,,,,,,,,,,,,,,,
202001753,"Weston Wallace is an Offensive Tackle from Eatonton, GA.",,,,,,,,,,,,,,,,
202001754,"Jackson Satterwhite is a 6-5, 285-pound Offensive Tackle from Miami, OK.",,,,,,,,,,,,,,,,
202001755,2018: Named the District 11-5A-I Co-Defensive Lineman of the Year as a junior.,,,,,,,,,,,,,,,,
202001756,"Zihenryon Perry is a 6-2, 220-pound Inside Linebacker from Brandon, MS.",,,,,,,,,,,,,,,,
202001757,"Jai'mari Herbert is a 6-3, 255-pound Athlete from Fort Lauderdale, FL.",,,,,,,,,,,,,,,,
202001758,"Kevin Kalonji is an Offensive Tackle from Washington, DC.",,,,,,,,,,,,,,,,
202001759,"Michael Leone is a 6-6, 270-pound Offensive Tackle from Princeton, NJ. He has committed to Yale Bulldogs.",,,,,,,,,,,,,,,,
202001760,"Gerand Turner is a 5-11, 190-pound Wide Receiver from Miami, FL.",,,,,,,,,,,,,,,,
202001761,2017: Second-team all-district selection as a sophomore,,,,,,,,,,,,,,,,
202001762,"Daniel Hishaw Jr. is an Athlete from Moore, OK.",,,,,,,,,,,,,,,,
202001763,"Mikele Colasurdo is a 6-1, 210-pound Pro-Style Quarterback from Inman, SC.",,,,,,,,,,,,,,,,
202001764,"Tailique Williams is an Athlete from Hamilton, GA.",,,,,,,,,,,,,,,,
202001765,"Onuma Dieke is a 6-4, 185-pound Wide Receiver from Atlanta, GA. He has committed to Massachusetts Minutemen.",,,,,,,,,,,,,,,,
202001766,"Jerrold Pough is a 6-0, 170-pound Safety from Hollywood, FL.",,,,,,,,,,,,,,,,
202001767,Declared for NFL Draft after 2022 season. Ranks third on ECU's all-time career rushing list.,,,,,,,,,,,,,,,,
