player_id,hs_athletic_background,skill_1,skill_1_rating,skill_2,skill_2_rating,skill_3,skill_3_rating,skill_4,skill_4_rating,skill_5,skill_5_rating,skill_6,skill_6_rating,skill_7,skill_7_rating,skill_8,skill_8_rating
201600721,"Freddie Pinder is a 6-5, 195-pound Wide Receiver from Miami, FL.",,,,,,,,,,,,,,,,
201600722,"Jimmie Taylor is a 6-3, 220-pound Weak-Side Defensive End from Jacksonville, NC.",,,,,,,,,,,,,,,,
201600723,"Fua Pututau is a 6-3, 231-pound Weak-Side Defensive End from Salt Lake City, UT.",,,,,,,,,,,,,,,,
201600724,"Jango Glackin is an Outside Linebacker from Lebanon, OH.",,,,,,,,,,,,,,,,
201600725,"De'Jon Harris is a 6-0, 230-pound Inside Linebacker from Marrero, LA.",,,,,,,,,,,,,,,,
201600726,"Josh Metellus is a 6-0, 187-pound Safety from Hollywood, FL.",,,,,,,,,,,,,,,,
201600727,"Jordan Iosefa is a 6-2, 225-pound Inside Linebacker from Honolulu, HI. He has committed to USC Trojans.",,,,,,,,,,,,,,,,
201600728,"Stephen Spanellis is a 6-5, 295-pound Offensive Tackle from Baltimore, MD.",,,,,,,,,,,,,,,,
201600729,"Tobias Little is a 6-1, 228-pound Inside Linebacker from Atlanta, GA.",,,,,,,,,,,,,,,,
201600730,Rated the No. 19 tight end in the country and the No. 22 player in the state of Illinois by ESPN • Also considered the No. 28 tight end and the No. 16 player in Illinois by Rivals • Ranked the No. 2 tight end in Illinois and the No. 25 tight end nationally by Scout • Caught 13 passes for 360 yards and five TDs as a junior at Carmel Catholic • PrepStar All-Midwest Region • Had his senior season cut short due to a foot injury • Coached by Andy Bitto.,,,,,,,,,,,,,,,,
201600731,"Tobias Gilliam is a 6-1, 185-pound Cornerback from Dayton, OH.",,,,,,,,,,,,,,,,
201600732,"Kingston Davis is a 6-1, 245-pound running back from Prattville, AL.",,,,,,,,,,,,,,,,
201600733,"2019 - Junior YearAppeared in 12 games along the defensive line and on special teams • Registered 16 tackles, three hurries and 1.5 sacks • Had a season-high five tackles against App State • Came up with one sack and three tackles at Wake Forest • Had two tackles against both Clemson and Mercer • Had a single tackle and a half TFL at Pitt • Registered three tackles against Temple in the Military Bowl.2018 - Sophomore YearAppeared in six games along the defensive line and on special teams • Tallied 10 tackles and a half TFL on the season • Posted six tackles and a half TFL against Georgia Tech • Recorded single-tackle games versus Miami, Virginia, Duke and Western Carolina.2017 - Redshirt Freshman YearAppeared in nine games at defensive end • Finished the season with eight tackles and a sack • Also forced a fumble, had one quarterback hurry and one pass breakup • Finished with three solo tackles, a sack and a forced fumble at Georgia Tech • Redshirted in 2016.",,,,,,,,,,,,,,,,
201600734,"Hamilcar Rashed is a 6-4, 210-pound Weak-Side Defensive End from Laveen, AZ. He has committed to Oregon State Beavers.",,,,,,,,,,,,,,,,
201600735,"Avery McCall is a 6-0, 184-pound Dual-Threat Quarterback from Dillon, SC.",,,,,,,,,,,,,,,,
201600736,"Zy'Aire  Hughes is a 6-1, 180-pound Dual-Threat Quarterback from Paducah, KY. He has committed to Kentucky Wildcats.",,,,,,,,,,,,,,,,
201600737,"Andrew Lee is a 5-11, 220-pound Athlete from Folkston, GA.",,,,,,,,,,,,,,,,
201600738,"Jaylen Miller is a 6-4, 285-pound Offensive Tackle from Jacksonville, FL.",,,,,,,,,,,,,,,,
201600739,"Jamil Dukes is a 6-4, 280-pound Defensive Tackle from Mooresville, NC. He is ranked No. 356 in the country by 247Sports.Dukes is the No. 14 recruit in Mooresville, NC (28115) State and is the No. 29 Defensive Tackle in the nation.Dukes has a 247Sports rating of 89, making him a 3-star prospect.",,,,,,,,,,,,,,,,
201600740,"Dedric Mills is a 6-0, 200-pound Running Back from Waycross, GA.",,,,,,,,,,,,,,,,
201600741,"Zach Gilbert is a 6-2, 260-pound Stong-Side Defensive End from Charlotte, NC.As a junior, Gilbert rushed for 206 yards and 13 touchdowns.On defense, Gilbert racked up 15.5 sacks, 26 tackles for loss, four forced fumbles, two fumble recoveries, 20 quarterback hurries and two touchdowns.",,,,,,,,,,,,,,,,
201600742,"Tucker Scott is a 6-5, 260-pound Offensive Tackle from San Clemente, CA.",,,,,,,,,,,,,,,,
201600743,"Tariqious Tisdale is a 6-5, 280-pound defensive end from Lexington, TN.",,,,,,,,,,,,,,,,
201600744,"Jachai Polite is a 6-3, 250-pound Strong-Side Defensive End from Daytona Beach, FL.",,,,,,,,,,,,,,,,
201600745,Named ASWA First Team All-State as a junior in 7A...,Strength,7,Body Quickness,7,Feet,7,Punch,6,Lateral Movement,6,Pass Blocking,6,Size,6,Run Blocking,5
201600746,"Sam Noyer is a 6-4, 200-pound Dual-Threat Quarterback from Beaverton, OR.",,,,,,,,,,,,,,,,
201600747,"Sam Heckel is a 6-5, 265-pound Offensive Tackle from Waukesha, WI.",,,,,,,,,,,,,,,,
201600748,"Jaquwan Nelson is a 6-4, 230-pound Weak-Side Defensive End from Fort Lauderdale, FL. He has committed to Syracuse.",,,,,,,,,,,,,,,,
201600749,"Joe Goff is a 6-5, 265-pound Offensive Guard from Alexandria, VA.",,,,,,,,,,,,,,,,
201600750,"Luke Campbell is an Offensive Tackle from Lewis Center, OH.",,,,,,,,,,,,,,,,
201600751,"Jordan Mack is a Athlete from Norcross, GA.",,,,,,,,,,,,,,,,
201600752,"Antone Williams is a 5-11, 161-pound Cornerback from Atlanta, GA.",,,,,,,,,,,,,,,,
201600753,"Isaiah Hayes is a defensive back from Calabasas, CA. He is the son of former NFL safety Chris Hayes Sr. and the brother of Oregon State cornerback Chris Hayes Jr.",,,,,,,,,,,,,,,,
201600754,Jeremy was on the 1st team All-District.,,,,,,,,,,,,,,,,
201600755,"Cole Blackman is a 6-2, 190-pound Wide Receiver from Glen Allen, VA. He has committed to Virginia Cavaliers.",,,,,,,,,,,,,,,,
201600756,"Greg Eiland is a 6-6, 280-pound Offensive Tackle from Philadelphia, MS.",,,,,,,,,,,,,,,,
201600757,"Rodarius Williams is a 6-0, 170-pound Cornerback from Shreveport, LA.",,,,,,,,,,,,,,,,
201600758,"Rodjay Burns is a 6-2, 175-pound Wide Receiver from Louisville, KY.",,,,,,,,,,,,,,,,
201600759,"Amandre Williams is a 6-2, 235-pound Weak-Side Defensive End from Covington, WA.",,,,,,,,,,,,,,,,
201600760,"Drue Chrisman is a Punter from Cincinnati, OH.",,,,,,,,,,,,,,,,
201600761,"Cameron Kolwich is a 6-5, 270-pound Offensive Guard from West Bloomfield, MI.",,,,,,,,,,,,,,,,
201600762,"Corey Sutton is a 6-4, 183-pound Wide Receiver from Cornelius, NC.",,,,,,,,,,,,,,,,
201600763,"Zach Sandwisch is a Outside Linebacker from Elmore, OH.",,,,,,,,,,,,,,,,
201600764,"Deon  McIntosh is a 5-11, 195-pound Running Back from Fort Lauderdale, FL. played at Notre Dame as true freshman in 2017, transferred to East Mississippi CC in 2018 and now is making hay at Washington State.",,,,,,,,,,,,,,,,
201600765,"Ben Skowronek is a 6-3, 195-pound Wide Receiver from Fort Wayne, IN.",,,,,,,,,,,,,,,,
201600766,"Cameron Dantzler is a 6-2, 153-pound Wide Receiver from Hammond, LA.",,,,,,,,,,,,,,,,
201600767,"Greg Simmons is a 6-2, 225-pound Inside Linebacker from Fort Pierce, FL.",,,,,,,,,,,,,,,,
201600768,"Keaton Torre is a 6-3, 195-pound Pro-Style Quarterback from Edmond, OK.",,,,,,,,,,,,,,,,
201600769,"Davion Curtis is a 5-11, 180-pound Wide Receiver from Temple, TX.",,,,,,,,,,,,,,,,
201600770,"Jack Stoll is a 6-5, 225-pound Tight End from Aurora, CO.",,,,,,,,,,,,,,,,
201600771,"Bo Peek is a 6-2, 300-pound Defensive Tackle from Tampa, FL.",,,,,,,,,,,,,,,,
201600772,"Julian Jones is a 6-4, 230-pound Weak-Side Defensive End from Hazel Green, AL.",,,,,,,,,,,,,,,,
201600773,"Corey Tipsword is a 6-3, 330-pound Defensive Tackle from Norman, OK.",,,,,,,,,,,,,,,,
201600774,"Jeriko Morris is a 6-4, 185-pound Athlete from Crystal Springs, MS.",,,,,,,,,,,,,,,,
201600775,"Traveon Beck is a 5-10, 170-pound Safety from Bellflower, CA.",,,,,,,,,,,,,,,,
201600776,"Jordan Loveni Iosefa is a 6-2, 216-pound Outside Linebacker from Honolulu, HI.",,,,,,,,,,,,,,,,
201600777,"Stefan Claiborne is a 6-1, 168-pound Safety from Clinton Township, MI.",,,,,,,,,,,,,,,,
201600778,2014: Was a first-team all-district selection as a junior.,,,,,,,,,,,,,,,,
201600779,"Korey  Banks  is a 6-0, 170-pound Cornerback from Tyrone, GA.",,,,,,,,,,,,,,,,
201600780,"Elijah Deveaux is a 6-1, 200-pound Athlete from Charlotte, NC. Father, Glenn Deveaux, played at Pittsburgh and later with the Seattle Seahawks.",,,,,,,,,,,,,,,,
201600781,"Keon Howard is a 6-1, 205-pound Dual-Threat Quarterback from Laurel, MS.",,,,,,,,,,,,,,,,
201600782,"Steven Frank is a 6-3, 209-pound Pro-Style Quarterback from Oswego, IL.",,,,,,,,,,,,,,,,
201600783,"Malik Walker is a 6-1, 260-pound strongside defensive end from Montezuma, Ga.",,,,,,,,,,,,,,,,
201600784,"Willie Baker is a 6-4, 200-pound Weak-Side Defensive End from Livonia, LA.",,,,,,,,,,,,,,,,
201600785,"JJ Givens is a 6-2, 170-pound Athlete from Mechanicsville, VA.",,,,,,,,,,,,,,,,
201600786,"Kamal Martin is a Dual-Threat Quarterback/Athlete from Burnsville, MN.",,,,,,,,,,,,,,,,
201600787,"Nik Urban is a 6-4, 280-pound Offensive Guard from Willoughby, OH.",,,,,,,,,,,,,,,,
201600788,"Spencer Kanz is a 6-6, 275-pound Offensive Tackle from Luxemburg, WI.",,,,,,,,,,,,,,,,
201600789,"Dakota Holtzclas is a 6-7, 215-pound Tight End from Columbus, OH. Holtzclas has a 247Sports rating of 85, making him a 3-star prospect.",,,,,,,,,,,,,,,,
201600790,"Derrion Grim is a 5-9, 160-pound Wide Receiver from Stockton, CA.",,,,,,,,,,,,,,,,
201600791,"Andre Polk is a 6-3, 190-pound Wide Receiver from Fort Myers, FL.",,,,,,,,,,,,,,,,
201600792,"James Valdez is a 6-0, 175-pound Cornerback from Santee, SC.",,,,,,,,,,,,,,,,
201600793,"Pookie Maka is a 6-4, 195-pound Weak-Side Defensive End from Woods Cross, UT. Maka has a 247Sports rating of 86, making him a 3-star prospect.",,,,,,,,,,,,,,,,
201600794,"Jay Jones is a 6-1, 190-pound Athlete from McCalla, AL.",,,,,,,,,,,,,,,,
201600795,"Drew Kobayashi is a 6-2, 180-pound Wide Receiver from Honolulu, HI.",,,,,,,,,,,,,,,,
201600796,"Tyliek Raynor is a 5-11, 175-pound Running Back from Philadelphia, PA.",,,,,,,,,,,,,,,,
201600797,"Romello Harris is a 5-10, 170-pound Running Back from Tulare, CA.",Explosiveness,7,Change of Direction,7,Feet,7,Vision,6,Tackle Breaking,6,Power,6,Speed,6,Build,6
201600798,1st Team All-Shore,,,,,,,,,,,,,,,,
201600799,"Kareem Felder is a Cornerback from Baltimore, MD.",,,,,,,,,,,,,,,,
201600801,2014: Was a second-team all-district selection at TE as a junior,,,,,,,,,,,,,,,,
201600802,"Christian Colon is a 6-3, 309-pound defensive tackle from Charlotte, NC.",,,,,,,,,,,,,,,,
201600803,"Phillip Howard is a 5-11, 185-pound Athlete from Minneapolis, MN.",,,,,,,,,,,,,,,,
201600804,"James  Wiggins is a 5-11, 180-pound Cornerback from Homestead, FL. He has committed to Miami Hurricanes.",,,,,,,,,,,,,,,,
201600805,"Adrian Hardy is a 6-3, 185-pound Wide Receiver from Houston, TX.",,,,,,,,,,,,,,,,
201600806,"Teton Saltes is a 6-6, 240-pound Strong-Side Defensive End from Albuquerque, NM.",,,,,,,,,,,,,,,,
201600807,"Chandler Reeves is a 6-6, 255-pound Offensive Tackle from Mcdonough, GA.",,,,,,,,,,,,,,,,
201600808,"Jon Randall Belton is a 6-2, 185-pound Dual-Threat Quarterback from West Monroe, LA.",,,,,,,,,,,,,,,,
201600809,"Harry Ballard is a 6-2, 180-pound Wide Receiver from Florissant, MO.",,,,,,,,,,,,,,,,
201600810,"Desmond  Bland is a 6-4, 270-pound Offensive Guard from Flossmoor, IL.",,,,,,,,,,,,,,,,
201600811,"Freddie Holly is a 6-0, 200-pound Running Back from Riverside, CA.",,,,,,,,,,,,,,,,
201600812,"Marshal Nathe is a 6-3, 270-pound Offensive Guard from Peoria, AZ.",,,,,,,,,,,,,,,,
201600813,HIGH SCHOOL: 2014: Was a first-team all-district selection as a juniorPERSONAL: He is the brother of former Oklahoma State linebacker Shaun Lewis.,,,,,,,,,,,,,,,,
201600814,"Eyioma Uwazurike is a 6-6, 254-pound Strong-Side Defensive End from Southfield, MI.",,,,,,,,,,,,,,,,
201600815,"Bricen Garner is a 6-1, 158-pound Safety from Pittsburgh, PA.",,,,,,,,,,,,,,,,
201600816,"Loa Kaufusi is a 6-4, 215-pound Tight End from Salt Lake City, UT.",,,,,,,,,,,,,,,,
201600817,"Emmanuel Walker is a 6-4, 250-pound Weak-Side Defensive End from Santee, SC. He was ranked No. 757 in the country by 247Sports coming out of high school.Walker was the No. 11 recruit in Santee, SC (29142) State and was ranked the No. 48 Weak-Side Defensive End in the nation.Walker has a 247Sports rating of 86, making him a 3-star prospect.",,,,,,,,,,,,,,,,
201600818,"J.J. Molson is a 6-1, 190-pound Kicker from Sainte-Anne-de-Bellevue, QC.",,,,,,,,,,,,,,,,
201600819,"Kelvin Lucky is a 6-6, 228-pound Tight End from Elmore, AL.",,,,,,,,,,,,,,,,
201600820,"Chris Hughes is a 6-5, 260-pound Offensive Tackle from Harker Heights, TX. He's the younger brother of Texas signees Camrhon Hughes (2012) and Naashon Hughes (2013).",,,,,,,,,,,,,,,,
201600821,"Matthew Laris is a 6-4, 210-pound Wide Receiver from Bellevue, WA.",,,,,,,,,,,,,,,,
201600822,"Jake Burton is a 6-6, 230-pound Weak-Side Defensive End from El Cajon, CA.",,,,,,,,,,,,,,,,
201600823,"Caron Baham is a 6-1, 190-pound Athlete from Marrero, LA.",,,,,,,,,,,,,,,,
201600824,"Johnny Maea is a 6-4, 280-pound Offensive Guard from Salt Lake City, UT. Maea has a 247Sports rating of 85, making him a 3-star prospect.",,,,,,,,,,,,,,,,
201600825,"Riley Lees is a 6-1, 185-pound Dual-Threat Quarterback from Libertyville, IL.",,,,,,,,,,,,,,,,
201600826,"Camryn Bynum is a 5-10, 170-pound Cornerback from Corona, CA.",,,,,,,,,,,,,,,,
201600827,"Tyler Brown is a 6-5, 325-pound Offensive Guard from Lexington, OK.",,,,,,,,,,,,,,,,
201600828,"Darius Harper is a 6-8, 268-pound Offensive Tackle from Springfield, OH.",,,,,,,,,,,,,,,,
201600829,"Terrance Harris is a 6-4, 190-pound Inside Linebacker from Birmingham, AL.",,,,,,,,,,,,,,,,
201600830,"Ranked the No. 1 safety in the state of Maryland and the No. 34 safety in the country by Scout • Also considered the No. 18 player overall in Maryland by Rivals and No. 23 by 247sports • PrepStar All-Atlantic Region • Helped lead Potomac to a 10-3 mark as a senior • Posted 78 tackles (42 solo), four INTs and four pass breakups • High school head coach was Ronnie Crump.",,,,,,,,,,,,,,,,
201600831,"Brandon Adams is a 6-1, 322-pound Defensive Tackle from Brentwood, TN.",,,,,,,,,,,,,,,,
201600832,"Shaka Toney is a 6-3, 210-pound Weak-Side Defensive End from Philadelphia, PA.",,,,,,,,,,,,,,,,
201600833,"Dylan Parham is a 6-4.5, 198-pound Pro-Style Quarterback from Raleigh, NC. He has committed to N.C. State Wolfpack.",,,,,,,,,,,,,,,,
201600834,"Barrington Wade is a 6-1, 200-pound Running Back from Skokie, IL.",,,,,,,,,,,,,,,,
201600835,Giovanni was on the 2nd team All-District,,,,,,,,,,,,,,,,
201600836,"Sonny Abramson is a 6-2, 190-pound Pro-Style Quarterback from Sparta, NJ.",,,,,,,,,,,,,,,,
201600837,"Malik Antoine is a 5-10, 175-pound Safety from Baton Rouge, LA.",,,,,,,,,,,,,,,,
201600838,"Kevin McCrary is a 6-1, 265-pound Defensive Tackle from Daytona Beach, FL.",,,,,,,,,,,,,,,,
201600839,"Trey  Sneed  is a 5-11, 198-pound Running Back from Orange Park, FL.",,,,,,,,,,,,,,,,
201600840,"Collin Hill is a 6-3, 185-pound Pro-Style Quarterback from Roebuck, SC.",,,,,,,,,,,,,,,,
201600841,"Rated the No. 38 outside linebacker in the country by Scout and ESPN • Ranked the No. 4 outside linebacker in Florida by Scout • Also considered the No. 48 outside linebacker nationally and the No. 77 player in the state of Florida by Rivals • PrepStar All-Southeast Region • Named first-team class 3A all-state as a senior at Trinity Christian • Member of the Orlando Sentinel Super 11 • Helped lead Trinity to a 14-0 record and the FHSAA 3A state championship • As a senior, had 54 tackles (33 solo), 15.5 tackles for loss, 11.5 sacks, seven quarterback hurries, broke up 10 passes, recovered two fumbles and forced four fumbles • Coached by Verlon Dorminey.",,,,,,,,,,,,,,,,
201600842,"Bryce Morais is a 6-4, 240-pound Strong-Side Defensive End from Loganville, GA. He has committed to Boston College Eagles.",Frame,9,Size,8,Point of Attack,7,Hand Quickness,6,Pursuit,5,Closing Speed,5,First Step,5,Athleticism,5
201600843,Was the 2015 Shrine Bowl of the Carolinas Defensive MVP with 13 total tackles (1.5 for loss) and a sack in the game. ...Led Richland Northeast to its first playoff berth since 2011 as a senior.,,,,,,,,,,,,,,,,
201600844,"Sean McKeon is a 6-5, 220-pound Tight End from Dudley, MA.",,,,,,,,,,,,,,,,
201600845,First team All-Conference selection as a junior.,,,,,,,,,,,,,,,,
201600846,"Collin Miller is a 6-2, 215-pound Outside Linebacker from Fishers, IN.",,,,,,,,,,,,,,,,
201600847,"Keith Corbin is a 6-2, 175-pound Wide Receiver from Beaumont, TX.",,,,,,,,,,,,,,,,
201600848,"J.C. Flowers is a 6-2, 175-pound Wide Receiver from Jacksonville, FL.",,,,,,,,,,,,,,,,
201600851,"Matthew Stevens is a 6-0, 215-pound Outside Linebacker from Cornelius, NC.",,,,,,,,,,,,,,,,
201600852,2014: Earned first-team all-district honors as a junior....2013: Was a first-team all-district selection as a sophomore,,,,,,,,,,,,,,,,
201600853,"Gunnar Hoak is a 6-4, 190-pound Pro-Style Quarterback from Dublin, OH.",,,,,,,,,,,,,,,,
201600854,"Drew Jensen is a 6-1, 180-pound Safety from Salt Lake City, UT.",Ball Skills,8,Playmaking,8,Instincts,7,Tackling,7,Speed,7,Frame,7,Size,7,Closing Speed,6
201600855,"Cole Kelly is a 6-7, 230-pound Pro-Style Quarterback from Lafayette, LA.",,,,,,,,,,,,,,,,
201600856,"Tray Eafford is a 6-1, 198-pound Wide Receiver from Leesburg, GA.",,,,,,,,,,,,,,,,
201600857,"Jahsen Wint is an Athlete from Brooklyn, NY.",,,,,,,,,,,,,,,,
201600858,"Zander Zimmer is a Defensive End from Orlando, FL. ... Named to All-Central Florida team in 2014.",,,,,,,,,,,,,,,,
201600859,"Nick McCloud is a 6-3, 170-pound Cornerback from Rock Hill, SC.",,,,,,,,,,,,,,,,
201600860,"Jaylin Bannerman  is a 6-6, 240-pound Outside Linebacker from Pickerington, OH. He attends Arizona Western College",,,,,,,,,,,,,,,,
201600861,"Chauncey Golston is a 6-5, 235-pound Strong-Side Defensive End from Detroit, MI.",,,,,,,,,,,,,,,,
201600862,"Ladarren Brown is a 5-8, 170-pound All Purpose Back from DeSoto, TX.",,,,,,,,,,,,,,,,
201600863,"T.J. London is a 6-3, 330-pound Defensive Tackle from Columbus, GA.",,,,,,,,,,,,,,,,
201600864,"2014: 2nd Team All-District DE/OLB, All-District Special Teams Player of the Year",,,,,,,,,,,,,,,,
201600865,"Lorenzo Harrison is a 5-8, 185-pound Running Back from Hyattsville, MD.",,,,,,,,,,,,,,,,
201600866,"Cody Saunders is a 6-1.5, 199-pound Pro-Style Quarterback from Panama City Beach, FL.",,,,,,,,,,,,,,,,
201600867,"Jacob Kizer is a 6-5, 235-pound Tight End from Salem, OR.",,,,,,,,,,,,,,,,
201600868,"Kobay White is a 5-11, 175-pound Wide Receiver from Harrisburg, PA. He earned all-state and all-league honors as a sophomore.",,,,,,,,,,,,,,,,
201600869,"Ben Snell is a 5-11, 200-pound Running Back from Westerville, OH.",,,,,,,,,,,,,,,,
201600870,HIGH SCHOOL: 2014: Was a second-team all-district selection as a utility player as a juniorPERSONAL: Is the first cousin of class of 2015 five-star quarterback Kyler Murray,,,,,,,,,,,,,,,,
201600871,"2014: Traveon was on the 1st team All-State, 1st team All-Region, and 1st team All-Conference.",,,,,,,,,,,,,,,,
201600872,"Dee  Nalls is a 6-3, 290-pound Offensive Guard from Fayette, AL.",,,,,,,,,,,,,,,,
201600873,"Drew  Wilson  is a 6-4, 285-pound Offensive Guard from Bamberg, SC.",,,,,,,,,,,,,,,,
201600874,"Zach Adams is a 6-7, 285-pound Offensive Tackle from Fredericksburg, VA.",,,,,,,,,,,,,,,,
201600875,"Jake Curhan is a 6-7, 305-pound Offensive Tackle from Larkspur, CA.",,,,,,,,,,,,,,,,
201600876,"Micario Stanley is a 6-2, 228-pound Inside Linebacker from Fort Myers, FL.",,,,,,,,,,,,,,,,
201600877,"Jacob Robertson is a Wide Receiver from Atlanta, GA.",,,,,,,,,,,,,,,,
201600878,"Anthony Smith is a 6-3, 250-pound Strong-Side Defensive End from Las Vegas, NV.",,,,,,,,,,,,,,,,
201600879,"Moustapha Toure is a 6-7, 300-pound Offensive Tackle from Hood River, OR.",,,,,,,,,,,,,,,,
201600880,"Alex Glover is a 6-0, 230-pound Cornerback from Albany, CA.",,,,,,,,,,,,,,,,
201600881,"Edward Vander is a 6-0, 185-pound Athlete from Paramount, CA.",,,,,,,,,,,,,,,,
201600882,"Rex Culpepper is a 6-3, 225-pound Pro-Style Quarterback from Tampa, FL.",,,,,,,,,,,,,,,,
201600883,"Antwaine Richardson is a 6-0, 165-pound Cornerback from Delray Beach, FL.",,,,,,,,,,,,,,,,
201600884,"Kevin Moore is a 5-11, 165-pound Safety from Lafayette, LA.",,,,,,,,,,,,,,,,
201600885,"Mackenzie Nworah is a 6-4, 335-pound Offensive Guard from Manvel, TX.",,,,,,,,,,,,,,,,
201600886,"Jarett Cole is a 5-10, 180-pound Safety from Norcross, GA.",,,,,,,,,,,,,,,,
201600887,"JaQuan Bailey is a 6-3.5, 230-pound Weak-Side Defensive End from Jacksonville, FL.",,,,,,,,,,,,,,,,
201600888,"Keaton Bills is an Offensive Tackle from Draper, UT.",,,,,,,,,,,,,,,,
201600889,"Wayne Kirby is a 6-3, 290-pound Defensive Tackle from Pocatello, ID.",,,,,,,,,,,,,,,,
201600890,"Christion Gainer is a 6-6, 285-pound Offensive Tackle from Panama City, FL.",,,,,,,,,,,,,,,,
201600891,"Jordyn Brooks is a 6-1, 220-pound Outside Linebacker from Houston, TX.",,,,,,,,,,,,,,,,
201600892,"Kenny Ruff is a Inside Linebacker from Fort Lauderdale, FL.",,,,,,,,,,,,,,,,
201600893,2014: Was a first-team all-district selection at DE as a junior,,,,,,,,,,,,,,,,
201600894,"Demari Simpkins is a athlete from Hollywood, FL.",,,,,,,,,,,,,,,,
201600895,"Luca Vartic is a 6-2, 200-pound Cornerback from Kealakekua, HI.",,,,,,,,,,,,,,,,
201600896,"Julian Carter is a 6-3, 190-pound Wide Receiver from Scottsdale, AZ.",,,,,,,,,,,,,,,,
201600897,"Monquavion Brinson is a 5-10, 158-pound Cornerback from Atlanta, GA.",,,,,,,,,,,,,,,,
201600898,"DeMarkus Acy is a 6-0, 162-pound Safety from Dallas, TX.",,,,,,,,,,,,,,,,
201600899,"Mason Vineyard is a 6-5, 200-pound Tight End from La Mesa, CA.",,,,,,,,,,,,,,,,
201600900,"Drew Hmielewski is a 6-2, 195-pound Wide Receiver from Marshall, MN.",,,,,,,,,,,,,,,,
201600901,"Kiondre Thomas is a 6-0, 181-pound Cornerback from Fort Smith, AR.",,,,,,,,,,,,,,,,
201600902,"Kare' Lyles is a 6-1, 215-pound Pro-Style Quarterback from Scottsdale, AZ.",,,,,,,,,,,,,,,,
201600903,"Elijah Daniels is a 5-11, 187-pound Cornerback from Fort Lauderdale, FL.",,,,,,,,,,,,,,,,
201600904,"1st Team All-Conference, 1st Team All-Southwest Ohio, All-State Special Mention, 1st Team All-Conference Academic",,,,,,,,,,,,,,,,
201600905,"Thomas Hoppel is a 6-6, 270-pound Offensive Tackle from Suffolk, VA.Hopple was on the 1st team all-conference, 2nd team all-tidewater, and honorable mention for all-4A.",,,,,,,,,,,,,,,,
201600906,"Evan Weaver is a 6-3, 220-pound Strong-Side Defensive End from Spokane, WA.",,,,,,,,,,,,,,,,
201600907,"David Moore is a 6-2, 180-pound Dual-Threat Quarterback from Alpharetta, GA",,,,,,,,,,,,,,,,
201600908,"Jesse Meyler is a 6-5, 280-pound Offensive Tackle from Alexandria, VA.",,,,,,,,,,,,,,,,
201600909,"Keyon Riley is a 6-2, 190-pound Safety from Anaheim, CA.",,,,,,,,,,,,,,,,
201600910,"Trey Udoffia is a 6-0, 175-pound Wide Receiver from Loomis, CA.",,,,,,,,,,,,,,,,
201600911,"Cam DeGeorge is a 6-5, 275-pound Offensive Guard from Lynnfield, MA.",,,,,,,,,,,,,,,,
201600912,"Tyler Watson is a 6-5, 275-pound Offensive Tackle from Alpharetta, GA.",,,,,,,,,,,,,,,,
201600913,"Grayson Stover is a 6-5, 300-pound Offensive Tackle from Hudson, FL.",,,,,,,,,,,,,,,,
201600914,"Kordell Looney is a 6-3, 285-pound Defensive Tackle from Springfield, OH.",,,,,,,,,,,,,,,,
201600915,"Isaiah Wright is a 6-2, 220-pound Wide Receiver from West Hartford, CT. He played college football for the Temple Owls. He is currently a member of the CFL's Toronto Argonauts.",,,,,,,,,,,,,,,,
201600916,"AJ Green is a 6-1, 155-pound Cornerback from Duncanville, TX.",,,,,,,,,,,,,,,,
201600917,"C.J. Riley is a 6-4, 180-pound Wide Receiver from Pompano Beach, FL.",,,,,,,,,,,,,,,,
201600918,LEL Player of the Year,,,,,,,,,,,,,,,,
201600919,"Tavante Beckett is a 6-0, 215-pound Outside Linebacker from Chesapeake, VA.",,,,,,,,,,,,,,,,
201600920,"Nate Herbig is a 6-4, 320-pound Offensive Guard from Honolulu, HI.",,,,,,,,,,,,,,,,
201600921,"Jacob Colacion is a 6-1, 215-pound Inside Linebacker from La Habra, CA. He has 4 Offers.",,,,,,,,,,,,,,,,
201600922,"Keenan Pili is a Linebacker from Provo, UT.",,,,,,,,,,,,,,,,
201600923,"Derrick Clark is a 5-11, 195-pound Running Back from San Diego, CA. He has committed to California Golden Bears.",,,,,,,,,,,,,,,,
201600924,"Jair Anderson is a 6-1, 185-pound Wide Receiver from Suwanee, GA.Recorded a SPARQ score of 106.17 at The Opening Atlanta Regional in March.",,,,,,,,,,,,,,,,
201600925,"Also an elite baseball prospect- plays outfield for Laurens High School. ...Cousin went to Wake Forest, sister to South Carolina.",,,,,,,,,,,,,,,,
201600926,"Brian Herrien is a 6-0, 200-pound Running Back from Douglasville, GA.",,,,,,,,,,,,,,,,
201600927,"Trevour Simms is a 6-5, 290-pound Offensive Tackle from East Saint Louis, IL.",,,,,,,,,,,,,,,,
201600928,"2014: 1st team All-State, All-Region, Defensive player of the year, All-County 1st team, and top 3 lineman in 4A state.",Play in Space,8,Athleticism,8,Instincts,7,Reactive Quickness,7,Lateral Movement,7,Pursuit,7,Tackling,7,Frame,7
201600929,"Chris Martin is a 6-2, 260-pound Strong-Side Defensive End from Loganville, GA.",,,,,,,,,,,,,,,,
201600930,"Jawaan Taylor is a 6-5, 350-pound Offensive Tackle from Cocoa, FL. Taylor was the offensive tackle of the year from Cocoa.",,,,,,,,,,,,,,,,
201600931,"Skyler Southam is a 6-1, 180-pound Kicker from Heber City, UT. He has committed to Brigham Young Cougars.",,,,,,,,,,,,,,,,
201600932,"Chavis Dawkins is a 6-2, 195-pound Wide Receiver from Duncan, SC.",,,,,,,,,,,,,,,,
201600933,"KJ Gray is a 6-2, 185-pound Wide Receiver from Jersey City, NJ.",,,,,,,,,,,,,,,,
201600934,"Patrick Johnson II is a Athlete from Washington, DC.",Ball Skills,9,Intangibles,7,Versatility,7,Change of Direction,6,Athleticism,6,Size,6,Explosiveness,5,Speed,5
201600935,"Michael Dwumfour is a 6-3, 265-pound Defensive Tackle from Wayne, NJ.",,,,,,,,,,,,,,,,
