player_id,hs_athletic_background,skill_1,skill_1_rating,skill_2,skill_2_rating,skill_3,skill_3_rating,skill_4,skill_4_rating,skill_5,skill_5_rating,skill_6,skill_6_rating,skill_7,skill_7_rating,skill_8,skill_8_rating
201601843,"Ezra Cleveland is a 6-6, 275-pound Defensive Tackle from Spanaway, WA.",,,,,,,,,,,,,,,,
201601844,"Wayne Taulapapa is a 5-11, 202-pound Running Back from Honolulu, HI.",,,,,,,,,,,,,,,,
201601845,"Mason Barta is a 6-2, 205-pound Inside Linebacker from Holton, KS. He has committed to Kansas State Wildcats.",,,,,,,,,,,,,,,,
201601846,"Elijah Piper is a 6-4, 280-pound Offensive Tackle from Tacoma, WA. He has committed to Fresno State Bulldogs.",,,,,,,,,,,,,,,,
201601847,"Keala Santiago is a 5-11, 190-pound Safety from Kahuku, HI. He has committed to Hawaii Warriors.",,,,,,,,,,,,,,,,
201601848,"2014: Academic All-Conference2013: State Championship, Academic All-Conference2012: All-District, Academic All-Conference",,,,,,,,,,,,,,,,
201601849,"Bryce Folsom is a 6-4, 250-pound Strong-Side Defensive End from Alpharetta, GA.",,,,,,,,,,,,,,,,
201601850,"Luke Doerger is a 6-3, 300-pound Center (FB) from Cincinnati, OH.",,,,,,,,,,,,,,,,
201601851,"Chinedu Udeogu is a 6-4, 240-pound Strong-Side Defensive End from Rockville, MD.",,,,,,,,,,,,,,,,
201601852,"Matthew McClurg is a 6-5, 230-pound Tight End from Alcoa, TN.",,,,,,,,,,,,,,,,
201601853,2014: Was an Honorable Mention All-State selection as a junior; Named the ETSN East Texas Offensive Newcomer of the Year,,,,,,,,,,,,,,,,
201601854,"Drew Plitt is a 6-3, 200-pound Pro-Style Quarterback from Loveland, OH. He has committed to Ball State Cardinals.",,,,,,,,,,,,,,,,
201601855,"Kollin Byers is a 6-5, 240-pound Offensive Tackle from Shelby, NC. He has committed to Charlotte 49ers.",,,,,,,,,,,,,,,,
201601856,"Marcus Garvin is a Cornerback from Fort Lauderdale, FL.",,,,,,,,,,,,,,,,
201601857,"Ashton Torres is a 6-4, 300-pound Offensive Tackle from Aurora, CO.",,,,,,,,,,,,,,,,
201601858,"Jack Richardson is a 6-5, 215-pound Pro-Style Quarterback from Salinas, CA.",,,,,,,,,,,,,,,,
201601859,"Anthony Hasan is a 6-2, 180-pound Pro-Style Quarterback from Miami, FL.",,,,,,,,,,,,,,,,
201601860,"Jermarquis Stimage is a 6-0, 180-pound Athlete from Shaw, MS.",,,,,,,,,,,,,,,,
201601861,"De'Shant Hester is a 5-10, 185-pound Safety from Atlanta, GA.",,,,,,,,,,,,,,,,
201601862,"Quint Scoufos is a 6-4, 235-pound Tight End from Sallisaw, OK.",,,,,,,,,,,,,,,,
201601863,"Kobie Jones is a 5-11, 168-pound Dual-Threat Quarterback from Dunnellon, FL.",,,,,,,,,,,,,,,,
201601864,"James Jackson is a 6-3, 184-pound Wide Receiver from Fort Lauderdale, FL.",,,,,,,,,,,,,,,,
201601865,"Jalen Williams is a 6-0, 220-pound Inside Linebacker from Trussville, AL. He has committed to Columbia Lions.",,,,,,,,,,,,,,,,
201601866,"Brenden Schooler is a 6-2, 190-pound Wide Receiver from Mission Viejo, CA. He has committed to Oregon Ducks.",,,,,,,,,,,,,,,,
201601867,"Troy Hill is a 6-6, 227-pound Tight End from Pasadena, CA.",,,,,,,,,,,,,,,,
201601868,"Decary Croaker is a 6-0, 181-pound Safety from Winter Garden, FL.",,,,,,,,,,,,,,,,
201601869,"Justin Garrett is a Wide Receiver from Cerritos, CA.",,,,,,,,,,,,,,,,
201601870,"Jacques Tanelus is a 5-11, 175-pound Safety from Fort Lauderdale, FL.",,,,,,,,,,,,,,,,
201601871,"Steven Newbold is a 5-11, 170-pound Athlete from Opa Locka, FL.",,,,,,,,,,,,,,,,
201601872,"Clayton Glasco is a 6-1, 240-pound Outside Linebacker from Pickerington, OH. He attends Monroe College in New Rochelle, NY.",,,,,,,,,,,,,,,,
201601873,"Isaiah Owens is a 6-2, 175-pound Wide Receiver from Antioch, TN.",,,,,,,,,,,,,,,,
201601874,"Germon Murray is a 6-1, 215-pound Inside Linebacker from Douglasville, GA.",,,,,,,,,,,,,,,,
201601875,"Stockton McGuire is a 6-3, 165-pound Pro-Style Quarterback from Fairburn, GA.",,,,,,,,,,,,,,,,
201601876,"Austin Hester is a 6-4, 270-pound Offensive Guard from Columbus, GA.",,,,,,,,,,,,,,,,
201601877,"Jamal Scott is a 5-11, 185-pound Running Back from Moreno Valley, CA.",,,,,,,,,,,,,,,,
201601878,"De'jour Simpson is a 6-3, 330-pound Offensive Guard from Charlotte, NC.",,,,,,,,,,,,,,,,
201601879,"Nick Perez is a 6-1, 180-pound Safety from Richmond, CA.",,,,,,,,,,,,,,,,
201601880,"AJ Davis is a 6-4, 245-pound Weak-Side Defensive End from Graceville, FL.",,,,,,,,,,,,,,,,
201601881,"DeShawn Smith is a 5-9, 165-pound All Purpose Back from Brooksville, FL.",,,,,,,,,,,,,,,,
201601882,"Aaron Manning is a 5-8, 170-pound Running Back from Rancho Cucamonga, CA.",,,,,,,,,,,,,,,,
201601883,"Taury Dixon is a 5-9, 160-pound Cornerback from Madison, MS.",,,,,,,,,,,,,,,,
201601884,"Jake Schwarzer is a 6-2, 205-pound Outside Linebacker from Temecula, CA.",,,,,,,,,,,,,,,,
201601885,"Nolan Givan is a 6-4, 220-pound Wide Receiver from Berkley, MI.",,,,,,,,,,,,,,,,
201601886,"Devin Singletary is a 5-9, 165-pound Running Back from Delray Beach, FL.",,,,,,,,,,,,,,,,
201601887,"Chance Lytle is a 6-6, 240-pound Offensive Tackle from San Antonio, TX.",,,,,,,,,,,,,,,,
201601888,"Erik Glueck is a 6-3, 225-pound Inside Linebacker from Tacoma, WA.Led all sophomores in the Nw( wa,Oregon, Idaho,Montana ) with 128 total/ 81 solo tackles .",,,,,,,,,,,,,,,,
201601889,"Isaiah Graham-Mobley is a 6-2, 225-pound Linebacker from King Of Prussia, PA.Photo courtesy of Owlsports.com",,,,,,,,,,,,,,,,
201601890,"Jesse Johnson is a Safety from Detroit, MI.",,,,,,,,,,,,,,,,
201601891,2014: Was a second-team all-district selection as a junior,,,,,,,,,,,,,,,,
201601892,"Brett Borske is a 6-6, 230-pound Tight End from Naperville, IL.",,,,,,,,,,,,,,,,
201601893,"Shemar Smith is a 6-1, 200-pound Outside Linebacker from Jacksonville, FL.",,,,,,,,,,,,,,,,
201601894,2014: Was a first-team all-district selection as a junior,,,,,,,,,,,,,,,,
201601895,"Daniel Bender is a 6-4, 225-pound Weak-Side Defensive End from El Cajon, CA.",,,,,,,,,,,,,,,,
201601896,"Eric Sutton is a 5-10, 165-pound Cornerback from Cedar Hill, TX. He has committed to SMU Mustangs.",,,,,,,,,,,,,,,,
201601898,"Devin Judd is a 5-11, 155-pound Wide Receiver from Olney, MD.",,,,,,,,,,,,,,,,
201601900,"Isiah Macklin is a 6-5, 195-pound Wide Receiver from Henderson, NV.",,,,,,,,,,,,,,,,
201601901,"Matthew Beck is a 6-5.5, 204-pound Pro-Style Quarterback from Alexandria, LA.",,,,,,,,,,,,,,,,
201601902,"Max Wariboko is a 6-0, 165-pound Cornerback from Oklahoma City, OK.",,,,,,,,,,,,,,,,
201601903,"Ulises De Los Santos is a 6-3, 275-pound Defensive Tackle from Union City, NJ.",,,,,,,,,,,,,,,,
201601904,"Keon Singleton is a running back from Washington, DC.",,,,,,,,,,,,,,,,
201601905,"Aaron Seigel is a 6-2, 271-pound Defensive Tackle from Harrisburg, PA.",,,,,,,,,,,,,,,,
201601906,"2014: Christian was on the All-District team, All-Area team, and All-State team.",,,,,,,,,,,,,,,,
201601907,"Tyreek Williams is a 6-1, 200-pound Outside Linebacker from Sicklerville, NJ.",,,,,,,,,,,,,,,,
201601908,"Dakota Miller is a 6-1, 185-pound Pro-Style Quarterback from San Marcos, CA.",,,,,,,,,,,,,,,,
201601909,"Jai Creamer is a 6-3, 220-pound Wide Receiver from Rome, GA.",,,,,,,,,,,,,,,,
201601910,"Chris Tucker is a 6-3, 245-pound Weak-Side Defensive End from Jackson, TN. He has 2 Offers.Photo courtesy of Owlsports.com",,,,,,,,,,,,,,,,
201601911,"Dean Taylor is a 6-5, 230-pound Strong-Side Defensive End from Pearland, TX.",,,,,,,,,,,,,,,,
201601912,"Hasaun Glasgow is a 6-3, 210-pound Weak-Side Defensive End from Manvel, TX.",,,,,,,,,,,,,,,,
201601913,"Aubrey White is a 5-11, 175-pound Athlete from Wylie, TX.",,,,,,,,,,,,,,,,
201601914,"Andrew Parchment is a Wide Receiver from Fort Lauderdale, FL.",,,,,,,,,,,,,,,,
201601915,"Garrett  Hooker is a 6-2, 220-pound Inside Linebacker from Thomasville, NC.2014: All-Conference, All-County, All-USA Team NC",,,,,,,,,,,,,,,,
201601916,"Jahod Booker is a 5-10, 185-pound Wide Receiver from Montgomery, AL.",,,,,,,,,,,,,,,,
201601917,"Shemiah Unutoa-Whitson is a 6-2.5, 240-pound Weak-Side Defensive End from San Bernardino, CA. He has 1 Offer.",,,,,,,,,,,,,,,,
201601918,"Braylon Royal is a 5-11, 165-pound Wide Receiver from Arlington, TX.",,,,,,,,,,,,,,,,
201601919,"Jahcour Pearson is an Athlete from Pompano Beach, FL.",,,,,,,,,,,,,,,,
201601920,"Ryan Smith is a 6-4, 275-pound Offensive Tackle from Cincinnati, OH.",,,,,,,,,,,,,,,,
201601921,"Christian Baumgardner is a 6-4, 250-pound Tight End from Ocean City, NJ. He has committed to Virginia Cavaliers.",,,,,,,,,,,,,,,,
201601922,"James McCourt is a 6-1, 185-pound Kicker from Fort Lauderdale, FL.",,,,,,,,,,,,,,,,
201601923,"Hal Northern is a 6-3, 293-pound Defensive Tackle from Senatobia, MS.",,,,,,,,,,,,,,,,
201601924,"Tyler Witt is a 6-3, 265-pound Offensive Tackle from Joliet, IL. He has committed to Western Kentucky Hilltoppers.",,,,,,,,,,,,,,,,
201601925,2014: Was a first-team all-district selection as a junior....2013: Was named the District 12-2A-DII Defensive Newcomer of the Year as a sophomore,,,,,,,,,,,,,,,,
201601926,"Willie Johnson is a 6-0, 170-pound Wide Receiver from Fort Myers, FL. Johnson has a 247Sports rating of 70, making him a 2-star prospect.He has committed to Marshall Thundering Herd.",,,,,,,,,,,,,,,,
201601927,"Josh Mueller is a 6-6, 260-pound Strong-Side Defensive End from Thiensville, WI.",,,,,,,,,,,,,,,,
201601928,"Chris Crumb is a Defensive Tackle from Lewis Center, OH.",,,,,,,,,,,,,,,,
201601929,"Tiller Bucktrot is a 6-4, 335-pound Offensive Guard from Stroud, OK.",,,,,,,,,,,,,,,,
201601930,"Lucas Tribble is a 6-4, 270-pound Offensive Tackle from Southlake, TX.",,,,,,,,,,,,,,,,
201601931,"Devin Williams is a 5-11, 170-pound Dual-Threat Quarterback from Mansfield, TX. He played at Fort Worth Southwest as a freshman and sophomore.",,,,,,,,,,,,,,,,
201601932,"Brendan Pyne is a 6-0, 210-pound Outside Linebacker from Bradenton, FL.",,,,,,,,,,,,,,,,
201601933,"Grant Hermans is a 6-6, 255-pound Offensive Tackle from Rio Rancho, NM.",,,,,,,,,,,,,,,,
201601934,"MJ Clark is a 6-1, 165-pound Wide Receiver from Dallas, TX.",,,,,,,,,,,,,,,,
201601935,"Desmond Chapple is a 6-4, 235-pound Weak-Side Defensive End from Edwardsville, IL.",,,,,,,,,,,,,,,,
201601936,"Delonte Berry is a 6-2, 212-pound Outside Linebacker from Shenandoah Junction, WV. He has committed to Navy Midshipmen.",,,,,,,,,,,,,,,,
201601937,"Hank Tuipulotu is a 6-2, 225-pound Tight End from Fort Mill, SC. He has committed to Brigham Young Cougars.",,,,,,,,,,,,,,,,
201601938,"D'Angelo Ware is a 5-8, 185-pound Running Back from Moore Haven, FL. Ware has a 247Sports rating of 70, making him a 2-star prospect.He has committed to FIU Golden Panthers.",,,,,,,,,,,,,,,,
201601939,"Kyle Banks is a 6-2, 180-pound Pro-Style Quarterback from Dallas, GA.",,,,,,,,,,,,,,,,
201601940,"Anthony Pegues is a 5-7, 180-pound Running Back from Frisco, TX.",,,,,,,,,,,,,,,,
201601941,"Roy Baker is a 6-2, 170-pound Cornerback from Hialeah, FL.",,,,,,,,,,,,,,,,
201601942,"Jonathan Lenard is a 6-1, 181-pound Safety from Oxnard, CA.",,,,,,,,,,,,,,,,
201601943,"Solomon Wise is a 6-4, 220-pound Strong-Side Defensive End from Coppell, TX.",,,,,,,,,,,,,,,,
201601944,"Tyler Tupa is a 6-1, 185-pound Wide Receiver from Broadview Heights, OH.",,,,,,,,,,,,,,,,
201601945,"Caleb Abrom is a 6-0, 190-pound Safety from DeSoto, TX.",,,,,,,,,,,,,,,,
201601946,"2019 (REDSHIRT JUNIOR): Played in 11 of 12 games for the Razorbacks in 2019 … Totaled 284 plays, according to Pro Football Focus, seeing 214 snaps on defense, with 70 coming on special teams … Recorded 22 tackles, 13 solo, with two pass breakups, a quarterback hurry and a fumble recovery … Had a tackle in eight of 11 games played, including a season-high five against Western Kentucky on Nov. 9 … Also recovered a fumble in the fourth quarter against the Hilltoppers.2018 (REDSHIRT SOPHOMORE): Played in four games for the Razorbacks in 2018, appearing in each of the first three games and in week five against Texas A&M in Arlington … Totaled 49 snaps according to Pro Football Focus, 13 on defense and 36 on Arkansas’ kickoff coverage and kick & punt return units … Recorded one tackle in the second game of the year at Colorado State.2017 (REDSHIRT FRESHMAN): Played in 10 games, mostly on special teams … Recorded three tackles and forced a fumble on kickoff coverage … Saw limited time on defense against Florida A&M (Aug. 31) and No. 16 Mississippi State (Nov. 18).2016 (FRESHMAN): Redshirted as a true freshman.HIGH SCHOOL: A three-star recruit by 247Sports and Scout … Tabbed the No. 153 safety in the class and the No. 288 player in the state of Texas … Had a breakout senior campaign, tallying a team-leading 123 tackles, including three for loss, three interceptions, one forced fumble, two fumble recoveries and seven pass breakups … Helped lead the Mavericks to an 11-2 record and an appearance in Texas Class 5A Division II (fourth-largest of 10 divisions) regional finals under head coach Clint Harper … Collected 76 tackles, including four for loss, one sack, one interception and five pass breakups as a junior to help Marshall to a 7-5 record and an appearance in Texas Class 5A Division II area finals … As a sophomore, had 37 stops and three pass breakups … Also participated in powerlifting and track … Chose Arkansas over Northwestern (La.) State, Lamar, Texas State, Sam Houston State and Stephen F. Austin.PERSONAL: Born on June 6, 1998 … Son of Stacy Carter and Tomiko Smith … Criminal justice major.",,,,,,,,,,,,,,,,
201601947,"Tobe Okafor is a 6-4, 270-pound Offensive Guard from Portland, OR.",,,,,,,,,,,,,,,,
201601948,"Keoni Stallworth is a 6-2, 190-pound Safety from Elk Grove, CA.",,,,,,,,,,,,,,,,
201601949,"Alex Hall is a 6-6, 265-pound Offensive Tackle from Louisville, OH. He has committed to Maryland Terrapins.",,,,,,,,,,,,,,,,
201601951,"Jared Culp is a 6-3, 205-pound Athlete from New Carlisle, IN.",,,,,,,,,,,,,,,,
201601952,"Jacquez Williams is a 6-1, 180-pound Wide Receiver from Hinesville, GA.",,,,,,,,,,,,,,,,
201601953,"Neiman Armstrong is a Cornerback from DeSoto, TX.",,,,,,,,,,,,,,,,
201601954,"Tyler Marshall is a 6-3, 210-pound Pro-Style Quarterback from Dothan, AL.",,,,,,,,,,,,,,,,
201601955,"2014: MO 4A defensive player of the year, 1st team All-State, All-District, All-Conference, and All-conference player of the year.",,,,,,,,,,,,,,,,
201601956,"Kenny Cooper is a 6-3, 275-pound Offensive Guard from Calhoun, GA.",,,,,,,,,,,,,,,,
201601957,2015: Was the AP Class 4A Offensive Player of the Year as a senior,,,,,,,,,,,,,,,,
201601958,"Cole Banwart is a 6-4, 280-pound Offensive Guard from Algona, IA.",,,,,,,,,,,,,,,,
201601959,"Jatairis Grant is a 5-11, 180-pound Safety from Akron, OH.",,,,,,,,,,,,,,,,
201601960,"Sam Glaesmann is a 6-3, 198-pound Pro-Style Quarterback from Waco, TX.",,,,,,,,,,,,,,,,
201601961,"Christian Moore is a 6-1, 210-pound Safety from Ashburn, VA.",,,,,,,,,,,,,,,,
201601962,"Jackson Anthrop is a 5-11, 180-pound Athlete from Lafayette, IN.",,,,,,,,,,,,,,,,
201601963,"Antonio Dupree is a 6-0, 205-pound Running Back from Baltimore, MD.",,,,,,,,,,,,,,,,
201601964,"Josh Johnson is a 5-9, 215-pound Running Back from Opelika, AL.",Vision,8,Power,8,Build,8,Tackle Breaking,7,Change of Direction,7,Feet,7,Explosiveness,6,Speed,6
201601965,"Julio Garcia is a 6-3, 300-pound Offensive Tackle from Las Vegas, NV. He has committed to UNLV Runnin' Rebels.",,,,,,,,,,,,,,,,
201601966,"Zachary Kastenhuber is a 6-1, 225-pound Outside Linebacker from Wallingford, CT.",,,,,,,,,,,,,,,,
201601967,"Bruno Labelle is a Tight End from Quebec City, QC. He has committed to Cincinnati Bearcats.",,,,,,,,,,,,,,,,
201601968,"Kyle Speas is a 6-5, 220-pound Tight End from Plainfield, IL. Speas has a 247Sports rating of 70, making him a 2-star prospect.He has committed to Miami (OH) RedHawks.",,,,,,,,,,,,,,,,
201601969,"Ohaji Hawkins is a 6-2, 169-pound Safety from Winter Haven, FL.",,,,,,,,,,,,,,,,
201601970,2014: Was a first-team all-district selection in basketball as a junior,,,,,,,,,,,,,,,,
201601971,"Joseph Dill is a 6-4, 330-pound Offensive Guard from Baytown, TX.",,,,,,,,,,,,,,,,
201601972,"Ko Kieft is a 6-4, 230-pound Athlete from Sioux Center, IA.",,,,,,,,,,,,,,,,
201601973,"Tristan Cooper is a 6-1, 180-pound Safety from El Paso, TX.",,,,,,,,,,,,,,,,
201601974,"Nigel Center is a 6-2, 190-pound Cornerback from American Canyon, CA.",,,,,,,,,,,,,,,,
201601975,"Randle Jones is a 5-10.5, 160-pound Wide Receiver from Miami Beach, FL. He has committed to Temple Owls.Photo courtesy of Owlsports.com",,,,,,,,,,,,,,,,
201601976,"D.J. Owens is a 5-11, 197-pound Running Back from Dallas, GA.",,,,,,,,,,,,,,,,
201601977,"Tristan Crowder is a 6-5, 336-pound Offensive Tackle from Carrollton, GA.",,,,,,,,,,,,,,,,
201601978,"Dimetrios Mason is a 6-0, 170-pound Wide Receiver from Loganville, GA.",,,,,,,,,,,,,,,,
201601979,2014: Was a first-team all-district selection as a junior,,,,,,,,,,,,,,,,
201601980,"Semisi Fakasiieiki is a 6-3, 231-pound Outside Linebacker from Compton, CA. He has committed to San Diego State Aztecs.",,,,,,,,,,,,,,,,
201601981,"Qwuantrezz Knight is a 6-0, 189-pound Safety from Quincy, FL.",,,,,,,,,,,,,,,,
201601982,"Baer Hunter is a 6-2, 232-pound Strong-Side Defensive End from Clemmons, NC.",,,,,,,,,,,,,,,,
201601983,"Dominic Maggio is a 6-2, 155-pound Kicker from Baltimore, MD. He has committed to Wake Forest Demon Deacons.",,,,,,,,,,,,,,,,
201601984,"Kee Whetzel is a Wide Receiver from Clearwater, FL.",,,,,,,,,,,,,,,,
201601985,"Jake Hansen is a 6-2, 220-pound Inside Linebacker from Tarpon Springs, FL.",,,,,,,,,,,,,,,,
201601986,"Doug Kramer is a 6-2, 255-pound Offensive Guard from Hinsdale, IL. He has committed to Illinois Fighting Illini.",,,,,,,,,,,,,,,,
201601987,"L'Jarius Sneed is a 6-1, 170-pound Safety from Mooringsport, LA.",,,,,,,,,,,,,,,,
201601988,"Will Harper is a 6-1, 195-pound Outside Linebacker from Tyrone, GA.",,,,,,,,,,,,,,,,
201601989,"Korab Idrizi is a 6-2, 207-pound Tight End from Oradell, NJ.",,,,,,,,,,,,,,,,
201601990,2015: Was named the District 30-5A Overall MVP as a senior....2014: Was the District 30-5A Co-MVP as a junior,,,,,,,,,,,,,,,,
201601991,Raequan Purvis was medically disqualified from playing football in the spring of 2019.,,,,,,,,,,,,,,,,
201601992,"Luke Benzschawel is a 6-7, 220-pound Weak-Side Defensive End from Grafton, WI. He has committed to Wisconsin Badgers.",,,,,,,,,,,,,,,,
201601993,"Marcel Paul is a 6-1, 170-pound Wide Receiver from Detroit, MI. He has committed to Cincinnati Bearcats.",,,,,,,,,,,,,,,,
201601994,"Martin  Mangram is a 5-11, 180-pound Athlete from Buford, GA.",,,,,,,,,,,,,,,,
201601995,"Keelen Roberts is a 6-0, 170-pound Cornerback from Opa Locka, FL. Also a track standout in 100m, 300m hurdles, and long jump.",,,,,,,,,,,,,,,,
201601996,"Daniel Brown is a 5-11, 175-pound Cornerback from Harbor City, CA.",,,,,,,,,,,,,,,,
201601997,"Felipe Fernandez is a 6-4, 313-pound Offensive Tackle from Tampa, FL.",,,,,,,,,,,,,,,,
201601998,"Dylan Thigpen is a 5-9.5, 182-pound Running Back from La Verne, CA.",,,,,,,,,,,,,,,,
201601999,"Delvin Bennett is a 6-3, 180-pound Wide Receiver from Beaumont, TX.",,,,,,,,,,,,,,,,
201602000,"Ka'Darian Smith is a 5-11, 170-pound Cornerback from Spring, TX.",,,,,,,,,,,,,,,,
201602001,"Jonard Robinson is a 6-2, 190-pound Safety from Baton Rouge, LA.",,,,,,,,,,,,,,,,
201602002,"Eron Carter is a 6-2, 230-pound Outside Linebacker from Palatka, FL.",,,,,,,,,,,,,,,,
201602003,"Bailey Byrum is a 6-6, 305-pound Offensive Guard from Sweetwater, TN.",,,,,,,,,,,,,,,,
201602004,"James Sutton is a 6-0, 200-pound Outside Linebacker from Miami, FL.",,,,,,,,,,,,,,,,
201602005,"Malik Talley is a 6-3, 180-pound Wide Receiver from Scottsboro, AL.",,,,,,,,,,,,,,,,
201602006,"Tanner Matthews is a 6-3, 222-pound Outside Linebacker from Rancho Santa Margarita, CA. He has committed to Navy Midshipmen.",,,,,,,,,,,,,,,,
201602007,"Kemon Freeman is a 5-11, 205-pound Athlete from Texarkana, TX.",,,,,,,,,,,,,,,,
201602008,"Taeshon Trotter is a Offensive Tackle from Detroit, MI.",,,,,,,,,,,,,,,,
201602009,"Edward Hayes is a 6-2, 190-pound Safety from Coldspring, TX.",,,,,,,,,,,,,,,,
201602010,"Matt Terrell is a 6-4, 225-pound Outside Linebacker from Lynchburg, VA. He has committed to Virginia Cavaliers.",,,,,,,,,,,,,,,,
201602011,"Brandon Moore is a 6-0, 165-pound Athlete from Sanford, FL.",,,,,,,,,,,,,,,,
201602012,"C.J. Windham is a 6-3, 190-pound Wide Receiver from Powder Springs, GA.",,,,,,,,,,,,,,,,
201602013,"Maleke Bell is a 6-2, 260-pound Strong-Side Defensive End from Starkville, MS.",,,,,,,,,,,,,,,,
201602014,"Michael Onuoha is a 6-3, 171-pound Cornerback from Austin, TX.",,,,,,,,,,,,,,,,
201602015,"Brian Lankford-Johnson is a 6-1, 190-pound Point Guard/Athlete originally from Saint Paul, MN. Brian transferred to Palm Bay before his Junior season.",,,,,,,,,,,,,,,,
201602016,"Bishop Jones is a 6-2, 215-pound Outside Linebacker from Las Vegas, NV.",,,,,,,,,,,,,,,,
201602017,"De'Andre Williams is a 6-4, 260-pound Defensive Tackle from Baton Rouge, LA. Williams has a 247Sports rating of 70, making him a 2-star prospect.He has committed to Tulane Green Wave.",,,,,,,,,,,,,,,,
201602018,"Alex Salguero is a 6-3, 310-pound Offensive Guard from Bradenton, FL. Salguero has a 247Sports rating of 70, making him a 2-star prospect.He has committed to Marshall Thundering Herd.",,,,,,,,,,,,,,,,
201602019,"Drayton Arnold is a 6-0, 182-pound Dual-Threat Quarterback from Myrtle Beach, SC.",,,,,,,,,,,,,,,,
201602020,2014: Was a second-team all-district selection as a junior,,,,,,,,,,,,,,,,
201602021,"Devon Brown is a 5-11, 175-pound Cornerback from West Palm Beach, FL.",,,,,,,,,,,,,,,,
201602022,"Jose Borregales is a 5-11, 175-pound Kicker from Miami, FL.As a junior, Borregales hit on four of five field goals. He has range over 50 yards and already kicks off the ground.He hit 59-of-79 of his kickoffs for touchbacks and connected on 66-of-71 PATs.He also averaged 35.7 yards per punt.",,,,,,,,,,,,,,,,
201602023,"Kendall Futrell is a 6-3, 215-pound Weak-Side Defensive End from Winterville, NC.",,,,,,,,,,,,,,,,
201602024,"Justin Chase is a 6-6, 265-pound Offensive Tackle from Chesapeake, VA.",,,,,,,,,,,,,,,,
201602025,"Josh Moran is a Wide Receiver from Alpharetta, GA.",,,,,,,,,,,,,,,,
201602026,"Jace Webb is a 6-4, 300-pound Offensive Guard from Hollis, OK.",,,,,,,,,,,,,,,,
201602027,"Deron Harrell is a 6-3, 175-pound Athlete from Denver, CO. He has committed to Wisconsin Badgers.",,,,,,,,,,,,,,,,
201602028,"Mikey Grandy is a 6-5, 305-pound Offensive Tackle from Palo Alto, CA.",,,,,,,,,,,,,,,,
201602029,"DeShawn Lookout is a 6-1, 180-pound Wide Receiver from Oklahoma City, (Westmoore).. Lookout committed to play baseball as well as football at Oklahoma on June 3, 2014.",,,,,,,,,,,,,,,,
201602030,"Noel Brouse is a 6-6, 255-pound Strong-Side Defensive End from Allentown, PA. He has committed to Syracuse Orange.",,,,,,,,,,,,,,,,
201602031,"Darius Stubbs is a 5-11, 200-pound Running Back from Locust Grove, GA.",,,,,,,,,,,,,,,,
201602032,"Myles Vigne is a 6-2, 295-pound Defensive Tackle from New Orleans, LA.",,,,,,,,,,,,,,,,
201602033,"Deon Rainey is a 6-2, 205-pound Weak-Side Defensive End from Baton Rouge, LA.",,,,,,,,,,,,,,,,
201602034,"Jeffrey Taylor is a 6-3, 290-pound Offensive Guard from Jonesboro, GA.",,,,,,,,,,,,,,,,
201602035,"Eric Lewis is a 5-11, 185-pound Safety from La Place, LA. He has committed to Tulane Green Wave.",,,,,,,,,,,,,,,,
201602036,"Cade  Stewart is a 6-4, 310-pound Offensive Tackle from Central, SC.",,,,,,,,,,,,,,,,
201602037,"Benny Walls is a 6-1, 210-pound Safety from Cherry Hill, NJ.Walls was on the 1st team All-State team and 2nd All-Catholic team",,,,,,,,,,,,,,,,
201602038,"Demetrius Davis is a 5-10, 175-pound All Purpose Back from Birmingham, AL.",,,,,,,,,,,,,,,,
201602039,"Malik Street is a 6-0, 180-pound Safety from Bellflower, CA.",,,,,,,,,,,,,,,,
201602040,"Mekhi Stevenson is a 6-0, 180-pound Wide Receiver from La Mesa, CA.",,,,,,,,,,,,,,,,
201602041,"Ben Kimpler is a 6-6, 217-pound Strong-Side Defensive End from Libertyville, IL.",,,,,,,,,,,,,,,,
201602042,"Josiah Sa'o is a 6-1.5, 267-pound Offensive Guard from San Diego, CA.",,,,,,,,,,,,,,,,
201602043,"DeMarcus (Mark) Williams is a 6-0, 190-pound Athlete from Jackson, AL.",,,,,,,,,,,,,,,,
201602044,"Jack Doyle is a 6-6, 255-pound Offensive Tackle from Wake Forest, NC. He has committed to East Carolina Pirates.",,,,,,,,,,,,,,,,
201602045,"Anthony Watley is a 6-3, 245-pound Tight End from Jacksonville, FL.",,,,,,,,,,,,,,,,
201602046,"Daeshawn Stephens is a 6-2, 190-pound Wide Receiver from Durham, NC. He has committed to N.C. State Wolfpack.",,,,,,,,,,,,,,,,
201602047,"Trysten Hill is a 6-1, 297-pound Defensive Tackle from Live Oak, FL. He has committed to UCF Knights.",,,,,,,,,,,,,,,,
201602048,"Austin Hergott is a 6-4, 220-pound Pro-Style Quarterback from Fort Thomas, KY. He has committed to Central Michigan Chippewas.",,,,,,,,,,,,,,,,
201602049,"Bailey Smith is a 6-5, 300-pound Offensive Tackle from Allen, TX.",,,,,,,,,,,,,,,,
201602050,"Rocco Marucci is a 6-1, 160-pound Cornerback from Hollywood, FL. He has committed to Colorado State Rams.",,,,,,,,,,,,,,,,
201602051,"Louis Kelley Jr. is a 6-1, 180-pound Safety from Pflugerville, TX.",,,,,,,,,,,,,,,,
201602052,"John Lamont is a 6-2, 202-pound Athlete from Mebane, NC.",,,,,,,,,,,,,,,,
201602053,"Perry Young is a 5-10, 185-pound Safety from Birmingham, AL.",,,,,,,,,,,,,,,,
201602054,"Ty Shelby is a 6-4, 225-pound Weak-Side Defensive End from Friendswood, TX.",,,,,,,,,,,,,,,,
201602055,"B.J. Smith is a 5-9, 185-pound All Purpose Back from Millbrook, AL. He has committed to Troy Trojans.",,,,,,,,,,,,,,,,
201602056,"Jordan Gonzalez is a 6-5, 225-pound Tight End from Palm Beach Gardens, FL. He has committed to Middle Tennessee State Blue Raiders.",,,,,,,,,,,,,,,,
201602057,"Shakur Chisolm is a 6-2, 175-pound Athlete from Barnwell, SC.",,,,,,,,,,,,,,,,
201602058,"Mareio McGraw is a 6-0, 175-pound Cornerback from Nashville, TN.",,,,,,,,,,,,,,,,
