player_id,hs_athletic_background,skill_1,skill_1_rating,skill_2,skill_2_rating,skill_3,skill_3_rating,skill_4,skill_4_rating,skill_5,skill_5_rating,skill_6,skill_6_rating,skill_7,skill_7_rating,skill_8,skill_8_rating
202000597,"Corbin Gibson is a 6-4, 205-pound Athlete from Sebastian, FL.",,,,,,,,,,,,,,,,
202000598,"Bryce Mostella is a 6-6, 235-pound Weak-Side Defensive End from Grand Rapids, MI.",,,,,,,,,,,,,,,,
202000599,"DeAngelo Taylor is a Cornerback from Tampa, FL.",,,,,,,,,,,,,,,,
202000601,"Drake Heismeyer is a 6-4, 275-pound Offensive Guard from Saint Charles, MO.",,,,,,,,,,,,,,,,
202000602,"Makell Esteen is a Cornerback from Lawndale, CA.",,,,,,,,,,,,,,,,
202000603,"Mitch Griffis is a Quarterback from Ashburn, VA.",,,,,,,,,,,,,,,,
202000604,"Javorrius Selmon is a 5-10, 165-pound Athlete from Jackson, MS.",,,,,,,,,,,,,,,,
202000605,"Corey Dyches is a Wide Receiver from Oxon Hill, MD.",,,,,,,,,,,,,,,,
202000606,"Collin Gamble is a Cornerback from Argyle, TX.",,,,,,,,,,,,,,,,
202000607,"Jordon Simmons is a Running Back from Powder Springs, GA.",,,,,,,,,,,,,,,,
202000608,2018: Was a first-team all-district selection as a junior,,,,,,,,,,,,,,,,
202000609,"Derek Bermudez is a 6-2, 180-pound Cornerback from Jacksonville, FL.",,,,,,,,,,,,,,,,
202000610,2018: Was a unanimous first-team all-district selection as a junior at Terrell (Texas) HS,,,,,,,,,,,,,,,,
202000611,"An early enrollee who is a three-star prospect listed as the No. 63 player in Georgia and the nation’s 48th-ranked offensive tackle in the 247Sports Composite • Ranked as the state’s No. 55 player and the nation’s 42nd-ranked offensive tackle according to Rivals • Tabbed as the state’s No. 57 player and the nation’s 57th-ranked offensive tackle according to ESPN • A three-time all-region selection • Tabbed first-team all-state and first-team region 4-7A by the Atlanta Journal Constitution as a senior • Helped Roswell to an 8-3 record, a region championship and the second round of the 7A playoffs • Blocked for an offense that posted 1,725 yards rushing and scored 20 rushing TDs • Earned All-Metro honors from the Atlanta Journal-Constitution as a junior • An all-region selection • Led Roswell to a 9-2 record, a region championship and a berth in the 7A state playoffs • Helped Roswell rush for 1,833 yards and 20 rushing TDs • Also claimed all-region honors as a sophomore • Coached by Matt Kemper.",,,,,,,,,,,,,,,,
202000612,"Chris Street is a 5-10, 180-pound Running Back from Santa Ana, CA.",,,,,,,,,,,,,,,,
202000613,"Octavious Oxendine is a 6-3, 310-pound Defensive Tackle from Radcliff, KY. He was named first team All-State by MaxPreps in 2019.",,,,,,,,,,,,,,,,
202000614,"Ramon Henderson is a 6-2, 183-pound Wide Receiver from Bakersfield, CA.",,,,,,,,,,,,,,,,
202000615,"Cole Pedersen is a 6-3, 190-pound athlete from Leon, IA.",,,,,,,,,,,,,,,,
202000616,"Malick Meiga is a Wide Receiver from Montreal, Quebec",,,,,,,,,,,,,,,,
202000617,2018: Was a first-team all-district selection as a juniorPERSONAL: Is the younger brother of Oklahoma DE Mark Jackson,,,,,,,,,,,,,,,,
202000618,2018: Played at Dallas Bishop Dunne as a junior,,,,,,,,,,,,,,,,
202000619,"Helped lead Edna Karr to 4A state championships all three years…Cougars were 14-1 his sophomore season, completed perfect 15-0 season his junior year and finished 13-2 in 2019.",,,,,,,,,,,,,,,,
202000620,"As a senior helped Venice advance to semifinal round of 7A state playoffs while blocking for offense that rushed for nearly 3,000 yards and averaged 32.8 points per game…junior year blocked for offense that averaged 43.1 points per game and achieved near-perfect balance, rushing for 2,892 yards and passing for 2,790 yards as Indians won 11 games and advanced to semifinal round of state playoffs…won state title as a sophomore, blocking for offense that averaged 39.5 points per game, passed for 3,145 yards and added 2,982 yards on the ground…also played basketball at Venice",,,,,,,,,,,,,,,,
202000621,2018: Earned first-team all-district honors as a junior.,,,,,,,,,,,,,,,,
202000622,"Altrique Barlow is a 6-4, 290-pound Offensive Guard from Chesapeake, VA.",,,,,,,,,,,,,,,,
202000623,"Xavier Restrepo is a 5-10, 178-pound Wide Receiver from Pompano Beach, FL.",,,,,,,,,,,,,,,,
202000624,"Miyan Williams is a Running Back from Cincinnati, OH.",,,,,,,,,,,,,,,,
202000625,"Plays football and runs track, where he competes in the 100 meters, 200 meters, 4x100 relay, and 4x200 relay.2019: Named the District 11-5A-II Overall MVP as a senior2018: Named the District 11-5A-II Offensive MVP as a junior.2017: Named the District 24-5A Co-Offensive MVP as a sophomore.",,,,,,,,,,,,,,,,
202000626,"Bryce Austin is a 6-2, 285-pound defensive tackle from Southfield, MI.",,,,,,,,,,,,,,,,
202000627,Father (Denard Walker) played at LSU from 1994-97 and played nine NFL seasons.,,,,,,,,,,,,,,,,
202000628,"Jalen Huff is a 6-1/2, 169-pound Cornerback from Buford, GA. He committed to Oklahoma on Nov 2, 2018.",,,,,,,,,,,,,,,,
202000629,Varsity basketball player,Ball Skills,9,Size,9,Hips,8,Instincts,8,Tackling,7,Change of Direction,7,Physicality,7,Speed,7
202000630,"Kalil Branham is a wide receiver from Columbus, OH. He plans to play in the Offense-Defense All-American Bowl.",,,,,,,,,,,,,,,,
202000631,2018: Earned first-team all-district honors as a junior. ... 2017: Earned a first-team all-district selection as a sophomore.,,,,,,,,,,,,,,,,
202000632,"Denver Warren is a Defensive Tackle from Aurora, IL.",,,,,,,,,,,,,,,,
202000633,"DeShawn Lynch is a Defensive End from Folsom, CA.",,,,,,,,,,,,,,,,
202000634,"Trai Jones is a 6-2, 285-pound Offensive Guard from Abbeville, SC.",,,,,,,,,,,,,,,,
202000635,"Aidan Bouman is a Pro-Style Quarterback from Buffalo, MN.",,,,,,,,,,,,,,,,
202000636,"Jabari Small is a Running Back from Memphis, TN.",,,,,,,,,,,,,,,,
202000637,2018: Earned second-team all-District 14-6A honors at tight end as a junior.,,,,,,,,,,,,,,,,
202000638,"His father, Carlos Phillips, played under head coach Jerry Claiborne at Kentucky in 1989. Phillips was named Class 5A first team All State by The State.",,,,,,,,,,,,,,,,
202000639,"Will Rogers is a Quarterback from Brandon, MS.",,,,,,,,,,,,,,,,
202000640,"Plays football and basketball.2018: Played both ways at DE and TE. Earned all-county honors, plus second-team honoree on the All-Arkansas Valley/Chisholm Trail team.",,,,,,,,,,,,,,,,
202000641,"Kevon Billingsley is a 6-4, 275-pound Offensive Guard from Saint Louis, MO.",,,,,,,,,,,,,,,,
202000642,"Akheem Mesidor is a 6-1, 195-pound Outside Linebacker from Ottawa, ON.",,,,,,,,,,,,,,,,
202000643,"Cedric Gray is a 6-2, 190-pound LB from Charlotte, NC.",,,,,,,,,,,,,,,,
202000644,"Antonio Stevens is a Safety from Franklin, TN.",Frame,9,Versatility,8,Instincts,8,Tackling,8,Ball Skills,8,Playmaking,8,Speed,8,Cover Skills,7
202000645,CamRon Jackson is a defensive tackle from Haynesville (La.) High School.,,,,,,,,,,,,,,,,
202000646,"Luke Kandra is an Offensive Lineman from Cincinnati, OH.",,,,,,,,,,,,,,,,
202000648,"Malik Reed is a 6-2, 220-pound Outside Linebacker from Chandler, AZ.",,,,,,,,,,,,,,,,
202000651,Two-sport athlete in football and track and field.Spring 2019: Texas Class 5A regional qualifier in the long jump (22-4 1/2 PR).,,,,,,,,,,,,,,,,
202000652,"Jay Max Jacobsen is a 6-4, 230-pound Strong-Side Defensive End from Temecula, CA.",,,,,,,,,,,,,,,,
202000653,"Threw for 6,811 yards and 74 touchdowns, averaging 243.3 yards per game in his career at Valdosta…threw 42 touchdowns as a senior, completing 66.8 percent of his passes for 3,225 yards while leading Wildcats to third round of AAAAAA state playoffs…led offense that tallied 4,695 yards of total offense, averaging 361.2 yards per game…named GACA Player of the Year…as a junior threw for 3,539 yards and 31 touchdowns while adding 133 yards and one touchdown on the ground",,,,,,,,,,,,,,,,
202000654,Was named second team All-State by MaxPreps in 2019. He will play in the Offense-Defense All-American Bowl.,,,,,,,,,,,,,,,,
202000655,"Gunner Maldonado is a Safety from Chandler, AZ.",,,,,,,,,,,,,,,,
202000656,Catrell Wallace is a 2020 OLB from Bryant (Ark.) High School.,,,,,,,,,,,,,,,,
202000657,"Jeremiah Wright is a 6-5, 320-pound Offensive Tackle from Selma, AL.",,,,,,,,,,,,,,,,
202000658,"Leshon Williams is a Running Back from Oak Lawn, IL.",,,,,,,,,,,,,,,,
202000659,"HIGH SCHOOL: Three-year varsity letterwinner at Brother Martin High School in New Orleans, Louisiana … Tallied 31 tackles, eight pass breakups and two interceptions, while allowing only five receptions on 26 targets … Helped the Crusaders to a 10-3 overall record as a senior in 2019, including a No. 6 ranking in the state, as well as a semifinal berth in the 2019 Allstate Sugar Bowl/LHSAA Non-Select Prep Classic Division I playoffs … Recorded a pick six in the semifinal contest against Archbishop Rummel … Was part of a 9-5 team in 2018, with a second round appearance in the state playoffs as a junior … Also lettered in basketball at Brother Martin HS … CHOSE ARKANSAS OVER: Tennessee, Penn State, Baylor, Georgia Tech, Houston, Memphis, Texas Tech and others.PERSONAL: Nick Turner … Born Nov. 3, 2001 … Son of Nikki and Wil Turner … Brother to Tre and Jeremy.",,,,,,,,,,,,,,,,
202000660,Khari Coleman is a an Edge from G.W. Carver in New Orleans.,,,,,,,,,,,,,,,,
202000661,"Ian Stewart is a 6-3, 215-pound Wide Receiver from Woodhaven, MI.",,,,,,,,,,,,,,,,
202000662,"Jordan Turner is a Linebacker from Farmington, MI.",,,,,,,,,,,,,,,,
202000663,"Mitchell Walters is an Offensive Tackle from Saint Louis, MO.",,,,,,,,,,,,,,,,
202000664,"Devin Hightower is a Linebacker from Akron, OH.",,,,,,,,,,,,,,,,
202000665,"Joey Hunter is a Cornerback from Tyrone, GA.",,,,,,,,,,,,,,,,
202000666,"Latarie Kinsler is a Defensive End from Pahokee, FL.2017 Class 1A Defensive Player of the Year.",,,,,,,,,,,,,,,,
202000667,Also played basketball at the high school level,,,,,,,,,,,,,,,,
202000668,"Michael Nichols is an Offensive Tackle from Justin, TX.",,,,,,,,,,,,,,,,
202000669,Football and track and field standout.Spring 2019: Finished second in the 100 meters at Louisiana 3A-4A-5A state track meet with a 10.75. Placed third in the 200 meters with a 21.63. Finished second in the high jump with a 6-0 (6-4 PR).,,,,,,,,,,,,,,,,
202000670,"Jordan Butler is a 6-3, 300-pound Defensive Tackle from Las Vegas, NV.",,,,,,,,,,,,,,,,
202000671,"Graham Barton is an Offensive Tackle from Brentwood, TN.",,,,,,,,,,,,,,,,
202000672,Two-sport athlete in football and basketball.,,,,,,,,,,,,,,,,
202000673,"Quentin Williams is a 6-3, 234-pound Strong-Side Defensive End from Charlotte, NC.",,,,,,,,,,,,,,,,
202000674,Daran Branch is a 2020 defensive back from Amite (La.) High School.,,,,,,,,,,,,,,,,
202000675,"Jonathan Mann is a 6-3, 205-pound Wide Receiver from Rosemount, MN.",,,,,,,,,,,,,,,,
202000676,2018: Named the District 5-5A-I Overall MVP as a junior.2017: Named the District 14-5A Two-Way Player of the Year as a sophomore.,,,,,,,,,,,,,,,,
202000677,2018: Was a first-team all-district selection as a junior,,,,,,,,,,,,,,,,
202000678,"Nate Matlack is a Defensive End from Olathe, KS.",,,,,,,,,,,,,,,,
202000679,"An early enrollee who is a three-star prospect listed as the No. 17 player in North Carolina and the nation’s 28th-ranked tight end in the 247Sports Composite • Ranked as the No. 20 player in the state and the nation’s 33rd-ranked tight end according to Rivals • Tabbed as the state’s No. 14 player and the nation’s 11th-ranked tight end-Y according to ESPN • Posted 61 receptions, 1,112 yards and 13 TDs over his first three prep seasons • Missed his senior season due to injury • Was tabbed a MaxPreps preseason all-state honoree • Named a preseason All-Gaston County selection • A Gaston Gazette/Shelby Star Dandy Dozen preseason honorable mention honoree • An all-state honoree as a junior • Tabbed All-Big South 3A first-team all-conference • An All-Gaston Gazette first-team selection • Helped Stuart Cramer to a 7-5 record and a spot in the state playoffs • Recorded 38 receptions for 635 yards and seven TDs • Claimed all-conference honors as a sophomore • Led the Storm to an 8-5 record and a berth in the second round of the state playoffs • Tallied 21 receptionsfor 438 yards and six TDs • A multi-sport athlete, who averaged 8.8 points and 8.1 rebounds per game on the basketball team • Earned all-conference honors as a junior • Coached by Ben McMillan.",,,,,,,,,,,,,,,,
202000680,"Timothy Lawson is a 6-5, 278-pound Offensive Tackle from Fort Washington, MD.",,,,,,,,,,,,,,,,
202000681,"Damarjhe Lewis is a Defensive Tackle from Griffin, GA.",,,,,,,,,,,,,,,,
202000682,2018: Earned first-team all-district honors as a junior.,,,,,,,,,,,,,,,,
202000683,2018: District 8-4A Division II Offensive MVP as a junior. Already the all-time rushing leader and all-time touchdown leader in Connally history.2017: Second-team all-district selection as a sophomore.,,,,,,,,,,,,,,,,
202000684,Dominic Richardson is a 2020 RB from Bishop McGuinness in Oklahoma City.,,,,,,,,,,,,,,,,
202000685,"Montra Edwards is a 6-3, 290-pound Strong-Side Defensive tackle from Jackson, MS.",,,,,,,,,,,,,,,,
202000686,"Courtland Ford is an Offensive Tackle from Cedar Hill, TX.",,,,,,,,,,,,,,,,
202000687,"Aydin Henningham is a Wide Receiver from Boynton Beach, FL.",,,,,,,,,,,,,,,,
202000688,"Alaka'i Gilman is a 5-11, 190-pound Cornerback from Honolulu, HI.",,,,,,,,,,,,,,,,
202000689,"Philip Blidi is a Defensive End from Portales, NM.",,,,,,,,,,,,,,,,
202000690,"K-Shawn Schulters is a 6-1, 175-pound Safety from Hammonton, NJ. He has committed to Villanova Wildcats.",,,,,,,,,,,,,,,,
202000691,Gabe Taylor is the younger brother of football legend Sean Taylor,,,,,,,,,,,,,,,,
202000692,"Originally from Belle Glade, Fla., where he played his senior season at Glades Central. Reported offers from Iowa State, UNLV, FAU, USF, Liberty, Southern Miss and South Dakota heading into his senior season.----2022: Named the ICCAC’s Most Valuable Offensive Player. In 11 games, caught 54 passes for 863 yards and 10 TD.2021: Totaled 777 receiving yards on 37 catches and 10 TD in 11 games.- Andrew Ivins",,,,,,,,,,,,,,,,
202000693,"Angelo Grose is a 5-10, 170-pound Cornerback from Mansfield, OH.",,,,,,,,,,,,,,,,
202000694,"Aydan White is a Cornerback from Arden, NC.",,,,,,,,,,,,,,,,
202000695,"Joey Hobert is a Wide Receiver from San Juan Capistrano, CA.",,,,,,,,,,,,,,,,
202000696,"Tyson McWilliams is a 6-2, 170-pound Cornerback from San Diego, CA.",,,,,,,,,,,,,,,,
202000698,"Armondous Cooley is a Defensive Tackle from Waynesboro, MS.",,,,,,,,,,,,,,,,
202000699,"JaQues Evans is an Athlete from Dublin, GA.",,,,,,,,,,,,,,,,
202000700,"Aaron Witt is a 6-5, 230-pound Strong-Side Defensive End from Winona, MN.",,,,,,,,,,,,,,,,
202000701,High-jumper and long-jumper during spring track and field season. Recorded 6-6 high jump PR and 22-5 long jump PR in April 2019.2018: Earned first-team all-district honors as a junior.2017: First-team all-district selection as a sophomore.,,,,,,,,,,,,,,,,
202000702,2018: Led Austin Regents School to an 11-2 record and state runner-up finish in the Texas Association of Private and Parochial Schools' Division II bracket.,,,,,,,,,,,,,,,,
202000703,2018: Was a first-team all-district selection as a junior,,,,,,,,,,,,,,,,
202000704,"Joey Wright is an Offensive Tackle from Reno, NV.",,,,,,,,,,,,,,,,
202000705,2022: Did not participate in game action during second year with the program … Named co-Offensive Scout Team Award winner at ECU's annual end of the year banquet.2021: Appeared in one game during his initial year with the Pirates ... Made collegiate debut against Charleston Southern as a member of special teams unit ... Did not record any stats.Personal: Major is communication ... Earned inclusion to the spring 2023 ECU Director of Athletics Honor Roll.,,,,,,,,,,,,,,,,
202000706,"Jayson Jones is a 5-11, 155-pound Wide Receiver from Birmingham, AL.",,,,,,,,,,,,,,,,
202000707,"Westley Neal is a 6-0, 285-pound Defensive Tackle from Miami, FL. Competes in throwing events for Gulliver's track and field team.",,,,,,,,,,,,,,,,
202000708,"Chris Long is a 6-0, 160-pound Athlete from Willingboro, NJ.",,,,,,,,,,,,,,,,
202000709,"Marcus Clarke is a 5-11, 175-pound Wide Receiver from Winter Park, FL.",,,,,,,,,,,,,,,,
202000710,"Keyshawn Smith is a 6-0, 165-pound Wide Receiver from San Diego, CA.",,,,,,,,,,,,,,,,
202000711,"Semaj Verner is a 6-2, 185-pound Safety from Lakewood, CA.",,,,,,,,,,,,,,,,
202000712,"Andy Alfieri is an Outside Linebacker from Portland, OR.",,,,,,,,,,,,,,,,
202000713,"Made 19 receptions for 277 yards and one touchdown as a senior…missed back half of season after injury…helped Haywood start 6-1 before being injured…played on both sides of the ball as a junior, helping lead Tomcats to state championship game and 10-5 final record…caught 10 passes for 150 yards as part of offense that averaged 34.7 points per game and added 70 tackles, four interceptions and two fumble recoveries on defense",,,,,,,,,,,,,,,,
202000714,"Douglas Emilien is a Wide Receiver from Fort Lauderdale, FL.",,,,,,,,,,,,,,,,
202000715,"Dejuan Butler is a 5-11, 180-pound Cornerback from Antioch, CA.",,,,,,,,,,,,,,,,
202000716,"Danny Striggow is a 6-4, 220-pound Weak-Side Defensive End from Long Lake, MN.",,,,,,,,,,,,,,,,
202000717,"Vershon Lee is a 6-3, 290-pound Offensive Tackle from Woodbridge, VA.",,,,,,,,,,,,,,,,
202000718,"Cameron Large is a 6-5, 232-pound Athlete from Pomfret, CT. He attends Noble & Greenough School in Dedham, MA.",,,,,,,,,,,,,,,,
202000719,"Tommy Guajardo is a 6-3, 230-pound Tight End from Dearborn, MI.",,,,,,,,,,,,,,,,
202000720,Donovan Johnson is a 2020 safety from Harvey (La.) Helen Cox.,,,,,,,,,,,,,,,,
202000721,"Caadyn Stephen is a 6-6, 295-pound Offensive Tackle from Camas, WA.",,,,,,,,,,,,,,,,
202000722,"Tee Webb is a 6-3, 170-pound Pro-Style Quarterback from Cartersville, GA.",,,,,,,,,,,,,,,,
202000723,Two-sport athlete in football and baseball who could potentially play both in college. Outfielder on the baseball diamond.,,,,,,,,,,,,,,,,
202000724,"Rickey Hyatt is an Athlete from Westerville, OH. Named third team defensive back on the All-Ohio team by the Ohio High School Athletic Association.",,,,,,,,,,,,,,,,
202000725,"De'Arre McDonald is a Cornerback from Murfreesboro, TN.",,,,,,,,,,,,,,,,
202000726,"Lanell Carr is a 6-3, 230-pound Outside Linebacker from Saint Louis, MO.",,,,,,,,,,,,,,,,
202000727,"Clarence Lewis is a 6-1, 185-pound Cornerback from Middletown, NJ.",,,,,,,,,,,,,,,,
202000728,Named Alabama Class 5A Basketball Player of the Year after averaging better than 18 points and 8 rebounds as a senior.,,,,,,,,,,,,,,,,
202000729,"DeMeer Blankumsee is a Wide Receiver from Cincinnati, OH.",,,,,,,,,,,,,,,,
202000730,"Marcus Harper is a 6-4, 290-pound Offensive Guard from Flossmoor, IL.",,,,,,,,,,,,,,,,
202000731,"Marvin Scott III is a 5-9, 195-pound Running Back from Port Orange, FL.",,,,,,,,,,,,,,,,
202000732,Two-sport athlete in football and track (100 meters; 10.87 PR).2019: Helped Noth Shore to a 16-0 season and second consecutive Texas 6A D-I state title as a senior.2018: Helped North Shore to an undefeated season (16-0) and the Texas 6A D-I state championship as a junior.,,,,,,,,,,,,,,,,
202000733,"Trey Paster is an Athlete from Atwater, CA.",,,,,,,,,,,,,,,,
202000734,"Alex Conn is a 6-6, 330-pound Offensive Tackle from Derby, KS.",,,,,,,,,,,,,,,,
202000735,"Kahlil Benson is an Offensive Tackle from Southaven, MS.",,,,,,,,,,,,,,,,
202000736,"Sean McLaughlin is a 6-7, 220-pound defensive lineman from Frankfort, IL.",,,,,,,,,,,,,,,,
202000737,"Jalen Logan-Redding is a Defensive End from Columbia, MO",,,,,,,,,,,,,,,,
202000738,Two-sport athlete in football and baseball who plans to play both in college.,,,,,,,,,,,,,,,,
202000739,"Chayil Garnett is a 6-2, 205-pound Dual-Threat Quarterback from Lake Wales, FL.",,,,,,,,,,,,,,,,
202000740,"Luke Petitbon is an Offensive Guard from Washington, DC.",,,,,,,,,,,,,,,,
202000741,"Kaleb Long is a 6-5, 178-pound Wide Receiver from Tampa, FL.",,,,,,,,,,,,,,,,
202000742,"Jake Wray is a 6-5, 280-pound Offensive Tackle from Franklin, TN.",,,,,,,,,,,,,,,,
202000743,"Mecose Todd is a 5-11, 206-pound Running Back from Villa Rica, GA.",,,,,,,,,,,,,,,,
202000744,"Talor Warner is a 6-4, 250-pound Offensive Tackle from Gardner, KS.",,,,,,,,,,,,,,,,
202000745,"Ben Finley is a Quarterback from Phoenix, AZ.",,,,,,,,,,,,,,,,
202000746,"James Robinson is an Offensive Guard from Montgomery, AL",,,,,,,,,,,,,,,,
202000747,"Christian Fitzpatrick is a Wide Receiver from West Bloomfield, MI.",,,,,,,,,,,,,,,,
202000748,"2018: Helped Owasso HS to the Oklahoma Class 6A-I state semifinals as a junior.2017: As a sophomore, helped Owasso HS to the Oklahoma Class 6A-I state title, the school's first.",,,,,,,,,,,,,,,,
202000750,"Dominick Hill is a Cornerback from Orlando, FL",,,,,,,,,,,,,,,,
202000751,"Robert Hanna is a 6-0, 170-pound Safety from Miami, FL.",,,,,,,,,,,,,,,,
202000752,"Brady Cook is a Quarterback from St. Louis, MO.",,,,,,,,,,,,,,,,
202000753,"Caleb Fauria is a Tight End from North Attleboro, MA.",,,,,,,,,,,,,,,,
202000754,Spring 2019: Texas 3A regional qualifier in the shot put (47-8 PR).2017: Earned first-team all-district honors at OLB and second-team at RB as a sophomore.,,,,,,,,,,,,,,,,
202000755,"Nehki Meredith is a DB from Virginia Beach, VA.",,,,,,,,,,,,,,,,
202000756,"Zion Alefosio is a 6-0, 197-pound Cornerback from Long Beach, CA.",,,,,,,,,,,,,,,,
202000757,"O'Donnell Fortune is a 6-2, 180-pound Cornerback from Sumter, SC.",,,,,,,,,,,,,,,,
202000758,"Makius Scott is a Defensive Lineman from Gainesville, GA.",,,,,,,,,,,,,,,,
202000759,"Martes Lewis is an Offensive Tackle from Merrillville, IN.",,,,,,,,,,,,,,,,
202000760,"Brian Balom is a 6-0, 179-pound Safety from Hollywood, FL.",,,,,,,,,,,,,,,,
202000761,"Ben Gulbranson is a Quarterback from Newbury Park, CA.",,,,,,,,,,,,,,,,
202000762,"Ty Hamilton is a 6-2, 240-pound Strong-Side Defensive End from Pickerington, OH.",,,,,,,,,,,,,,,,
202000763,"Michael Statham is a 6-6, 300-pound Offensive Tackle from Baltimore, MD.",,,,,,,,,,,,,,,,
202000764,"E. Jai Mason is a Wide Receiver from Jackson, MS.",,,,,,,,,,,,,,,,
202000765,A four-star prospect tabbed as the state’s No. 7 player and the nation’s 60th-ranked wide receiver by ESPN • A three-star prospect listed as the No. 10 player in Georgia in the 247Sports Composite • Selected to play in the 2019 Shrine Bowl of the Carolinas • Recorded 59 receptions for 993 yards and 11 TDs over his final two prep seasons • A SCFCA 5A all-state selection as a senior • Helped Sumter to a 10-1 record and a berth in the second round of the 5A playoffs • Posted 38 receptions for 593 yards and six TDs • Helped Sumter to a 10-1 record and the second round of the 5A state playoffs as a junior • Tallied 21 catches for 400 yards and five TDs • Also competed in basketball for three years and track and field for two • A four-year honor roll student • Coached by Mark Barnes.,,,,,,,,,,,,,,,,
202000766,"Justin Wodtly is a Defensive End from Cleveland, OH.",,,,,,,,,,,,,,,,
202000767,"HIGH SCHOOL: Four-year varsity letterwinner at Helen Cox High School in Harvey, Louisiana … Played linebacker for the Cougars, making the playoffs in two of the last three years of his high school career … Helped Helen Cox HS to its first playoff victory in over a decade in 2018 … CHOSE ARKANSAS OVER: Kentucky, LSU, Tennessee, Texas A&M, West Virginia and others.PERSONAL: Kelin Burrle (BURR-lay) … Son of Lashanona Burrle.",,,,,,,,,,,,,,,,
202000768,"T Lee is a 5-11, 172-pound athlete from Alpharetta, GA.",,,,,,,,,,,,,,,,
202000769,"Macen Williams is a 5-9, 150-pound Cornerback from Gardena, CA.",,,,,,,,,,,,,,,,
202000770,"Jonathan Odom is a 6-6, 240-pound Tight End from Tampa, FL.",,,,,,,,,,,,,,,,
202000771,Named Offensive Line MVP of The Opening Orlando in February 2019.Plays for high school baseball team.,,,,,,,,,,,,,,,,
202000772,"Jahmeer Carter is a 6-3, 297-pound Defensive Tackle from Severn, MD.",,,,,,,,,,,,,,,,
202000773,"Damien Alford is a Wide Receiver from Hollywood, FL. He moved to Florida from Canada prior to the 2019 football season.",,,,,,,,,,,,,,,,
202000774,"Devyn Curtis is a Linebacker from Brentwood, TN.",,,,,,,,,,,,,,,,
202000775,Went 50-3 as a heavyweight wrestler during his junior year,Motor,9,Athleticism,8,Hand Quickness,8,Explosiveness,8,Point of Attack,7,Strength,7,Versatility,6,Size,5
202000776,"Tyreem Powell is a 6-4, 185-pound Athlete from Vineland, NJ.",,,,,,,,,,,,,,,,
202000777,Jan. 2018: Next Level Athlete Houston Showcase OL MVP.,,,,,,,,,,,,,,,,
202000778,Erik Williams is a 2020 offensive tackle from Lubbock (Texas) Coronado.,,,,,,,,,,,,,,,,
202000779,"Austin Keys is a 6-2, 241-pound Inside Linebacker from Seminary, MS. He has committed to Ole Miss Rebels.",,,,,,,,,,,,,,,,
202000780,"Aeneas Peebles is a Defensive Tackle from Knightdale, NC.",,,,,,,,,,,,,,,,
202000781,"Jay Brunelle is a 6-2, 195-pound Wide Receiver from Paxton, MA. He attends St John's High School in Shrewsbury, MA.",,,,,,,,,,,,,,,,
202000782,"Keanu Tanuvasa is a 6-4, 270-pound Defensive Tackle from Mission Viejo, CA.",,,,,,,,,,,,,,,,
202000783,2018: Helped Tulsa Booker T. Washington to the state semifinals in Oklahoma Class 6A-II.,,,,,,,,,,,,,,,,
202000784,"Taurus Simmons is a 6-3, 210-pound Weak-Side Defensive End from Savannah, GA.",,,,,,,,,,,,,,,,
202000785,"Charlie Gordinier is a 6-5, 225-pound Tight End from Red Bank, NJ.",,,,,,,,,,,,,,,,
