player_id,year,rank,name,position,rating,high_school,city,state,committed_to,url,hs_athletic_background,flag_all_usa_first_team,flag_all_usa_second_team,flag_all_american_bowl,flag_all_america_game,flag_gatorade_poy,flag_state_poy,flag_the_opening,flag_maxpreps_all_american,height_inches,weight_lbs,pos_group
202102445,2021,2550,Ashton Logan,P,0.8,Orange Lutheran,Orange,CA,Colorado,https://247sports.com/player/ashton-logan-46094373/,"2019: As a junior, predominantly punted but also made 1 of 1 FGA and 3 of 4 PAT. Hit 12 of 37 punts inside the 20-yard line.",0.0,0.0,0.0,0.0,0.0,0.0,0.0,0.0,74.0,185.0,SPEC
202102464,2021,2572,James Evans,P,0.7989,ProKick Australia,New Zealand,NEW,Indiana,https://247sports.com/player/james-evans-46101921/,"James Evans is a 6-1, 207-pound Punter from Auckland, New Zealand that trained at ProKick Australia.",0.0,0.0,0.0,0.0,0.0,0.0,0.0,0.0,73.0,207.0,SPEC
202102475,2021,2584,Mitchell Tomasek,K,0.7983,Worthington Kilbourne,Columbus,OH,Eastern Michigan,https://247sports.com/player/mitchell-tomasek-46111652/,"Mitchell Tomasek is a Kicker from Columbus, OH.",0.0,0.0,0.0,0.0,0.0,0.0,0.0,0.0,,,SPEC
202102490,2021,2597,Jackson Ray,P,0.7967,Highland,Gilbert,AZ,Colorado State,https://247sports.com/player/jackson-ray-46102565/,"Jackson Ray is a 5-11, 150-pound Punter from Gilbert, AZ. He has committed to Colorado State Rams.",0.0,0.0,0.0,0.0,0.0,0.0,0.0,0.0,71.0,150.0,SPEC
202102524,2021,2637,John McConnell,P,0.7944,Morgantown,Morgantown,WV,Marshall,https://247sports.com/player/john-mcconnell-46086461/,"John McConnell is a Punter from Morgantown, WV.",0.0,0.0,0.0,0.0,0.0,0.0,0.0,0.0,76.0,190.0,SPEC
202102534,2021,2649,Jayden Tate,LS,0.7937,North Lincoln,Lincolnton,NC,NC State,https://247sports.com/player/jayden-tate-46101221/,"Jayden Tate is a 5-11, 245-pound Long Snapper from Lincolnton, NC. He has committed to NC State Wolfpack.",0.0,0.0,0.0,0.0,0.0,0.0,0.0,0.0,71.0,265.0,SPEC
202102547,2021,2657,Michael Hughes,K,0.7933,George Washington,Charleston,WV,Appalachian State,https://247sports.com/player/michael-hughes-46104113/,"Michael Hughes is a 6-3, 160-pound Kicker from Charleston, WV. He has committed to Appalachian State Mountaineers.",0.0,0.0,0.0,0.0,0.0,0.0,0.0,0.0,75.0,160.0,SPEC
202102588,2021,2704,Zack Taylor,LS,0.7889,Parsippany Hills,Morris Plains,NJ,Rutgers,https://247sports.com/player/zack-taylor-46101531/,"Zack Taylor is a 6-0, 220-pound Long Snapper from Morris Plains, NJ.",0.0,0.0,0.0,0.0,0.0,0.0,0.0,0.0,72.0,220.0,SPEC
202102597,2021,2712,Scott Renfroe,K,0.7867,Pike Liberal Arts School,Troy,AL,Troy,https://247sports.com/player/scott-renfroe-46102108/,"Scott Renfroe is a 6-0, 175-pound Kicker from Troy, AL. He has committed to Troy Trojans.",0.0,0.0,0.0,0.0,0.0,0.0,0.0,0.0,72.0,175.0,SPEC
202102599,2021,2714,Zane Smith,P,0.7867,N Myrtle Beach,Little River,SC,Florida State,https://247sports.com/player/zane-smith-46093762/,"Zane Smith is a Kicker from Little River, SC.",0.0,0.0,0.0,0.0,0.0,0.0,0.0,0.0,74.0,190.0,SPEC
202102616,2021,2729,Collyn Hopkins,K,0.7844,Bradley-Bourbonnais,Bradley,IL,San Diego State,https://247sports.com/player/collyn-hopkins-46100042/,"Collyn Hopkins is a 6-2, 210-pound Kicker from Bradley, IL. He has committed to San Diego State Aztecs.",0.0,0.0,0.0,0.0,0.0,0.0,0.0,0.0,74.0,210.0,SPEC
202102709,2021,2827,Casey Magyar,K,0.7633,Dublin Coffman,Dublin,OH,Kent State,https://247sports.com/player/casey-magyar-46111795/,"Casey Magyar is a Kicker from Dublin, OH.",0.0,0.0,0.0,0.0,0.0,0.0,0.0,0.0,71.0,165.0,SPEC
202102710,2021,2827,Benjamin Lisk,LS,0.7633,Paradise Valley,Phoenix,AZ,Toledo,https://247sports.com/player/benjamin-lisk-46111831/,"Benjamin Lisk is a 5-10, 210-pound Long Snapper from Phoenix, AZ.",0.0,0.0,0.0,0.0,0.0,0.0,0.0,0.0,70.0,210.0,SPEC
202102713,2021,2830,Jake Marion,K,0.7583,North Davidson,Lexington,NC,Georgia State,https://247sports.com/player/jake-marion-46101565/,"Jake Marion is a 5-11, 180-pound Kicker from Lexington, NC. He has committed to Army Black Knights.",0.0,0.0,0.0,0.0,0.0,0.0,0.0,0.0,71.0,180.0,SPEC
202102716,2021,2834,Britton Williams,K,0.7533,Richmond Hill,Richmond Hill,GA,Georgia Southern,https://247sports.com/player/britton-williams-46111761/,"Britton Williams is a 5-11, 170-pound Kicker from Richmond Hill, GA.",0.0,0.0,0.0,0.0,0.0,0.0,0.0,0.0,71.0,170.0,SPEC
202102717,2021,2834,Tanner Luther,K,0.7533,Chambersburg Area,Chambersburg,PA,Eastern Michigan,https://247sports.com/player/tanner-luther-46113610/,"Tanner Luther is a 5-9, 175-pound Kicker from Chambersburg, PA.",0.0,0.0,0.0,0.0,0.0,0.0,0.0,0.0,69.0,175.0,SPEC
202102718,2021,2834,Zach Zoglio,LS,0.7533,Anderson,Cincinnati,OH,Eastern Michigan,https://247sports.com/player/zach-zoglio-46113716/,"Zach Zoglio is a 6-0, 215-pound Long Snapper from Cincinnati, OH.",0.0,0.0,0.0,0.0,0.0,0.0,0.0,0.0,72.0,215.0,SPEC
202201537,2022,1614,Alex McPherson,K,0.8378,Fort Payne,Fort Payne,AL,Auburn,https://247sports.com/player/alex-mcpherson-46093880/,"Alex McPherson is a Kicker from Fort Payne, AL.",0.0,0.0,0.0,0.0,0.0,0.0,0.0,0.0,70.0,155.0,SPEC
202201615,2022,1688,Ethan Moczulski,K,0.8356,Mt. Spokane,Mead,WA,Texas A&M,https://247sports.com/player/ethan-moczulski-46117769/,2022 All-American Bowl selection,0.0,0.0,1.0,0.0,0.0,0.0,0.0,0.0,71.0,185.0,SPEC
202201724,2022,1818,Will Stone,K,0.83,Regents School,Austin,TX,Texas,https://247sports.com/player/will-stone-46111578/,"Will Stone is a Kicker from Austin, TX.",0.0,0.0,0.0,0.0,0.0,0.0,0.0,0.0,72.0,175.0,SPEC
202201725,2022,1818,Will Bettridge,K,0.83,Gulliver Prep,Miami,FL,Virginia,https://247sports.com/player/will-bettridge-46058859/,Also plays baseball.,0.0,0.0,0.0,0.0,0.0,0.0,0.0,0.0,71.0,165.0,SPEC
202201731,2022,1829,Brett Thorson,P,0.8293,ProKick Australia,Australia,AUST,Georgia,https://247sports.com/player/brett-thorson-46115223/,"Brett Thorson is a 6-2, 205-pound Punter from Australia, AUST.",0.0,0.0,0.0,0.0,0.0,0.0,0.0,0.0,74.0,205.0,SPEC
202201746,2022,1843,Evan Crenshaw,P,0.8283,Nease,Ponte Vedra Beach,FL,Coastal Carolina,https://247sports.com/player/evan-crenshaw-46116377/,2020: Averaged 32.2 yards per punt. Downed six of them inside the opponent's 20-yard line.,0.0,0.0,0.0,0.0,0.0,0.0,0.0,0.0,75.0,180.0,SPEC
202201757,2022,1859,Trevor Helburg,K,0.8278,Crosby,Crosby,TX,Houston,https://247sports.com/player/trevor-helburg-46103912/,2020: MaxPreps Junior All-American second-team selection. Helped Crosby reach the Class 5A-Division II state championship game. Kicked 66 touchbacks. Ten of his 16 made field goals ranged from 35 to 42 yards.,0.0,0.0,0.0,0.0,0.0,0.0,0.0,1.0,72.0,175.0,SPEC
202201765,2022,1869,Jack Stone,K,0.8267,Highland Park,Dallas,TX,Michigan State,https://247sports.com/player/jack-stone-46117362/,"2020: Hit 4 of 6 field-goal attempts, including a long of 36 yards, as a junior. Also kicked 51 touchbacks on kickoffs.",0.0,0.0,0.0,0.0,0.0,0.0,0.0,0.0,72.0,186.0,SPEC
202201766,2022,1869,Nathan Dibert,K,0.8267,Hartland,Hartland,MI,LSU,https://247sports.com/player/nathan-dibert-46117913/,"Nathan Dibert is a Kicker from Hartland, MI.",0.0,0.0,0.0,0.0,0.0,0.0,0.0,0.0,71.0,195.0,SPEC
202201799,2022,1897,Alex Bacchetta,P,0.8259,Westminster School,Atlanta,GA,Penn State,https://247sports.com/player/alex-bacchetta-46103591/,Was a MaxPreps Sophomore All-American in 2019.,0.0,0.0,0.0,0.0,0.0,0.0,0.0,1.0,75.0,200.0,SPEC
202201801,2022,1897,Robert Gunn,K,0.8259,Pinellas Park,Largo,FL,Clemson,https://247sports.com/player/robert-gunn-46117077/,"Robert Gunn is a 6-2, 165-pound Kicker from Largo, FL. He has committed to Clemson Tigers.",0.0,0.0,0.0,0.0,0.0,0.0,0.0,0.0,74.0,165.0,SPEC
202201827,2022,1931,Carter Brown,K,0.8244,Pearland Dawson,Pearland,TX,Arizona State,https://247sports.com/player/carter-brown-46097995/,2019: Was named a MaxPreps Sophomore All-American,0.0,0.0,0.0,0.0,0.0,0.0,0.0,1.0,73.0,185.0,SPEC
202201842,2022,1950,Oliver Straw,P,0.8226,ProKick Australia,Australia,AUST,West Virginia,https://247sports.com/player/oliver-straw-46127949/,"Oliver Straw is a Punter from Australia, AUST.",0.0,0.0,0.0,0.0,0.0,0.0,0.0,0.0,75.0,220.0,SPEC
202201843,2022,1950,Trey Smack,K,0.8226,Severna Park,Severna Park,MD,Florida,https://247sports.com/player/trey-smack-46117657/,"Trey Smack is a 6-2, 200-pound Kicker from Severna Park, MD.",0.0,0.0,0.0,0.0,0.0,0.0,0.0,0.0,74.0,200.0,SPEC
202201849,2022,1958,Buck Buchanan,K,0.8222,Marshall,Marshall,TX,Louisiana Tech,https://247sports.com/player/buck-buchanan-46118635/,"Buck Buchanan is a Kicker from Marshall, TX.",0.0,0.0,0.0,0.0,0.0,0.0,0.0,0.0,70.0,170.0,SPEC
202201850,2022,1958,Aidan Birr,K,0.8222,Kennedale,Kennedale,TX,Georgia Tech,https://247sports.com/player/aidan-birr-46118274/,"Aiden Birr is a Kicker from Kennedale, TX.",0.0,0.0,0.0,0.0,0.0,0.0,0.0,0.0,73.0,190.0,SPEC
202201857,2022,1964,Sam Candotti,P,0.8217,ProKick Australia,Australia,AUST,Boston College,https://247sports.com/player/sam-candotti-46117919/,"Sam Candotti is a Punter from Australia, AUST. He has committed to Boston College Eagles.",0.0,0.0,0.0,0.0,0.0,0.0,0.0,0.0,,,SPEC
202201900,2022,2016,Max Fletcher,P,0.8196,ProKick Australia,Australia,AUST,Arkansas,https://247sports.com/player/max-fletcher-46127994/,"2022 (FRESHMAN): Played in nine games during his first campaign with the Razorbacks, punting 38 times for an average of 37.5 yards … Booted three punts of 50+ yards, including a career-best 51 yards … Had 14 of his 38 punts fair caught and 14 inside the 20-yard line … Punted six times for 231 yards in his collegiate debut, a win over Cincinnati (Sept. 3) and his brother Mason, who punts for the Bearcats … Three punts for 107 yards vs. South Carolina (Sept. 10) … Averaged 35.7 yards over three punts against Missouri State (Sept. 17) … His six punts vs. Texas A&M went for 218 yards (36.3 ypp) … Career-high eight punts vs. Alabama averaged 42.5 yards … Punted once at Mississippi State for 25 yards and once vs. LSU for 31 yards … Four punts for 137 yards (34.3 ypp) in win over Ole Miss (Nov. 19) … Averaged 37 yards per punt on six punts in win over Kansas in the AutoZone Liberty Bowl (Dec. 28).PRIOR TO ARKANSAS: Rated the No. 5 punter in the national recruiting class by 247Sports … Product of ProKick Australia in Melbourne, Australia … Coached by Nathan Chapman and John Smith.PERSONAL: Son of Dustin and Suzanne Fletcher … Has one brother, Mason … Father, Dustin, played 23 years of Australian rules football in the Australian Football League, playing all 23 seasons for Essendon Football Club and representing Australia in international competitions … Brother, Mason, is the starting punter at Cincinnati … Born October 9, 2002.",0.0,0.0,0.0,0.0,0.0,0.0,0.0,0.0,77.0,190.0,SPEC
202201912,2022,2031,John Love,K,0.8181,Spartanburg,Spartanburg,SC,Virginia Tech,https://247sports.com/player/john-love-46118440/,"John Love is a Kicker from Spartanburg, SC.",0.0,0.0,0.0,0.0,0.0,0.0,0.0,0.0,71.0,155.0,SPEC
202201919,2022,2039,Jackson Smith,K,0.817,Boyle County,Danville,KY,Kentucky,https://247sports.com/player/jackson-smith-46102763/,"Jackson Smith is a Kicker from Danville, KY.",0.0,0.0,0.0,0.0,0.0,0.0,0.0,0.0,71.0,170.0,SPEC
202201937,2022,2061,Tyler Perkins,P,0.8163,Norwalk,Norwalk,OH,Iowa State,https://247sports.com/player/tyler-perkins-46116378/,"Tyler Perkins is a 6-0, 184-pound Punter from Norwalk, OH. He has committed to Iowa State Cyclones.",0.0,0.0,0.0,0.0,0.0,0.0,0.0,0.0,72.0,184.0,SPEC
202201959,2022,2091,Bryce McFerson,P,0.8144,Metrolina Christian Academy,Indian Trail,NC,Notre Dame,https://247sports.com/player/bryce-mcferson-46108955/,"Bryce McFerson is a Punter from Indian Trail, NC.",0.0,0.0,0.0,0.0,0.0,0.0,0.0,0.0,73.0,185.0,SPEC
202201970,2022,2103,AJ Vinatieri,K,0.8133,Zionsville,Zionsville,IN,Ball State,https://247sports.com/player/aj-vinatieri-46110472/,"AJ Vinatieri is a Kicker from Zionsville, IN.",0.0,0.0,0.0,0.0,0.0,0.0,0.0,0.0,72.0,178.0,SPEC
202201979,2022,2113,Tom Ellard,P,0.8126,ProKick Australia,Australia,AUST,Western Kentucky,https://247sports.com/player/tom-ellard-46113387/,Tom Ellard is a Punter from Australia,0.0,0.0,0.0,0.0,0.0,0.0,0.0,0.0,74.0,190.0,SPEC
202201984,2022,2115,Jackson Smith,P,0.8119,Saraland,Saraland,AL,Clemson,https://247sports.com/player/jackson-smith-46128983/,"Jackson Smith is a 6-5, 246-pound Punter from Saraland, AL.",0.0,0.0,0.0,0.0,0.0,0.0,0.0,0.0,77.0,227.0,SPEC
202202014,2022,2150,Atticus Bertrams,P,0.8107,ProKick Australia,Australia,AUST,USC,https://247sports.com/player/atticus-bertrams-46128037/,Atticus Bertrams is a Punter from Australia,0.0,0.0,0.0,0.0,0.0,0.0,0.0,0.0,75.0,215.0,SPEC
202202089,2022,2237,James Ferguson-Reynolds,P,0.8033,ProKick Australia,Australia,AUST,Boise State,https://247sports.com/player/james-ferguson-reynolds-46127928/,James Ferguson is a Punter from Australia,0.0,0.0,0.0,0.0,0.0,0.0,0.0,0.0,73.0,175.0,SPEC
202202090,2022,2237,Sam Vander Haar,P,0.8033,ProKick Australia,Australia,AUST,Pittsburgh,https://247sports.com/player/sam-vander-haar-46117314/,Sam Vander Haar is a Punter from Australia.,0.0,0.0,0.0,0.0,0.0,0.0,0.0,0.0,,,SPEC
202202118,2022,2270,Braeden McAlister,K,0.7989,Porter Ridge,Indian Trail,NC,Charlotte,https://247sports.com/player/braeden-mcalister-46115532/,"Braeden McAlister is a Kicker from Indian Trail, NC.",0.0,0.0,0.0,0.0,0.0,0.0,0.0,0.0,74.0,180.0,SPEC
202202129,2022,2284,Jordan Doelling,P,0.7978,ProKick Australia,Australia,AUST,FIU,https://247sports.com/player/jordan-doelling-46127974/,"Jordan Doelling is a Punter from Australia, AUST. He has committed to FIU Golden Panthers.",0.0,0.0,0.0,0.0,0.0,0.0,0.0,0.0,76.0,230.0,SPEC
202202157,2022,2314,Eli Stein,LS,0.7911,Cambridge,Cambridge,WI,Arkansas,https://247sports.com/player/eli-stein-46117667/,"2024 Patrick Mannelly Award Watch List2023 Patrick Mannelly Award Watch List2022 Freshman All-SEC2023 (SOPHOMORE): Started all 12 games and served as the team’s primary long snapper for the second straight season … Made his first career tackle vs. BYU (Sept. 16) … Recorded 118 snaps according to Pro Football Focus, making every snap on special teams during the season.2022 (FRESHMAN): Started the first 11 games of the season as the team’s long snapper before a finger injury forced him to miss the final two games of the season … Logged 116 special teams snaps according to Pro Football Focus with 59 on the punt unit and 54 on the field goal unit.HIGH SCHOOL: Consensus five-star prospect by Kohl’s Kicking and Rubio Long Snapping … Rated the No. 2 long snapper in the country by Kohl’s Kicking … No. 3 long snapper nationally per Rubio Long Snapping … Played tight end and linebacker in addition to snapping for head coach Mike Klingbeil at Cambridge High School … Team captain … Also played basketball and competed in track & field … CHOSE ARKANSAS OVER: Baylor, Illinois, Stanford, Wisconsin and others.PERSONAL: Son of Jeff and Heide Stein … Father, Jeff, played football at Wisconsin … Has one brother, Ezra, and two sisters, Elyssa and Emily … Born April 11, 2004.",0.0,0.0,0.0,0.0,0.0,0.0,0.0,0.0,75.0,215.0,SPEC
202202158,2022,2314,Lance St. Louis,LS,0.7911,Williams Field,Gilbert,AZ,Texas,https://247sports.com/player/lance-st-louis-46116918/,"Lance St. Louis is a Long Snapper from Gilbert, AZ.",0.0,0.0,0.0,0.0,0.0,0.0,0.0,0.0,73.0,215.0,SPEC
202202170,2022,2322,Jackson Ross,P,0.7894,ProKick Australia,Australia,AUST,Tennessee,https://247sports.com/player/jackson-ross-46134664/,"Jackson Ross is a 6-3, 190-pound Punter from Australia.",0.0,0.0,0.0,0.0,0.0,0.0,0.0,0.0,75.0,190.0,SPEC
202202187,2022,2348,Rino Monteforte,LS,0.7844,Kellenberg Memorial,Uniondale,NY,Notre Dame,https://247sports.com/player/rino-monteforte-46118056/,"Rino Monteforte is a Long Snapper from Uniondale, NY.",0.0,0.0,0.0,0.0,0.0,0.0,0.0,0.0,69.0,215.0,SPEC
202202223,2022,2395,Nate Merchant,LS,0.7633,Easley,Easley,SC,Coastal Carolina,https://247sports.com/player/nate-merchant-46130655/,"Nate Merchant is a 6-1, 205-pound Long Snapper from Easley, SC. Merchant has a 247Sports rating of 70, making him a 2-star prospect.He has committed to Coastal Carolina Chanticleers.",0.0,0.0,0.0,0.0,0.0,0.0,0.0,0.0,73.0,205.0,SPEC
202301408,2023,1487,Tyler White,P,0.85,Southlake Carroll,Southlake,TX,Texas A&M,https://247sports.com/player/tyler-white-46118248/,"Also plays baseball.2023 All-American Bowl selection who scored 205 career points at kicker (17 of 19 FG, 154 of 156 PAT) and averaged 43.3 yards on 58 punts, including 27 inside the 20-yard line and a long of 62 yards.-----2022: Averaged 45.4 yards on 17 punts as a senior. Posted a long of 58 yards and five punts inside the 20-yard line. Also hit 7 of 7 field-goal attempts with a long of 50 yards, as well as all 74 PAT attempts.2021: MaxPreps Second-Team Junior All-American as a punter. Texas District 4-6A unanimous first-team selection as both punter and kicker. Averaged 42.3 yards across 36 punts, 21 of which landed inside the 20-yard line. Posted a long of 62 yards. Made 10 of 12 field-goal attempts, including a career-long 55-yarder. Also hit 79 of 81 PAT tries.2020: Debuted as a sophomore with five punts averaging 42.8 yards, including a long of 50 and one inside the 20-yard line. Also made lone PAT try.",0.0,0.0,1.0,0.0,0.0,0.0,0.0,1.0,75.0,202.0,SPEC
202301827,2023,1952,Peyton Woodring,K,0.8333,Ascension Episcopal,Lafayette,LA,Georgia,https://247sports.com/player/peyton-woodring-46134782/,2021: Averaged 7.5 points per game and totaled 82 points as a junior. Connected on 13 of 17 field-goal attempts with a long of 56 and made 43 of 44 PATs.,0.0,0.0,0.0,0.0,0.0,0.0,0.0,0.0,70.0,165.0,SPEC
202301970,2023,2106,Aidan Flintoft,P,0.8256,Oaks Christian,Westlake Village,CA,Stanford,https://247sports.com/player/aidan-flintoft-46133143/,Also plays volleyball at the varsity level.2021: MaxPreps Junior All-American as a punter. MaxPreps All-California first-team selection as a kicker. Hit a state-best 13 field goals (missed only three attempts) and had 59 touchbacks while average 40.1 yards per punt.,0.0,0.0,0.0,0.0,0.0,0.0,0.0,1.0,73.5,185.0,SPEC
202301990,2023,2124,Brock Taylor,K,0.825,Knoxville Catholic,Knoxville,TN,Vanderbilt,https://247sports.com/player/brock-taylor-46131832/,Grew up playing soccer.,0.0,0.0,0.0,0.0,0.0,0.0,0.0,0.0,74.0,160.0,SPEC
202302005,2023,2145,David Olano,K,0.8244,Naperville North,Naperville,IL,Illinois,https://247sports.com/player/david-olano-46130539/,2023 All-American Bowl selection,0.0,0.0,1.0,0.0,0.0,0.0,0.0,0.0,70.0,160.0,SPEC
202302007,2023,2145,Conor Talty,K,0.8244,St. Rita,Chicago,IL,Alabama,https://247sports.com/player/conor-talty-46135585/,"2022: In first game of senior season, hit from 51 yards.2021: As a junior, connected on 9 of 13 field goal attempts with a long of 42 yards while also going 51 of 52 on PAT attempts. When it came to kickoffs, credited with 28 touchbacks (44.4 percent) over the course of the season. Also punted for St. Rita and averaged 38.2 yards per boot with four of those punts downed inside the opponent’s 20-yard line.",0.0,0.0,0.0,0.0,0.0,0.0,0.0,0.0,73.0,195.0,SPEC
202302040,2023,2187,Nicolas Radicic,K,0.8211,Coppell,Coppell,TX,Indiana,https://247sports.com/player/nicolas-radicic-46129697/,2023 All-American Bowl selection,0.0,0.0,1.0,0.0,0.0,0.0,0.0,0.0,71.0,180.0,SPEC
202302074,2023,2226,Palmer Williams,P,0.8203,Davie County,Mocksville,NC,Baylor,https://247sports.com/player/palmer-williams-46131166/,"Also does track & field and has played lacrosse in high school … Regional qualifier in the discus 11th grade year with a personal best 136-8 in the event … Older brother, Spencer Williams, signed to throw at UNC after earning Gatorade Player of the Year honors and capturing a North Carolina 4A state title in the shot put.2021: As a junior, averaged 36.8 yards per punt. Downed four inside the 20. Also doubled as school’s kicker. Connected on 54 of 56 PAT attempts. Hit a 47-yard field goal, as well.",0.0,0.0,0.0,0.0,1.0,0.0,0.0,0.0,75.0,190.0,SPEC
202302092,2023,2245,Tristan Alvano,K,0.8194,Omaha Westside,Omaha,NE,Nebraska,https://247sports.com/player/tristan-alvano-46136748/,"Tristan Alvano is a 6-2, 185-pound Kicker from Omaha, NE.",0.0,0.0,0.0,0.0,0.0,0.0,0.0,0.0,74.0,185.0,SPEC
202302108,2023,2258,Caleb McGrath,P,0.817,Eastview Senior,Saint Paul,MN,Minnesota,https://247sports.com/player/caleb-mcgrath-46130537/,"2021: As a junior, averaged 41.7 yards per punt. Downed eight inside the 20 with a long of 64 yards. Earned all-district honors.",0.0,0.0,0.0,0.0,0.0,0.0,0.0,0.0,75.0,175.0,SPEC
202302116,2023,2271,Adam Samaha,K,0.8169,Huron,Ann Arbor,MI,Michigan,https://247sports.com/player/adam-samaha-46118303/,"Adam Samaha is a Kicker from Ann Arbor, MI.",0.0,0.0,0.0,0.0,0.0,0.0,0.0,0.0,72.0,170.0,SPEC
202302117,2023,2271,Declan Duley,P,0.8169,El Paso-Gridley,El Paso,IL,Illinois,https://247sports.com/player/declan-duley-46133047/,"Lefty that also has experience holding. Also competes in track and field at the high school level. Posted personal bests of 132-2 in the discus and 40-8 in the shot as an 11th grader. Big into weightlifting (245 power clean, 285 bench).2021: Served as team’s punter, kicker and kickoff specialist. Averaged 37.2 yards per punt with a long of 51. Hit on 13 of 14 PAT attempts per MaxPreps and was a perfect 3-of-3 on FGs. Also had five touchbacks on 27 kickoffs.",0.0,0.0,0.0,0.0,0.0,0.0,0.0,0.0,74.0,200.0,SPEC
202302118,2023,2273,Jackson Kleather,K,0.8167,Tippecanoe,Tipp City,OH,Bowling Green,https://247sports.com/player/jackson-kleather-46138038/,"Jackson Kleather is a 5-10, 170-pound Kicker from Tipp City, OH.",0.0,0.0,0.0,0.0,0.0,0.0,0.0,0.0,70.0,170.0,SPEC
202302138,2023,2287,Blake Craig,K,0.8156,Liberty North,Liberty,MO,Missouri,https://247sports.com/player/blake-craig-46137288/,"Blake Craig is a 5-11, 180-pound Kicker from Liberty, MO.",0.0,0.0,0.0,0.0,0.0,0.0,0.0,0.0,71.0,180.0,SPEC
202302153,2023,2312,Mitch Lake,P,0.8144,ProKick Australia,Australia,AUST,Appalachian State,https://247sports.com/player/mitch-lake-46135869/,From Australia. A member of ProKick Australia.,0.0,0.0,0.0,0.0,0.0,0.0,0.0,0.0,71.0,195.0,SPEC
202302154,2023,2312,Tyler Black,K,0.8144,Goochland,Goochland,VA,Wake Forest,https://247sports.com/player/tyler-black-46135927/,"Also pole vaults. Two-time state champion in the event after placing 6th as a freshman.2021: Virginia 3A second-team all-state selection as a kicker. Connected on 4 of 6 FG attempts with a long of 38. Also went 26 of 31 on PATs. When it came to kickoffs, had a 45 percent touchback rate.",0.0,0.0,0.0,0.0,0.0,0.0,0.0,0.0,73.0,160.0,SPEC
202302170,2023,2336,Grant Reddick,K,0.8136,Boone,Orlando,FL,UCF,https://247sports.com/player/grant-reddick-46132310/,"Also plays soccer.2022: Connected from 46 yards in spring game with no rush.2021: As a junior, hit 51 touchbacks on 60 kickoffs for a Boone program that won a district title in Florida’s highest classification. Averaged 43.8 yards per punt. Worked behind senior Brady Myers, who signed with Virginia Union.",0.0,0.0,0.0,0.0,0.0,0.0,0.0,0.0,70.0,190.0,SPEC
202302177,2023,2340,Connor Gibbs,K,0.8117,Metairie Park Country Day,Metairie,LA,Southern Miss,https://247sports.com/player/connor-gibbs-46138014/,Also plays soccer.-----2022: Made 7 of 9 FGA with a long of 49 yards as a senior. Also made 13 of 14 PAT.,0.0,0.0,0.0,0.0,0.0,0.0,0.0,0.0,70.0,175.0,SPEC
202302178,2023,2347,Grant Meadors,K,0.8111,Liberty,Bakersfield,CA,Oregon,https://247sports.com/player/grant-meadors-46115960/,"2021: MaxPreps All-California second-team selection as a punter. Averaged 41.2 yards per punt, downing 13 inside the opponent’s 20-yard line. Hit a 41-yard field goal.",0.0,0.0,0.0,0.0,0.0,0.0,0.0,0.0,72.0,165.0,SPEC
202302179,2023,2348,Hudson Kaak,P,0.8108,ProKick Australia,Australia,AUST,Oklahoma State,https://247sports.com/player/hudson-kaak-46135967/,From Australia. Played Aussie rules football in the NAB League with the Murray Bushrangers before enrolling at ProKick Australian.,0.0,0.0,0.0,0.0,0.0,0.0,0.0,0.0,73.0,190.0,SPEC
202302213,2023,2384,Gianni Spetic,K,0.8083,Notre Dame-Cathedral Latin School,Chardon,OH,Ohio,https://247sports.com/player/gianni-spetic-46139093/,"Gianni Spetic is a Kicker from Chardon, OH.",0.0,0.0,0.0,0.0,0.0,0.0,0.0,0.0,73.0,190.0,SPEC
202302271,2023,2454,Reese Keeney,P,0.7989,Farragut,Knoxville,TN,Rice,https://247sports.com/player/reese-keeney-46134944/,"Reese Keeney is a Punter from Knoxville, TN.",0.0,0.0,0.0,0.0,0.0,0.0,0.0,0.0,71.0,175.0,SPEC
202302272,2023,2455,Jake Eldridge,LS,0.7983,IMG Academy,Bradenton,FL,Rutgers,https://247sports.com/player/jake-eldridge-46097440/,Originally from Texas.,0.0,0.0,0.0,0.0,0.0,0.0,0.0,0.0,72.0,190.0,SPEC
202302273,2023,2455,Michael Petro,K,0.7983,Marcus,Flower Mound,TX,Uncommitted,https://247sports.com/player/michael-petro-46128575/,"2021: Hit 7 of 8 field goals as a junior, including a long of 51.",0.0,0.0,0.0,0.0,0.0,0.0,0.0,0.0,69.0,175.0,SPEC
202302298,2023,2489,Alex Smith,P,0.7894,ProKick Australia,Australia,AUST,Georgia Southern,https://247sports.com/player/alex-smith-46118101/,"Alex Smith is a Punter from Melbourne, Australia. He has committed to Vanderbilt Commodores.",0.0,0.0,0.0,0.0,0.0,0.0,0.0,0.0,78.0,220.0,SPEC
202302300,2023,2489,Ryder Burns,LS,0.7894,Lake Cormorant,Lake Cormorant,MS,Southern Miss,https://247sports.com/player/ryder-burns-46137467/,"Ryder Burns is a Long Snapper from Lake Cormorant, MS.",0.0,0.0,0.0,0.0,0.0,0.0,0.0,0.0,73.0,190.0,SPEC
202302307,2023,2500,Trey Dubuc,LS,0.7844,Cardinal Gibbons,Fort Lauderdale,FL,South Florida,https://247sports.com/player/trey-dubuc-46134289/,Also plays rugby.,0.0,0.0,0.0,0.0,0.0,0.0,0.0,0.0,74.0,220.0,SPEC
