Score Range,Career Designation,College Outlook,Professional Outlook
80 – 100,Elite Power 4,All-Conference/All-American honors., First round NFL Draft talent
70 – 80,Meaningful P4 Contributor,Reliable multi-year starter at the highest level of competition.,Potential Day 2 Pick
60 – 70,Meaningful G5 Contributor,Standout starter at the Group of 5 level; high-end depth in Power 4.,Potential Day 3 Pick
50 – 60,Multi-Year Starter,Consistent career presence; reliable rotational player or specialist.,N/A
40 – 50,Single Season Contributor,Late bloomer or one-year starter; limited career longevity.,N/A
20 – 40,Partial Season Contributor,Rotational backup or special teams contributor; limited starts.,N/A
0 – 20,Minimal D1 Impact,Roster filler; medical DQ; or transferred to lower levels.,N/A
