player_id,hs_athletic_background,skill_1,skill_1_rating,skill_2,skill_2_rating,skill_3,skill_3_rating,skill_4,skill_4_rating,skill_5,skill_5_rating,skill_6,skill_6_rating,skill_7,skill_7_rating,skill_8,skill_8_rating
202101701,"Jadai Smith is a 6-2, 170-pound Safety from Orlando, FL. He has committed to Florida Atlantic Owls.",,,,,,,,,,,,,,,,
202101702,"Roscoe Gibson is a 6-0, 170-pound Wide Receiver from Miami, FL.",,,,,,,,,,,,,,,,
202101703,"Corey Walker is a Tight End from Normal, IL.",,,,,,,,,,,,,,,,
202101704,2019: Helped Denton Guyer to a 14-2 record and a state title game appearance in the Texas 6A D-II playoff bracket as a junior.,,,,,,,,,,,,,,,,
202101705,"Tylon Dunlap is a Defensive End from Charlotte, NC.",,,,,,,,,,,,,,,,
202101706,Two-sport athlete in football and basketball (helped South Grand Prairie to 6A basketball playoff berth as a junior).2019: First-team all-district Texas 7-6A at ILB as a junior; helped South Grand Prairie to a Texas 6A D-I first-round playoff appearance.,,,,,,,,,,,,,,,,
202101707,"Jatavious Magee is an Athlete from Federal Way, WA.",,,,,,,,,,,,,,,,
202101708,"Trevion Stevenson is a 6-4, 217-pound Weak-Side Defensive End from Hampton, VA.",,,,,,,,,,,,,,,,
202101709,"Dalton Dueweke is a 6-4, 270-pound Offensive Guard from Utica, MI.",,,,,,,,,,,,,,,,
202101710,"JT Hand is a center from Mission Viejo, CA.",,,,,,,,,,,,,,,,
202101711,"Two-sport athlete in football and track. Placed fourth as a senior at the May 2021 6A state meet in the 200 meters (21.05, 1.8 wind aid) and fifth in the 100 (10.16, 5.7 wind aid). Ran a 10.49 100 and 21.25 200 at regionals in April 2021.2019: Attended Mesquite (Texas) Horn as a junior.",,,,,,,,,,,,,,,,
202101712,2019: Helped St. Charles Catholic to an 11-2 record and the Louisiana Division III state championship game as a junior.,,,,,,,,,,,,,,,,
202101713,"George Gumbs is a Wide Receiver from Chicago, IL.",,,,,,,,,,,,,,,,
202101714,"Shaun Grayson is a 6-4, 215-pound Tight End from La Mirada, CA.",,,,,,,,,,,,,,,,
202101715,"Ezra McAllister is a 6-0, 170-pound Athlete from Marshall, MI.",,,,,,,,,,,,,,,,
202101716,2019: Played both ways at linebacker and running back as a junior.,,,,,,,,,,,,,,,,
202101717,"Ethan Hampton is a Quarterback from Aurora, IL.",,,,,,,,,,,,,,,,
202101718,"- Trey Brown is a 6-3, 205-pound Outside Linebacker from Phoenix, AZ.- His father, Ray Brown, played offensive line at Memphis and was an eighth-round selection in the 1986 NFL Draft by the then St. Louis Cardinals before stints in Washington, San Francisco and Detroit. He was a Pro Bowl selection in 2001.",,,,,,,,,,,,,,,,
202101719,"Tyrell Davis is a 6-1, 180-pound Safety from Harrisburg, NC.",,,,,,,,,,,,,,,,
202101720,"Jahaad Scales is a 6-0, 166-pound Safety from Kernersville, NC.",,,,,,,,,,,,,,,,
202101721,"Elijah Fuentes is a 6-3, 260-pound Defensive Tackle from Bronx, NY.",,,,,,,,,,,,,,,,
202101722,Two-sport athlete in football and baseball. Plays INF and OF and pitches.,,,,,,,,,,,,,,,,
202101723,2019: Helped Lennard to a 7-4 record and a Florida 8A first-round playoff appearance as a junior.,,,,,,,,,,,,,,,,
202101724,"Pius Odjugo is a Defensive Tackle from River Rouge, MI.",,,,,,,,,,,,,,,,
202101725,Two-sport athlete in football and track (110 hurdles). Ran a 14.95 in the 110 hurdles in Feb. 2020 as a junior.,,,,,,,,,,,,,,,,
202101726,"Nathan Lewis is an Athlete from Carmichael, CA.",,,,,,,,,,,,,,,,
202101727,"Damir Abdullah is a 6-5, 190-pound Wide Receiver from Covina, CA.",,,,,,,,,,,,,,,,
202101728,"Two-sport athlete in football and track and field (high jump, long jump, triple jump).",,,,,,,,,,,,,,,,
202101729,"Justin Michael is a 6-5, 260-pound Offensive Tackle from Fort Collins, CO.",,,,,,,,,,,,,,,,
202101730,"Austyn Kauhi is a 6-5, 260-pound Offensive Tackle from Honolulu, HI.",,,,,,,,,,,,,,,,
202101731,"Tyler Magnuson is a 6-5, 240-pound Offensive Tackle from Minneapolis, MN.",,,,,,,,,,,,,,,,
202101732,"Carson Casteel is a 6-3, 210-pound Inside Linebacker from Florence, AL.",,,,,,,,,,,,,,,,
202101733,"Alzillion Hamilton is a 5-11, 160-pound Cornerback from Hayward, CA.",,,,,,,,,,,,,,,,
202101734,"Logan Kraut is a 6-2, 190-pound Athlete from Santa Rosa, CA.",,,,,,,,,,,,,,,,
202101735,"Dominic Schofield is a 6-3, 228-pound Outside Linebacker from Milford, MA. He has committed to Massachusetts Minutemen.",,,,,,,,,,,,,,,,
202101736,Two-sport athlete in football and track and field.,,,,,,,,,,,,,,,,
202101737,"Played at Gregory-Portland (Texas) High School prior to junior season. Football and track and field athlete.2019: Helped Searcy to Arkansas 6A state championship as a junior. He announced he is transferring to Cabot, a Class 7A school, for his senior season.",,,,,,,,,,,,,,,,
202101738,"Javon Batten is a 6-3, 182-pound Athlete from Brooklyn, NY.",,,,,,,,,,,,,,,,
202101739,"Jeremiah Brown is a Linebacker from Tallahassee, FL.",,,,,,,,,,,,,,,,
202101740,"Siaosi Finau is a 6-2, 300-pound Defensive Tackle from Renton, WA.",,,,,,,,,,,,,,,,
202101741,"Nathan Hoke is a 6-3, 225-pound Inside Linebacker from Wexford, PA.",,,,,,,,,,,,,,,,
202101742,2019: Texas District 12-2A-I first-team selection at RB as a junior.,,,,,,,,,,,,,,,,
202101743,"Deavin Hilson is a 6-1, 200-pound Athlete from Des Moines, IA.",,,,,,,,,,,,,,,,
202101744,"Carlton Brown is a 6-6, 200-pound Tight End from San Luis Obispo, CA.",,,,,,,,,,,,,,,,
202101745,2019: Played at West Memphis (Ark.) HS as a junior....2018: Played at Memphis (Tenn.) Freedom Prep prior to his junior season,,,,,,,,,,,,,,,,
202101746,"Fernando Sanchez is a 6-2, 212-pound Strong-Side Defensive End from Loganville, GA. He has committed to Central Michigan Chippewas.",,,,,,,,,,,,,,,,
202101747,2019: Started at LT as a junior.,,,,,,,,,,,,,,,,
202101748,Multi-positional player who could play a number of roles in college.,,,,,,,,,,,,,,,,
202101749,"Cole Essek is a 6-7, 240-pound Offensive Tackle from Tampa, FL.",,,,,,,,,,,,,,,,
202101750,"Derek Coombs is a 6-1, 200-pound Running Back from Holly Springs, NC.",,,,,,,,,,,,,,,,
202101751,Also runs track.2019: Ocala Star-Banner Offensive Football Player of the Year after helping team go 8-4 and make regional finals of 3A regional finals.2018: A two-way player. Made Ocala Star-Banner All-County second-team defense after making 21 tackles and picking off two passes.,,,,,,,,,,,,,,,,
202101752,"Fred Farrier is a Wide Receiver from Frankfort, KY.",,,,,,,,,,,,,,,,
202101753,"Two-sport athlete in football and track (110 hurdles, 300 hurdles).2019: As a junior, earned honorable mention all-state at tight end in Division I of the Texas Association of Private and Parochial Schools; helped Houston St. Thomas to a 9-4 record and TAPPS D-I state semifinal appearance.2018: Helped Houston St. Thomas to a 6-6 record and TAPPS Division I second-round playoff appearance as a sophomore.2017: Played his freshman season at Houston Christian.",,,,,,,,,,,,,,,,
202101754,"Chance McDonald is a 6-2, 205-pound Pro-Style Quarterback from Steilacoom, WA.",,,,,,,,,,,,,,,,
202101755,"Two-way impact player at the high school level. Has played snaps at RB, WR, and in the secondary.",,,,,,,,,,,,,,,,
202101756,2019: First-team all-district selection as a junior.,,,,,,,,,,,,,,,,
202101757,"Jaggar Hebeisen is a Tight End from Colleyville, TX.",,,,,,,,,,,,,,,,
202101758,"Dre Pinckney is a 6-0, 170-pound Safety from Boiling Springs, SC.",,,,,,,,,,,,,,,,
202101759,2020: Was named the District 22-6A Defensive MVP as a senior,,,,,,,,,,,,,,,,
202101760,"Two-sport athlete in football and track and field (shot put, discus).2019: First-team all-district at LT as a junior.",,,,,,,,,,,,,,,,
202101761,"Caymen Mills is a 6-1, 166-pound Cornerback from Virginia Beach, VA.",,,,,,,,,,,,,,,,
202101762,Two-player at TE and DE. Has also played basketball during high school career.,,,,,,,,,,,,,,,,
202101763,"Hunter Smith is a 5-11, 190-pound running back from Little Rock, Arkansas. In 2019, he helped Joe T. Robinson to Arkansas 4A state championship. He previously played at ULM.",,,,,,,,,,,,,,,,
202101764,"Malachi Fields is an Athlete from Charlottesville, VA.",,,,,,,,,,,,,,,,
202101765,"Christian Abraham is a 5-11, 200-pound athlete from Paramus, NJ.",,,,,,,,,,,,,,,,
202101766,"Damian Ilalio is a 6-2, 265-pound Defensive Tackle from Manhattan, KS.2019 Centennial League Defensive Player of the Year.",,,,,,,,,,,,,,,,
202101767,"C.J. Montes is a Quarterback from Pasadena, CA.",,,,,,,,,,,,,,,,
202101768,"Two-sport athlete in football and track (100 meters, 200 meters). Ran 11.58 100 and 23.53 200 as a sophomore.2019: Played multiple positions, including RB and S, as a junior.",,,,,,,,,,,,,,,,
202101769,"Tony Muse is a 5-8, 170-pound Athlete from Groton, MA.",,,,,,,,,,,,,,,,
202101770,"Jaymar Hargrove-Mundy is a Cornerback from Cincinnati, OH.",,,,,,,,,,,,,,,,
202101771,"Ryan Kershaw is a 6-2, 220-pound Inside Linebacker from Yakima, WA. Graduated early from high school and enrolled at Washington State in January 2021. Injured during spring ball of 2021 and medically retired.",,,,,,,,,,,,,,,,
202101772,"Tyrese Baptiste is a 5-10, 175-pound Athlete from Everett, MA.",,,,,,,,,,,,,,,,
202101773,"Two-sport athlete in football and track and field (100 meters, relays).2019: First-team all-district Texas 6-5A D-I at running back as a junior; helped Lancaster to an 11-3 record and a Texas 5A D-I state quarterfinal appearance.",,,,,,,,,,,,,,,,
202101774,Played at Conroe (Texas) Oak Ridge prior to his junior year.,,,,,,,,,,,,,,,,
202101775,2020: Will attend Calvary Christian.2019: Worked in the secondary at IMG Academy where he totaled 28 tackles and an interception in nine games.2018: Got snaps on both offense and defense at Clearwater Central Catholic.2017: Played varsity as a freshman at Indian Rocks Christian.,,,,,,,,,,,,,,,,
202101776,"Dominick Guidice is a 6-4, 250-pound Weak-Side Defensive End from Freehold, NJ.",,,,,,,,,,,,,,,,
202101777,"Tony McCray is a 5-11, 170-pound Cornerback from Lake Cormorant, MS.",,,,,,,,,,,,,,,,
202101778,"Cord Kringlen is a 6-5, 275-pound Offensive Tackle from Broomfield, CO.",,,,,,,,,,,,,,,,
202101779,"Zachary Barlev is an Offensive Guard from Plainfield, IL.",,,,,,,,,,,,,,,,
202101780,"Malik Cooper is a 5-9, 180-pound Wide Receiver from Philadelphia, PA.",,,,,,,,,,,,,,,,
202101781,2019: First-team all-district Texas 19-6A as a junior; helped Katy Tompkins to an 11-2 record and a Texas 6A D-I third-round playoff appearance.,,,,,,,,,,,,,,,,
202101782,"Willie Jones is a 6-2, 171-pound Safety from Chicago, IL.",,,,,,,,,,,,,,,,
202101783,"Canaan Clark is a 6-6, 310-pound Offensive Tackle from Cumming, GA.",,,,,,,,,,,,,,,,
202101784,"Drayton Charlton-Perrin is a 6-4, 230-pound Tight End from Northbrook, IL.",,,,,,,,,,,,,,,,
202101785,"Two-sport athlete in football and track and field (100 meters, long jump).2019: Texas District 9-6A first-team selection at RB as a junior.",,,,,,,,,,,,,,,,
202101786,Two-sport athlete in football and basketball who plans to play both in college.,,,,,,,,,,,,,,,,
202101787,"Kavon Baptiste is a 6-3, 180-pound Cornerback from Riverside, CA.",,,,,,,,,,,,,,,,
202101788,"Fuches Lewis is a 6-3, 290-pound Defensive Tackle from Savannah, GA. He has committed to Georgia State Panthers.",,,,,,,,,,,,,,,,
202101789,"Toler Keigley is a 6-1, 180-pound Wide Receiver from Mobile, AL. He has committed to East Carolina Pirates.",,,,,,,,,,,,,,,,
202101790,"2019: Played WR, RB, CB, and S as a junior.",,,,,,,,,,,,,,,,
202101791,"Quentavius Scandrett is a Safety from Hampton, GA",,,,,,,,,,,,,,,,
202101792,Also competes in track and field. Owns personal bests of 20-3 in the long jump and 43-1 in the triple jump.,,,,,,,,,,,,,,,,
202101793,Also competed in several track and field events.2020: Helped New Manchester to a Georgia AAAAA second-round playoff appearance as a senior.,,,,,,,,,,,,,,,,
202101794,"Jorden McDonald is a Cornerback from Salem, VA.",,,,,,,,,,,,,,,,
202101795,"Dequaveon Fuller is a 5-10, 196-pound Inside Linebacker from Lehigh Acres, FL.",,,,,,,,,,,,,,,,
202101796,"Jalen Riven is a Outside Linebacker from Toledo, OH.",,,,,,,,,,,,,,,,
202101797,2019: Was a Class 3A first-team all-state selection by the TSWA and second-team by the AP as a junior,,,,,,,,,,,,,,,,
202101798,"Hutson Lillibridge is a 6-3, 303-pound Offensive Guard from Saint Louis, MO.",,,,,,,,,,,,,,,,
202101799,"Henry Buckles is a 6-2, 285-pound offensive lineman from Hood River, OR.",,,,,,,,,,,,,,,,
202101800,"Demarco Cuffey is a 5-11, 175-pound Cornerback from Waldorf, MD.",,,,,,,,,,,,,,,,
202101801,"Kyson Hall is a 5-11, 175-pound Athlete from Spanish Fork, UT.",,,,,,,,,,,,,,,,
202101802,"Jayden Ramsey is a 6-6, 225-pound Tight End from Anderson, SC.",,,,,,,,,,,,,,,,
202101803,Also wrestles and has ran track.2019: Tampa Bay Times All-Hillsborough honorable mention. Key player for a Buccaneers team that went 8-2 and made 3A state playoffs.,,,,,,,,,,,,,,,,
202101804,"Isaiah Rogers is a 6-4, 270-pound Defensive Tackle from Sharon Hill, PA.",,,,,,,,,,,,,,,,
202101805,"Shawn Chappell Jr. is a 6-2, 181-pound safety from Durham, NC.",,,,,,,,,,,,,,,,
202101806,Two-sport athlete in football and track.2019: Helped William A. Hough to an 8-5 record and a North Carolina 4AA second-round playoff appearance as a junior.,,,,,,,,,,,,,,,,
202101807,"Jordan Sandlin is a 6-6, 295-pound Offensive Tackle from Tampa, FL.",,,,,,,,,,,,,,,,
202101808,"Caiden Woullard is an Outside Linebacker from Massillon, OH.",,,,,,,,,,,,,,,,
202101809,"Cam Fancher is a Quarterback from Dayton, OH.",,,,,,,,,,,,,,,,
202101810,"Football and track athlete (100 meters, 200 meters).Placed second as a senior at the May 2021 Texas 3A state meet in the 200 meters (22.13) and third in the 100 meters (10.83). Also qualified for regionals in the shot put (45-7 1/2).2019: Texas District 12-3A-II first-team running back as a junior. Also earned second-team all-state honors.2018: Texas District 12-3A-II first-team running back as a sophomore.",,,,,,,,,,,,,,,,
202101811,"Carson Cota is a 6-5, 222-pound tight end from Medford, OR.",,,,,,,,,,,,,,,,
202101812,Two-sport athlete in football and basketball.2019: Helped Alabaster Thompson to a 12-1 record and the Alabama 7A state championship as a junior.,,,,,,,,,,,,,,,,
202101813,"Esean Carter is a Defensive Tackle from Detroit, MI.",,,,,,,,,,,,,,,,
202101814,"Patrick Turner is a Linebacker from Dallas, TX.",,,,,,,,,,,,,,,,
202101815,Two-sport athlete in football and track and field (shotput).2019: Texas District 9-6A second team linebacker as a junior; helped Prosper to an 11-3 record and a Texas 6A D-I state quarterfinal appearance.2018: Texas District 9-6A Defensive Newcomer of the Year as a sophomore.,,,,,,,,,,,,,,,,
202101816,"Monte Maxwell is a 6-0, 177-pound Athlete from Hartwell, GA.",,,,,,,,,,,,,,,,
202101817,"Yakiri Walker is an Offensive Lineman from DeSoto, TX.",,,,,,,,,,,,,,,,
202101818,"Jahbari Hill is a Cornerback from Delray Beach, FL.",,,,,,,,,,,,,,,,
202101819,"Jimto Obidegwu is a 6-6, 305-pound Offensive Tackle from Brandywine, MD.",,,,,,,,,,,,,,,,
202101820,Also plays baseball. Infielder that hit .375 as a sophomore and drove in eight runs.2019: All-News4Jax Honorable Mention. Got some snaps on offense.,,,,,,,,,,,,,,,,
202101821,"Brandon Alvarez is a 5-10, 180-pound Wide Receiver from Corona, CA.",,,,,,,,,,,,,,,,
202101822,"Omar Simpson, Jr. is a 5-8, 160-pound Cornerback from Fort Lauderdale, FL.",,,,,,,,,,,,,,,,
202101823,Jathan Caldwell is a 2021 tight end from Dickinson (Texas).,,,,,,,,,,,,,,,,
202101824,"Jeremiah McClendon is a 6-0, 170-pound defensive back from Delray Beach, FL.",,,,,,,,,,,,,,,,
202101825,"Kai Jessie is a 6-5, 180-pound Wide Receiver from San Diego, CA.",,,,,,,,,,,,,,,,
202101826,2020: Participated in the Florida-Georgia All-Star Game.,,,,,,,,,,,,,,,,
202101827,"Jalen Richmond is a 6-0, 175-pound Wide Receiver from Chandler, AZ.",,,,,,,,,,,,,,,,
202101828,"Malik Franklin is a 5-10.5, 167-pound Cornerback from Tallahassee, FL.",,,,,,,,,,,,,,,,
202101829,Twos-sport athlete in football and track and field (discus).,,,,,,,,,,,,,,,,
202101830,Two-sport athlete in football and track and field (shot put).2019: Helped Del City to a 9-3 record and an Oklahoma 6A-II state semifinal as a junior.,,,,,,,,,,,,,,,,
202101831,"Drew Cornelius is a 6-5, 271-pound Offensive Guard from Franklin, GA.",,,,,,,,,,,,,,,,
202101832,"Marquise Brunson is a 6-4, 270-pound Defensive Tackle from Virginia Beach, VA.",,,,,,,,,,,,,,,,
202101833,"Shaki Carson is a 5-7, 164-pound Running Back from West Orange, NJ.",,,,,,,,,,,,,,,,
202101834,"Almarion Crim is a 6-3, 285-pound Offensive Tackle from Adamsville, AL.",,,,,,,,,,,,,,,,
202101835,"Rae'quin Lee is a 5-11, 180-pound Running Back from Southfield, MI.",,,,,,,,,,,,,,,,
202101836,"Roderic Lewis is a 5-11, 165-pound Athlete from Memphis, TN.",,,,,,,,,,,,,,,,
202101837,"Wes Hoeh is an Offensive Guard from Glen Ellyn, IL.",,,,,,,,,,,,,,,,
202101838,"Hunter Rice is a 6-0, 205-pound Running Back from Daleville, VA.",,,,,,,,,,,,,,,,
202101839,"Griffin Duggan is an Offensive Tackle from Suffolk, VA.",,,,,,,,,,,,,,,,
202101840,"Alani Maafu is a 6-3, 285-pound Defensive Tackle from Scottsdale, AZ.",,,,,,,,,,,,,,,,
202101841,"Jamarion McDougle is a Wide Receiver from Deerfield Beach, FL.",,,,,,,,,,,,,,,,
202101842,"Tre Shackelford is a Wide Receiver from Decatur, AL.",,,,,,,,,,,,,,,,
202101843,"Dawson Rivers is a 6-1.5, 208-pound Strong-Side Defensive End from Tucker, GA.",,,,,,,,,,,,,,,,
202101844,"Joseph Bray is a 5-11, 205-pound Running Back from Baltimore, MD.",,,,,,,,,,,,,,,,
202101845,"Zach Myers is a 6-4, 245-pound Strong-Side Defensive End from Evanston, IL.",,,,,,,,,,,,,,,,
202101846,"Christian Wingfield is a Offensive Tackle from Atlanta, GA.",,,,,,,,,,,,,,,,
202101847,"Leviticus ""Levi"" McAffee is a 6-0.5, 175-pound Cornerback from Tampa, FL.",,,,,,,,,,,,,,,,
202101848,"Tristyn Flores is a 6-0, 170-pound Cornerback from Rancho Cucamonga, CA.",,,,,,,,,,,,,,,,
202101849,"Bryce Fleetwood is a 6-3, 185-pound Wide Receiver from Lilburn, GA.",,,,,,,,,,,,,,,,
202101850,"Jamari Sirmons is a 5-11, 190-pound Running Back from Atlanta, GA.",,,,,,,,,,,,,,,,
202101851,"Tyler Curtis is a 6-1, 225-pound Running Back from Lilburn, GA.",,,,,,,,,,,,,,,,
202101852,"Harlan Obioha is an Offensive Tackle from Hoxie, KS.",,,,,,,,,,,,,,,,
202101853,"Will Jones is a 6-6, 280-pound Offensive Tackle from Stuarts Draft, VA.",,,,,,,,,,,,,,,,
202101854,"Shawqi Itraish is a Quarterback from Bradenton, FL.",,,,,,,,,,,,,,,,
202101855,2019: Helped Lancaster to an 11-3 record and a Texas 5A D-I state quarterfinal appearance as a junior.,,,,,,,,,,,,,,,,
202101856,"Jaiden Brown is a 5-11, 160-pound Cornerback from La Mesa, CA.",,,,,,,,,,,,,,,,
202101857,"Jordan Stringer is a 6-0, 225-pound Inside Linebacker from Augusta, GA.",,,,,,,,,,,,,,,,
202101858,"Peyton Higgins is a 5-10, 170-pound Wide Receiver from Florence, AL.",,,,,,,,,,,,,,,,
202101859,"Angelo Butts is a 5-11, 167-pound Wide Receiver from Florissant, MO.",,,,,,,,,,,,,,,,
202101860,"Kaden Rogers is a 6-4, 265-pound Offensive Guard from Hamilton, OH.",,,,,,,,,,,,,,,,
202101861,"Caiden Miles is a 6-4, 290-pound Offensive Tackle from Peoria, AZ.",,,,,,,,,,,,,,,,
202101862,"Dallin Havea is an Athlete from Provo, UT.",,,,,,,,,,,,,,,,
202101863,"Trevor Appleman Appleman is a 6-5, 185-pound Pro-Style Quarterback from Chula Vista, CA.",,,,,,,,,,,,,,,,
202101864,"Caleb Cook is an Offensive Lineman from Brunswick, GA.",,,,,,,,,,,,,,,,
202101865,"Eric Reese is a 5-11, 170-pound Cornerback from Macomb, MI.",,,,,,,,,,,,,,,,
202101866,2019: Leading tackler for a Miami Northwestern team that won a 5A state title. Miami Herald All-Dade 5A-2A first-team selection.,,,,,,,,,,,,,,,,
202101867,"Diego Neri is a 6-2, 230-pound Outside Linebacker from Cincinnati, OH.",,,,,,,,,,,,,,,,
202101868,"Malik Brooks is a 6-2, 205-pound Running Back from Las Vegas, NV.",,,,,,,,,,,,,,,,
202101869,"Andrew Kilfoyl is an Offensive Tackle from Tampa, FL.",,,,,,,,,,,,,,,,
202101870,"Nasir Washington is a 6-3, 230-pound Weak-Side Defensive End from West Des Moines, IA.",,,,,,,,,,,,,,,,
202101871,"Also plays basketball. Born in Colorado.2019: Pensacola News Journal All-Area selection, PNJ.com Athlete of the Week after totaling 8 sacks against Tallahassee Lincoln; Helped Navarre go 6-4.",,,,,,,,,,,,,,,,
202101872,"Charles Arnold Jr is a 5-9, 165-pound Cornerback from Fairburn, GA. He has committed to Coastal Carolina Chanticleers.",,,,,,,,,,,,,,,,
202101873,"Jacob Pasley is a 6-5, 235-pound Tight End from Sebring, FL.",,,,,,,,,,,,,,,,
202101874,"Alex Padgett is a 6-6, 310-pound Offensive Tackle from Avon Lake, OH.",,,,,,,,,,,,,,,,
202101875,"Jeremiah Dervil is a 6-3, 185-pound Athlete from Naples, FL.",,,,,,,,,,,,,,,,
202101876,Two-sport athlete who competes in the triple jump.2019: Earned Texas District 12-5A D-I Defensive MVP as a junior (DE).,,,,,,,,,,,,,,,,
202101877,"Damien Taylor is a Running Back from Northport, AL.",,,,,,,,,,,,,,,,
202101878,"Lawson Chandler is a 6-4, 320-pound Offensive Tackle from Bainbridge, GA. He has committed to Troy Trojans.",,,,,,,,,,,,,,,,
202101879,"Sione Hingano is a 6-5, 290-pound Offensive Tackle from Chandler, AZ.",,,,,,,,,,,,,,,,
202101880,"Two-sport athlete in football and track and field (100 meters, 200 meters, long jump).2019: First-team all-district Texas 5-5A as a junior; helped Aledo to second consecutive Texas 5A D-II state championship.",,,,,,,,,,,,,,,,
202101881,"JoJo Blackmon is a 5-10, 175-pound Wide Receiver from Pensacola, FL.",,,,,,,,,,,,,,,,
202101882,"Jordan Favors is a 5-9, 180-pound Athlete from Griffin, GA.",,,,,,,,,,,,,,,,
202101883,"Donnie Gray is an Athlete from New Haven, CT. He attends Deerfield Academy in Deerfield, MA.",,,,,,,,,,,,,,,,
202101884,Played at Woodlawn High School in Baltimore prior to senior season.,,,,,,,,,,,,,,,,
202101885,"Martavien Johnson is a 5-9, 170-pound Wide Receiver from Akron, OH.",,,,,,,,,,,,,,,,
202101886,Also competes in track and field.Placed sixth as a senior at the May 2021 Texas 5A state meet in the triple jump (45-3 1/4) and eighth in the 110 hurdles (14.67). Ran a 14.80 110 hurdles as a junior. Triple jumped 45-6 1/2 and ran a 23.18 200 as a sophomore.,,,,,,,,,,,,,,,,
202101887,2019: Handled kicking and punting duties as a junior for a Southlake Carroll team that went 13-1 and reached the Texas 6A D-I state quarterfinals.,,,,,,,,,,,,,,,,
202101888,"Lytton Connor is a 6-2, 195-pound Kicker from Radford, VA.",,,,,,,,,,,,,,,,
202101889,2019: Helped St. Mary's Ryken to a 9-3 record and the Washington Catholic Athletic Conference championship as a junior.,,,,,,,,,,,,,,,,
202101890,"Alec Palella is a 6-5, 220-pound Tight End from Bartlett, IL. He is ranked No. 1327 in the country by 247Sports.Palella is the No. 31 recruit in Bartlett, IL (60103) State and is the No. 67 Tight End in the nation.Palella has a 247Sports rating of 84, making him a 3-star prospect.He has committed to Central Michigan Chippewas.",,,,,,,,,,,,,,,,
202101891,"Jackson Wiegold is a 6-2, 220-pound Inside Linebacker from Vernon Hills, IL. He has committed to Ball State Cardinals.",,,,,,,,,,,,,,,,
202101892,"Mason Fletcher is a Punter from Australia, AUST. He has committed to Cincinnati Bearcats.",,,,,,,,,,,,,,,,
202101893,"Jevon Jackson is a Running Back from Decatur, AL.",,,,,,,,,,,,,,,,
202101894,"Josh Trice is a 5-11, 170-pound Cornerback from Hamilton, GA.",,,,,,,,,,,,,,,,
202101895,"Justice Cross is a Linebacker from Deerfield Beach, FL.",,,,,,,,,,,,,,,,
202101896,"Danijel Miletic is a 6-3, 290-pound Offensive Guard from Germany.",,,,,,,,,,,,,,,,
202101897,"Ollie Finch is a 6-2, 180-pound Wide Receiver from Attalla, AL.",,,,,,,,,,,,,,,,
202101898,"Gus Zilinskas is a 6-3, 263-pound Defensive Tackle from Englewood, CO.",,,,,,,,,,,,,,,,
202101899,Kybo Jamerson is a 2021 OLB/S from Longview (Texas).,,,,,,,,,,,,,,,,
202101900,Also runs track.2019: Started at one of the corner spots for an Auburndale team that made the 6A state playoffs for the first time in three years.2018: The Ledger All-County honorable mention as a sophomore.,,,,,,,,,,,,,,,,
202101901,"Brian Mayes is a Cornerback from Houston, TX.",,,,,,,,,,,,,,,,
202101902,"Patrick Smith is a 5-11, 185-pound Running Back from Absecon, NJ. He has committed to Colorado State Rams.",,,,,,,,,,,,,,,,
202101903,"Two-sport athlete in football and track and field (discus, javelin).2019: First-team all-district selection at DT as a junior; helped C.E. Byrd to a Louisiana Division I first-round playoff appearance.9",,,,,,,,,,,,,,,,
202101904,"Marcus Williams is a Linebacker from Hoover, AL.",,,,,,,,,,,,,,,,
202101905,"Tharon Davis is a 5-10, 170-pound Running Back from Newport, AR.",,,,,,,,,,,,,,,,
202101906,"Luke Pinnick is a 6-4, 275-pound Offensive Tackle from Marshalltown, IA.",,,,,,,,,,,,,,,,
202101907,"Shawn Williams is a 6-4, 250-pound Strong-Side Defensive End from Philadelphia, PA.",,,,,,,,,,,,,,,,
202101908,"Darius Chester is a 5-6, 177-pound Running Back from Opa Locka, FL.",,,,,,,,,,,,,,,,
202101909,2019: Played seven games as a junior; earned Texas District 14-5A D-I first-team selection and helped Harlan to a 12-1 record and a Texas 5A D-I third-round playoff appearance.,,,,,,,,,,,,,,,,
202101910,Won two Texas 5A D-II state championships in final two high school seasons.,,,,,,,,,,,,,,,,
202101911,"Josh Gesky is a 6-5, 265-pound Offensive Tackle from Manteno, IL.",,,,,,,,,,,,,,,,
202101912,"Kalen Villanueva is a Wide Receiver from Falls Church, VA.",,,,,,,,,,,,,,,,
202101913,"Jason Brooks is a 5-10, 168-pound Athlete from Mobile, AL. As a junior he caught 31 passes for 359 yards and four TDs, rushed 25 times for 230 yards and seven TDs, and recorded 43 solo tackles and six assists with nine interceptions on defense.",,,,,,,,,,,,,,,,
202101914,"David Larkins is a 6-5, 225-pound Tight End from Cincinnati, OH.",,,,,,,,,,,,,,,,
202101915,"Aidan Ralph is a 6-3, 195-pound Outside Linebacker from Chicago, IL.",,,,,,,,,,,,,,,,
