player_id,hs_athletic_background,skill_1,skill_1_rating,skill_2,skill_2_rating,skill_3,skill_3_rating,skill_4,skill_4_rating,skill_5,skill_5_rating,skill_6,skill_6_rating,skill_7,skill_7_rating,skill_8,skill_8_rating
202100333,"2019: Ocala Star-Banner All-County first-team selection as a utility player after helping Vanguard make third round of 5A state playoffs. Accounted for 675 yards and eight touchdowns on offense averaging just over 12 yards a touch. Also played defense and made 30 tackles and three interceptions; Participated in the Legend's Football All-Florida Junior Showcase. A member of the South Florida Express.2018: Started at quarterback for Ocala Vanguard and was a first-team All-County pick by the Ocala Star-Banner after leading Knights to an undefeated regular season. Went 85-of-174 passing for 1,246 yards with 14 touchdowns to go against five interceptions. Added 1,025 rushing yards and eight more scores on the ground averaging 8.6 yards per carry. Also caught three passes for 114 yards finding the end zone twice.",,,,,,,,,,,,,,,,
202100334,"2019: As a junior, played both ways at WR and DB; helped Kearns to a 10-2 record and a Utah 6A state quarterfinal appearance.",,,,,,,,,,,,,,,,
202100335,"D.J. Harvey is a Cornerback from Palmdale, CA.",,,,,,,,,,,,,,,,
202100336,A four-star prospect listed as the nation’s No. 13 tight end and the No. 19 player in North Carolina in the 247Sports Composite • Ranked as the nation’s 17th-best tight end and the No. 15 player in the state according to Rivals • Tabbed as the nation’s No. 10 tight end and the No. 30 player in the state according to ESPN • An SI All-America candidate prior to his senior season • Tallied more than 500 yards and four TDs as a junior • Earned third-team All-Observer honors • Started playing football in the summer prior to his junior season • Also played basketball for two years as a prep • Coached by Joe Evans.,,,,,,,,,,,,,,,,
202100337,2019: Played at Pearland (Texas) as a junior; first-team all-district selection.Spring 2019: Had the second-highest SPARQ score (126.33) in the country for the class of 2021.2018: Played his sophomore season at Katy (Texas) Taylor.,,,,,,,,,,,,,,,,
202100338,"Three-sport athlete in football, basketball, and track and field. Won two silver medals as a senior at the May 2021 Texas 3A state meet in the shot put (58-2 3/4) and discus (172-7). Recorded a shot put PR of 58-5 3/4 in April 2021.2019: Texas Sports Writers Association and AP 3A second-team all-state selection as a junior.",Second Level Blocking,9,Feet,9,Run Blocking,9,Strength,8,Punch,8,Body Quickness,8,Size,7,Pass Blocking,5
202100339,Also runs track (100m and 400m)2019: Florida Today All-Space Coast first-team selection after helping Eau Gallie to a 9-3 record and appearance in 5A state playoffs.,,,,,,,,,,,,,,,,
202100340,"Mar'Kiese Irving is a Running Back from Country Club Hills, IL.",,,,,,,,,,,,,,,,
202100341,"2020: As a senior, helped Westlake to an 11-2 record and a Georgia AAAAAA state semifinal appearance.",,,,,,,,,,,,,,,,
202100342,"Walker Merrill is a 6-1, 178-pound Wide Receiver from Brentwood, TN.",Toughness,8,Strength,8,Yards After Catch,8,Size,8,Hands,7,Speed,7,Route Running,6,Ball Skills,6
202100343,"2019: As a junior, helped St. Thomas More to an 11-2 record and the Louisiana Division II state championship.2018: Helped St. Thomas More to an 11-2 record and state runner-up finish in Louisiana Division II as a sophomore.",,,,,,,,,,,,,,,,
202100344,"Kechaun Bennett is a 6-4, 220-pound Strong-Side Defensive End from Suffield, CT.",,,,,,,,,,,,,,,,
202100345,"Three-sport athlete (basketball, track). ASWA 5A All-State second-team selection on the hardwood as a junior. Lewis was named Class 5A first-team Offense by the Alabama Sports Writers Association. He was named first-team Offense by MaxPreps in 2020.2020: Helped lead Pleasant Grove to a 5A runner-up finish after hauling in 70 receptions for 1,235 yards and 18 touchdowns; Participated in the Alabama-Mississippi All-Star Game.2019: Caught 75 passes for 1,398 yards and 20 touchdown as a junior for a Spartans squad that reached the 5A state title game.",,,,,,,,,,,,,,,,
202100346,Also runs track. Monarch student body class president.2019: Miami Herald All-Broward 8A-6A second-team pick. Got snaps on both offense and defensive for a Monarch team that went 6-4.,,,,,,,,,,,,,,,,
202100347,Extensive two-way snaps on the offensive and defensive lines.,,,,,,,,,,,,,,,,
202100348,"Julian Nixon is a Tight End from Roswell, GA.",,,,,,,,,,,,,,,,
202100349,"Athan Kaliakmanis is a Quarterback from Antioch, IL.",Intangibles,8,Playmaking ability,8,Pocket Presence,7,Arm Strength,8,Speed,8,Size,8,Outside the pocket,8,Delivery,7
202100350,"Zakee Wheatley is a 6-3, 180-pound Athlete from Severn, MD.",,,,,,,,,,,,,,,,
202100351,"Also participates in track (100m, 200m, relays)2020: MaxPreps All-Florida second-team selection. Got snaps on both offense and defense for a Lightning team that went 5-5 and made second round of 7A state playoffs.2019: Was all over the field as a junior for a Lehigh squad that went 4-6 lining up at cornerback, safety, wide receiver, running back and even quarterback; Participated in the Legend's Football All-Florida Junior Showcase.2018: Finished 4th at the 3A state track meet after qualifying with a 10.71 in the 100-meter dash.",,,,,,,,,,,,,,,,
202100352,2019: Played nose and DT in multiple fronts as a junior.,,,,,,,,,,,,,,,,
202100353,"Beau Stephens is a 6-6, 295-pound Offensive Tackle from Blue Springs, MO.",,,,,,,,,,,,,,,,
202100354,"Caleb Tiernan is a 6-7, 280-pound Offensive Tackle from Franklin, MI.",,,,,,,,,,,,,,,,
202100355,"Keagan Johnson is an Athlete from Bellevue, NE.",,,,,,,,,,,,,,,,
202100356,"2020: Gained 3,849 yards from scrimmage and scored 65 offensive TD's (70 total) as a senior; helped Hallettsville to a 13-3 record and a Texas 3A D-I state runner-up finish.2019: District 14-3A D-I Overall MVP as a junior; helped Hallettsville to an 11-3 record and Texas 3A D-I state quarterfinal berth.2018: Texas District 15-3A D-I first team selection as a sophomore.",,,,,,,,,,,,,,,,
202100357,Two-way experience at safety and running back.,,,,,,,,,,,,,,,,
202100358,"Deven Eastern is a 6-6, 300-pound defensive tackle from Shakopee, MN. He has committed to Minnesota Golden Gophers.",,,,,,,,,,,,,,,,
202100359,Also runs track.,Versatility,10,Playmaking,10,Instincts,9,Cover Skills,8,Tackling,8,Ball Skills,8,Speed,8,Frame,8
202100360,2019: Started at LT as a junior.,,,,,,,,,,,,,,,,
202100361,"Benjamin Perry is a Safety from Chicago, IL.",,,,,,,,,,,,,,,,
202100362,"Three-sport athlete in football, basketball, and track and field (100 meters, 200 meters)2019: Helped Choctaw to an 8-4 record and Oklahoma 6A D-II state semifinal as a junior.",,,,,,,,,,,,,,,,
202100363,"Akili Calhoun is a 6-4, 245-pound Weak-Side Defensive End from Brentwood, CA.PR for shot was 46.7 and PR for discus was 148.0 as a sophomore.",,,,,,,,,,,,,,,,
202100364,Ran track in middle school.2020: Started multiple games for one of the nation's top high school teams in IMG Academy. Picked off a pass against Life Christian Academy and was credited with two more breakups.2019: A role player for IMG Academy squad that went 9-1 and finished ranked No. 8 in the MaxPreps Xcellent 25; Participated in Under Armour's Future 50 camp.2018: Attended IMG Academy.2017: Started three games as a freshman at Pahokee. Broke up three passes.,,,,,,,,,,,,,,,,
202100365,Born in Indiana. Also plays basketball.2020: MaxPreps Preseason All-Florida second-team selection.,,,,,,,,,,,,,,,,
202100366,Two-sport athlete in football and basketball.,,,,,,,,,,,,,,,,
202100367,"Logan Fano is an Edge from Spanish Fork, UT.",,,,,,,,,,,,,,,,
202100368,"2019: As a junior, helped Birmingham Ramsay to a 10-3 record and an Alabama 5A state quarterfinal appearance.",Hand Quickness,8,Point of Attack,8,Strength,8,Motor,7,Size,7,Athleticism,6,Explosiveness,6,Versatility,5
202100369,Also throws shot put in high school.2019: FloridaHSFootball.com 7A All-State second-team selection. Helped Armwood go 12-2 and make deep run in 7A state playoffs; Participated in the Legend's Football All-Florida Junior Showcase.,,,,,,,,,,,,,,,,
202100370,Also plays basketball.2019: Attended Miami Central where he won a 6A state title starting at tight end for the Rockets; A Miami Herald All-Dade 8A-6A first-team selection.,,,,,,,,,,,,,,,,
202100371,2019: Named the unanimous District 4-6A Overall MVP as a junior.2018: Named the District 4-6A Defensive Sophomore of the Year,,,,,,,,,,,,,,,,
202100372,2019: Played both ways as a LB and TE as a junior.,,,,,,,,,,,,,,,,
202100373,2019: Helped Knightdale to a North Carolina 4A first-round playoff appearance as a junior.,,,,,,,,,,,,,,,,
202100374,"Extensive experience at multiple positions, including QB and WR.",,,,,,,,,,,,,,,,
202100375,"Two-sport athlete in football and track and field (100 meters, 200 meters).Spring 2019: Recorded 11.44 PR in the 100 as a sophomore.",,,,,,,,,,,,,,,,
202100376,"Markus Allen is a Wide Receiver from Clayton, OH.",,,,,,,,,,,,,,,,
202100377,"Attended a boarding school in Virginia, before returning home to Raleigh for his senior year",,,,,,,,,,,,,,,,
202100378,"Derek Wilkins is a 6-4, 250-pound Strong-Side Defensive End from Rancho Santa Margarita, CA.",,,,,,,,,,,,,,,,
202100379,2020: Helped Mansfield Summit to an 8-5 record and the Texas 5A D-I state semifinals as a senior; also served as Summit's punter with 30.5 yards per punt on 29 attempts.2019: Texas District 7-6A first-team selection at receiver as a junior; helped Mansfield Summit to a 7-4 record and Texas 6A D-II first-round playoff appearance.2018: Texas District 7-6A Offensive Sophomore of the Year at receiver.,,,,,,,,,,,,,,,,
202100380,"Jake Ratzlaff is a 6-2, 220-pound Outside Linebacker from Rosemount, MN.",,,,,,,,,,,,,,,,
202100381,Two-time all-state selection at Opelousas Catholic…helped lead Vikings to quarterfinal round of Division IV playoffs and 10-2 record his junior year…also participated in basketball and track and field…earned second-team all-state honors in basketball his junior year after averaging 26.0 points per game and leading Vikings to regional final round of Class 4A state playoffs…averaged 23.1 points per game on state semifinal team his sophomore year.,,,,,,,,,,,,,,,,
202100382,"Also plays baseball. Recruited by some SEC baseball program. MLB scouts also expressed interest.2019: Played QB, WR, and multiple DB spots as a junior; threw for 626 yards, 5 TD, 4 INT, while rushing 44 times for 151 yards. Also caught 16 passes for 298 yards and 4 TD.",,,,,,,,,,,,,,,,
202100383,Played at Fort Bend (Texas) Ridge Point prior to junior season.2019: Helped Cane Ridge to a 9-4 record and Tennessee Division I Class 6A second-round playoff as a junior.2018: Was a second-team all-district selection at WR at Fort Bend (Texas) Ridge Point.,,,,,,,,,,,,,,,,
202100384,Two-sport athlete in football and baseball who plans to play both in college. At one time was committed to play baseball at Georgia. Also a scratch golfer.2019: Helped North Oconee to a 10-2 record and Georgia AAAA second-round playoff appearance as a junior.,,,,,,,,,,,,,,,,
202100385,"Darryl Peterson is a 6-3, 235-pound Defensive End from Akron, OH.",,,,,,,,,,,,,,,,
202100386,"Mason Murphy is an Offensive Tackle from San Juan Capistrano, CA.",,,,,,,,,,,,,,,,
202100387,2020: Atlanta Journal-Constitution Super 11 selection.,,,,,,,,,,,,,,,,
202100388,"Tyler Macon is a 6-0, 180-pound Pro-Style Quarterback from East Saint Louis, IL.",,,,,,,,,,,,,,,,
202100389,"Sam Hart is a 6-5, 205-pound Tight End from Aurora, CO.",,,,,,,,,,,,,,,,
202100390,"Khari Gee is an Athlete from Atlanta, GA.",,,,,,,,,,,,,,,,
202100391,All-Region selection as a junior... also plays basketball.,,,,,,,,,,,,,,,,
202100392,"Jordan Young is a 6-0, 185-pound Cornerback from Tampa, FL.",,,,,,,,,,,,,,,,
202100393,"2019: AP Class 6A first-team all-state selection; Unanimous first-team all-district honoree as a junior.March 2018: Recorded 95.79 Nike Football Rating (including 8440 peak power score, 38-foot power ball).",,,,,,,,,,,,,,,,
202100394,"Thomas Cole is a 6-7, 255-pound Offensive Tackle from San Luis Obispo, CA.  Named First Team Offensive Tackle from Cal-Hi Sports All State Juniors",,,,,,,,,,,,,,,,
202100395,"Travali Price is a 6-4, 265-pound Weak-Side Defensive End from Lincolnton, NC.",,,,,,,,,,,,,,,,
202100396,"2021 (FRESHMAN): Redshirted and made one appearance at offensive line against Georgia Southern (Sept. 18).HIGH SCHOOL: Rated a four-star prospect by 247Sports and a three-star prospect by Rivals and ESPN … Rated the No. 1 player in Arkansas by Rivals and the No. 2 player by both 247Sports and ESPN … Played both offensive and defensive tackle for head coach Van Paschal at Wynne High School … MaxPreps Preseason Arkansas all-state selection … All-state and all-district honoree as a junior … Named the outstanding lineman at the U.S. Army All-American National Combine … Played in the playoffs each of the last two years and was part of a 13-1 Yellowjackets team that reached the state championship as a senior … CHOSE ARKANSAS OVER: Miami (Fla.), Mississippi State, Kansas, Arkansas State and Southern Miss.PERSONAL: Born Jan. 16, 2003.Two-sport athlete in football and track and field (shot put).2019: Helped Wynne to a 7-5 record and Arkansas 5A second-round playoff appearance as a junior.Spring 2019: Qualified for the Arkansas 4A state finals in the shot put (42-11 3/4 PR).",,,,,,,,,,,,,,,,
202100397,"Led Myrtle Beach to the state championship game as a junior. ...All-Region, third-team All-State as a junior. ..also runs track.",,,,,,,,,,,,,,,,
202100398,2019: Played five games on defense after moving over from wide receiver; helped South Oak Cliff to a 9-3 record and a Texas 5A D-II second-round playoff appearance.,,,,,,,,,,,,,,,,
202100399,"Connor Tollison is an Offensive Tackle from Jackson, MO.",,,,,,,,,,,,,,,,
202100400,Two-sport athlete in football and basketball.2019: Primarily played tight end as a junior.,,,,,,,,,,,,,,,,
202100401,"Voi Tunuufi is a 6-2, 280-pound Defensive Tackle from Salt Lake City, UT.",,,,,,,,,,,,,,,,
202100402,"Danny Stutsman is a Linebacker from Orlando, FL.",,,,,,,,,,,,,,,,
202100403,Two-sport athlete in football and track (100 meters).2019: Unanimous first-team selection at RB in Texas District 25-6A as a junior.2018: First-team all-district selection as a sophomore.,,,,,,,,,,,,,,,,
202100404,"Kaleb Elarms-Orr is a Linebacker from Hayward, CA.",,,,,,,,,,,,,,,,
202100405,"Ari Patu is a Quarterback from Folsom, CA.",,,,,,,,,,,,,,,,
202100406,"Jaylen Johnson is a Safety from Cincinnati, OH.",,,,,,,,,,,,,,,,
202100407,2019: Played LT and DT as a junior; helped Pearl-Cohn to a 14-1 record and a Tennessee D-I 3A state championship game appearance.,,,,,,,,,,,,,,,,
202100408,"Two-sport athlete (track and field)2019: Miami Herald 8A-6A All-Dade first-team selection after starting at left tackle for a Miami Columbus team that went 11-4 and won an 8A state title. Helped pave the way for a 2,300-yard rusher in Ole Miss running back signee Henry Parrish.2018: A rotational player that started four games for an Explorers team that made 8A state championship game.2017: Earned varsity snaps as a freshman.",,,,,,,,,,,,,,,,
202100409,"Earned all-district recognition his senior year after helping lead St. Augustine to quarterfinal round of state playoffs…recorded 102 tackles, including 29.0 for loss with 13.0 sacks, as a junior to help Purple Knights advance to quarterfinal round of state playoffs…also contested shot put for St. Augustine’s track and field team.",,,,,,,,,,,,,,,,
202100410,"Two-sport athlete in football and track (100 meters, relays). Owns a personal record of 10.91 in the 100.2020: Texas District 13-6A Offensive Player of the Year as a senior; helped Oak Ridge to a 6-5 record and 6A D-II second-round playoff appearance.2019: First-team all-district selection as a junior.2018: Second-team all-district selection as a sophomore",,,,,,,,,,,,,,,,
202100411,"Also runs track (100m, 400m, relays) and participates in field events (long jump, high jump)2019: A versatile player for a Godby team that went 6-7.",,,,,,,,,,,,,,,,
202100412,"Three-sport athlete in football, basketball, and track and field (long jump, triple jump, relays).2019: Earned District 3-5A-II Co-MVP honors as a junior.2018: Named the District 3-5A-II Offensive Newcomer of the Year as a sophomore.",,,,,,,,,,,,,,,,
202100413,2019: Helped Cass Tech to a 7-6 record and Michigan Division I state quarterfinal appearance as a junior.,,,,,,,,,,,,,,,,
202100414,"Two-sport athlete in football and track and field (shot put, discus).",,,,,,,,,,,,,,,,
202100415,Also runs track.2019: Courier-Post All-South Jersey first-team selection. Played both ways for a Camden team that made state playoffs. Returned three punts for a touchdown along with a kickoff.,,,,,,,,,,,,,,,,
202100416,2019: Started at RG as a junior.,,,,,,,,,,,,,,,,
202100417,"Kyndrich Breedlove is an Athlete from Nashville, TN.",,,,,,,,,,,,,,,,
202100418,Two-sport athlete in football and basketball.,,,,,,,,,,,,,,,,
202100419,"Erik Olsen is a 6-5, 230-pound Tight End from Littleton, CO.",,,,,,,,,,,,,,,,
202100420,"2019: As a junior, helped Plano John Paul II to a 10-3 record and state runner-up finish in the Texas Association of Private and Parochial Schools' Division I playoff bracket.",,,,,,,,,,,,,,,,
202100421,Two-sport athlete in football and baseball (outfielder).2020: Led Lawrence to a 9-1 record and the Kansas 6A state quarterfinals as a senior.2019: Helped Lawrence to an 8-2 record and a Kansas 6A first-round playoff appearance as a junior.,,,,,,,,,,,,,,,,
202100422,Earned All-State honors from the Alabama Sportswriters Association as a junior.,,,,,,,,,,,,,,,,
202100423,2018: Played at Spanish Fort (Ala.) HS as a sophomore,,,,,,,,,,,,,,,,
202100424,"Josh Moore is a 6-1, 185-pound Athlete from Atlanta, GA.",,,,,,,,,,,,,,,,
202100425,Competes in track and field.Pays both sides of the football.,,,,,,,,,,,,,,,,
202100426,"Two-sport athlete in football and track (100 meters, 400 meters, relays).2019: Helped Stillwater to a 12-1 record and Oklahoma 6A-II state title game appearance as a junior.Spring 2019: Oklahoma 6A state qualifier in the 100 meters (10.75 PR).2018: Helped Stillwater to a 12-1 record and Oklahoma 6A-II state championship berth as a sophomore.",,,,,,,,,,,,,,,,
202100427,"2019: Played both ways (RB, DB) as a junior; helped Portland Jefferson to a 6-4 record and an Oregon 6A first-round playoff appearance.2018: Played both ways as a sophomore (RB, DB).",,,,,,,,,,,,,,,,
202100428,"Geno VanDemark is an Offensive Tackle from Montvale, NJ.",,,,,,,,,,,,,,,,
202100429,2019: Helped Dacula to a 13-1 record and a Georgia AAAAAA state semifinal appearace as a junior.,,,,,,,,,,,,,,,,
202100430,"Najee Story is a 6-4, 235-pound Strong-Side Defensive End from Solon, OH.",,,,,,,,,,,,,,,,
202100431,2019: Times-Union All-First Coast first-team selection. Key player for an Eagles squad that went 10-2 and made an appearance in the 3A regional semifinals.,,,,,,,,,,,,,,,,
202100432,2019: Helped Allen to an 11-1 record and the Texas Class 6A Division I state playoffs as a junior2018: Helped Allen to a 14-1 record and the Texas Class 6A Division I state semifinals as a sophomore.,,,,,,,,,,,,,,,,
202100433,"Kyran Montgomery is a Defensive End from Indianapolis, IN.",,,,,,,,,,,,,,,,
202100434,2018: First-team all-district selection at OT as a sophomore.,,,,,,,,,,,,,,,,
202100435,"Also plays basketball. Earned All-County honorable mention honors from The Ledger as a junior. Invited to All-America Bowl.2020: A member of the The Ledger's Super 16. Got snaps at both defensive end and tight end for a Fort Meade program that went 5-4 and qualified for 1A state playoffs. Missed some time due to COVID-19 protocols, but still totaled 32 tackles and two sacks in six games. Also caught 16 passes for 192 yards and four touchdowns.2019: The Ledger third-team All-County selection.",Pursuit,9,Hand Quickness,8,Instincts,8,Closing Speed,8,First Step,8,Athleticism,8,Point of Attack,7,Frame,7
202100436,2019: First-team all-district selection as a junior.,,,,,,,,,,,,,,,,
202100437,"Max Llewellyn is a 6-5, 230-pound Tight End from Urbandale, IA.",,,,,,,,,,,,,,,,
202100438,"Kimo Makaneole is an Offensive Tackle from Niceville, FL.",,,,,,,,,,,,,,,,
202100439,Multi-sport athlete in football and track and field.2020: Helped Edmond Santa Fe to a 10-3 overall record and runner-up finish in Oklahoma Class 6A-I2019: Played only six games as a junior.Spring 2019: Placed third in Oklahoma 6A high jump (6-2 PR) and ninth in long jump (21-0 1/2 PR).,,,,,,,,,,,,,,,,
202100440,Taylor was a first-team Class 6A all-state selection in 2019 as a junior.,,,,,,,,,,,,,,,,
202100441,2019: Helped Allen to an 11-1 record and Texas 6A D-I second-round playoff appearance as a junior.,,,,,,,,,,,,,,,,
202100442,"Christian Veilleux is a Quarterback from Orleans, ON.",,,,,,,,,,,,,,,,
202100443,2020: Was named a first-team all-district pick at both TE and DE as a senior....2019: Was a first-team all-district selection at DE as a junior....2018: Helped Grandview win the Texas Class 3A Division I state championship as a sophomore.Two-sport standout in football and basketball.,,,,,,,,,,,,,,,,
202100444,Also the starting center on the varsity basketball team.,,,,,,,,,,,,,,,,
202100445,"Four-sport athlete in football, basketball, track and field, and wrestling.2020: Missed all but one game due to injury2019: Started both ways at QB and safety as a junior.",,,,,,,,,,,,,,,,
202100446,"Christopher Thomas is a Defensive Tackle from Tallahassee, FL.",,,,,,,,,,,,,,,,
202100447,Also runs track.2019: A key offensive player for a Armwood team that went 12-2 and made the 7A state semifinals. Participated in the Legend's Football All-Florida Junior Showcase where he scored a touchdown working out of the slot.,,,,,,,,,,,,,,,,
202100448,"A four-star prospect listed as the nation’s No. 68 wide receiver and the No. 4 player in South Carolina in the 247Sports Composite • Ranked as the nation’s 64th-best wide receiver and the No. 19 player in the state according to Rivals • Tabbed as the nation’s No. 26 athlete and the No. 22 player in the state according to ESPN • A four-year starter at wide receiver who posted 195 receptions for 3,912 yards and 51 TDs during his prep career • A two-time first-team All-Big South 3A and All-Gaston Gazette performer • An SI All-America candidate prior to his senior season • Played his senior season in Gaffney, S.C. at Gaffney • Helped Gaffney to a 6-1 record and the second round of the playoffs • Caught 37 passes for 534 yards and five TDs in seven games • A third-team All-Observer selection as a junior • Tabbed first-team All-Gazette • Led Kings Mountain to a 12-3 record and the state semifinals • Posted 60 receptions for 1,138 yards and 16 TDs • Earned MaxPreps Sophomore All-America and USA Today All-North Carolina honors after tallying 71 receptions for 1,596 yards and 26 TDs • Helped Kings Mountain to a 12-3 record and the state semifinals • Added 27 receptions for 644 yards and four TDs as a freshman • Also a three-year starter in basketball • Coached by Greg Lloyd at Kings Mountain and Dan Jones at Gaffney.",,,,,,,,,,,,,,,,
202100449,"Three-sport athlete (track, basketball). A qualifier for the 2A state track meet as a sophomore in the 300-meter hurdles and triple jump.2020: Jacksonville.com All-First Coast first-team pick. Totaled 39 tackles and three interceptions while working on defense. Hauled in 25 passes for 386 yards on offense. Key reason why Tornadoes made second-round of 4A playoffs.2019: A two-way player for a Bradford program that lost in third round of 4A state playoffs. Gainesville Sun All-Area second-team selection. Caught 17 passes for 312 yards and with five touchdowns on offense. Made 30 tackles on defense and totaled eight pass breakups to go along with seven interceptions.",,,,,,,,,,,,,,,,
202100450,"Jared Wilson is a 6-4, 325-pound Offensive Guard from Clemmons, NC.",,,,,,,,,,,,,,,,
202100451,"Javonte Gardner is a 6-5, 290-pound Offensive Tackle from Orlando, FL. He has committed to Florida Gators.",,,,,,,,,,,,,,,,
202100452,"Justin Johnson is a 5-11, 190-pound Running Back from Edwardsville, IL.",,,,,,,,,,,,,,,,
202100453,2019: First-team all-district selection at TE as a junior.2018: Named the District 21-6A Sophomore of the Year.,,,,,,,,,,,,,,,,
202100454,Played at Washington (D.C.) Ballou until transferring to Washington (Pa.) High for his senior season.,,,,,,,,,,,,,,,,
202100455,"Easton Mascarenas-Arnold is a Linebacker from Mission Viejo, CA.2023: Mascarenas-Arnold was a first-team All-Pac-12 selection in 2023 after recording a team-high 107 tackles, 6.5 tackles for a loss with two sacks and a pair of interceptions.",,,,,,,,,,,,,,,,
202100456,"2020: Played more on the OL as a senior, amassing 14 pancake blocks. ASWA Class 6A First Team All-State selection on the OL.2019: Helped Lee to a 7-3 record as a junior.2018: Helped Lee to an 8-5 record and an Alabama 7A state semifinal appearance as a sophomore.",,,,,,,,,,,,,,,,
202100457,"Jack Pugh is a 6-5, 235-pound Strong-Side Defensive End from Hilliard, OH.",,,,,,,,,,,,,,,,
202100458,2019: Helped John Ehret to an 8-3 record and a Louisiana 5A first-round playoff appearance as a junior.,,,,,,,,,,,,,,,,
202100459,"Chase Mason is a 6-4, 212-pound Pro-Style Quarterback from Viborg, SD.",,,,,,,,,,,,,,,,
202100460,2019: Texas AP Class 4A second-team all-state selection as a junior.,,,,,,,,,,,,,,,,
202100461,"Henry Lutovsky is a 6-6, 295-pound Offensive Tackle from Mount Pleasant, IA.",,,,,,,,,,,,,,,,
