player_id,hs_athletic_background,skill_1,skill_1_rating,skill_2,skill_2_rating,skill_3,skill_3_rating,skill_4,skill_4_rating,skill_5,skill_5_rating,skill_6,skill_6_rating,skill_7,skill_7_rating,skill_8,skill_8_rating
202100860,"Cedric Seabrough is a Tight End from Swainsboro, GA.",,,,,,,,,,,,,,,,
202100861,"Chase Penry is a 6-1, 185-pound Wide Receiver from Englewood, CO.",,,,,,,,,,,,,,,,
202100862,Two-sport athlete in football and track. PR of 11.55 in the 100 and 23.95 in the 200.2019: Helped Brother Rice to an 8-5 record and an Illinois 8A state semifinal appearance as a junior.,,,,,,,,,,,,,,,,
202100863,"Santino Marucci is a Quarterback from Youngstown, OH.",,,,,,,,,,,,,,,,
202100864,"HIGH SCHOOL: Rated a consensus three-star prospect by 247Sports, Rivals and ESPN … Rated the No. 42 cornerback in his class and No. 74 overall prospect in Texas by 247Sports … Played on both sides of the ball for head coach Jeff Harbert at Frisco High School … As a senior, made 14 grabs for 403 yards (28.8 ypc) and two touchdowns while making 26 tackles, four interceptions, one pass broken up, one fumble recovery and one forced fumble in seven games … As a junior, made 31 catches for 709 yards (22.9 ypc) and seven touchdowns while also making 44 tackles with four interceptions, one interception return for a score, eight passes defended and one forced fumble … Named District 7-5A D-II MVP for Frisco, who finished 11-2 and reached the third round of the playoffs … CHOSE ARKANSAS OVER: Texas Tech, Purdue, Michigan State, Memphis, Pitt, San Diego State, Oregon State and others.2019: Named District 7-5A-II Overall MVP as a junior.2018: Played his sophomore season at Plano Prestonwood.",,,,,,,,,,,,,,,,
202100865,"Two-sport athlete in football and track and field (100 meters, 200 meters).2019: As a junior, earned first-team all-state honors at defensive end in Division I of the Texas Association of Private and Parochial Schools; helped Nolan Catholic to an 11-1 record and TAPPS D-I second-round playoff appearance.",,,,,,,,,,,,,,,,
202100866,"Jaden Lindsay is a 6-3, 270-pound Offensive Guard from Kernersville, NC.",,,,,,,,,,,,,,,,
202100867,2019: Helped Imhotep Charter to an 8-5 record and a Pennsylvania 4A quarterfinal appearance as a junior.,,,,,,,,,,,,,,,,
202100868,"Two-way experience with snaps at C, OG, and DL.",,,,,,,,,,,,,,,,
202100869,"Tyler Needham is a 6-4, 280-pound Offensive Tackle from Philadelphia, PA.",,,,,,,,,,,,,,,,
202100870,"Two-sport athlete in football and track and field (100 meters, 200 meters, relays).2019: First-team all-district Texas 17-6A as a junior; helped Cy Falls to a 10-2 record and Texas 6A D-I second-round playoff appearance.",,,,,,,,,,,,,,,,
202100871,Two-sport athlete in football and track and field.Spring 2019: Ran a 10.97 100 as a sophomore.,,,,,,,,,,,,,,,,
202100872,"Adrian Huey is a 5-10.5, 141-pound Cornerback from Murfreesboro, TN. Huey was named to the preseason third-team All-Defense team in Tennessee in 2020.",,,,,,,,,,,,,,,,
202100873,"Two-sport athlete in football and track (200 meters, long jump).",,,,,,,,,,,,,,,,
202100874,2019: Played both ways (WR/S/CB) as a junior; helped Baton Rouge Central to an 8-3 record and Louisiana 5A first-round playoff appearance.,,,,,,,,,,,,,,,,
202100875,"Three-sport athlete (basketball, track).2020: Key player for a Sanford Seminole squad that has made a deep run in the 8A state playoffs. Accounted for 824 yards of offense and 11 touchdowns through nine games.2019: Only played in a handful of games as a junior due to a wrist injury.",,,,,,,,,,,,,,,,
202100876,2019: Played junior season at Texarkana (Texas) Pleasant Grove; helped PG to a 15-1 record and a Texas 4A D-II state championship.2018: Played sophomore season at Hope (Ark.) High School.2017: Played freshman season at Little Rock (Ark.) Joe T. Robinson.,,,,,,,,,,,,,,,,
202100877,Experience in two sports as a football and throws athlete in track and field. Recorded a 43-7 1/4 PR in the shot put and a 130-8 PR in the discus as a sophomore in Spring 2019.,,,,,,,,,,,,,,,,
202100878,"Colin Henrich is a 6-3, 310-pound Offensive Tackle from Leesburg, VA. He attends St. John's College High School in Washington, DC.",,,,,,,,,,,,,,,,
202100879,"Terion Sugick is a 6-0, 240-pound Defensive Tackle from Fort Washington, MD.",,,,,,,,,,,,,,,,
202100880,2019: Played multiple positions on defense as a junior.,,,,,,,,,,,,,,,,
202100881,Played both ways in high school...helped team reach the state championship game as a junior. ...also a standout in Track...ranks among the top 10 athletes in the state of Alabama in the 100-meter dash with a confirmed time of 10.83 seconds.,,,,,,,,,,,,,,,,
202100882,Plays football and competes in the long jump and triple jump.,,,,,,,,,,,,,,,,
202100883,"Victor Wikstrom is a 6-3, 235-pound Tight End from Sweden, SWED.",,,,,,,,,,,,,,,,
202100884,"HIGH SCHOOL: Rated a consensus three-star prospect by 247Sports, Rivals and ESPN … Rated the No. 4 player overall in Arkansas by both ESPN and 247Sports … Rated the No. 46 outside linebacker in his class … Played linebacker for head coach Randy Coleman at Jonesboro High School … As a senior, made 91 tackles with 3.0 sacks and a forced fumble in 10 games … Made a season-best 18 tackles against Sylvan Hills … As a junior at Forrest City High School, registered 83 tackles with 12.0 tackles for loss in eight games … Part of a team that went 8-3 … In 10 games as a sophomore, posted 67 tackles with 4.0 sacks and two interceptions … CHOSE ARKANSAS OVER: Louisiana, Southern Miss, Tulane, Houston and others.Played at Forrest City (Ark.) prior to senior season.2020: Started at LB and also got snaps at RB (6-58-1); helped Jonesboro to a 6-4 record and Arkansas 6A first-round playoff appearance.2019: Helped Forrest City to an 8-3 record and an Arkansas 4A first-round playoff appearance as a junior.2018: Earned third-team all-conference honors as a sophomore at Forrest City.",,,,,,,,,,,,,,,,
202100885,2019: Helped Del City to a 9-3 record and an Oklahoma 6A-II state semifinal appearance as a junior.,,,,,,,,,,,,,,,,
202100886,"Two-sport athlete in football and track and field (100 meters, 200 meters, relays).2019: First-team all-district Texas 4-6A as a junior; helped Arlington Bowie to an 8-4 record and a second-round appearance in the Texas 6A D-II playoff bracket.",,,,,,,,,,,,,,,,
202100887,Two-sport athlete in football and basketball.2020: Earned first-team all-district honors at DE as a senior2019: First-team all-district selection at OLB as a junior.,,,,,,,,,,,,,,,,
202100888,2019: Helped Freedom to an 11-1 record and a Virginia Class 6 second-round playoff appearance as a junior.,,,,,,,,,,,,,,,,
202100889,2019: Texas AP 5A first-team all-state selection at WR as a junior; Texas District 4-5A-II MVP.,,,,,,,,,,,,,,,,
202100890,"Measured 6-4 1/2, 212 pounds with an 80 1/2-inch wingspan in the Spring 2020 semester.",,,,,,,,,,,,,,,,
202100891,2019: Helped McKinney to a 7-5 record and a Texas 6A D-II second-round playoff appearance as a junior.,,,,,,,,,,,,,,,,
202100892,"Al-Shadee Salaam is a 5-9, 170-pound Running Back from East Orange, NJ.",,,,,,,,,,,,,,,,
202100893,Also runs track. A state qualifier as a junior in the 100-meter dash.2020: Key player for a team that went 4-6 and lost in opening round of AAAAAAA state playoffs; Participated in Florida-Georgia All-Star Game.,,,,,,,,,,,,,,,,
202100894,Also participates in track and field (high jump).2019: A key player for a team that made the 7A state semifinals.2018: The leading receiver as a sophomore for a Venice squad that went 12-2 and won a district championship while making a deep run in the 7A state playoffs; Herald Tribune All-Area first-team selection.,,,,,,,,,,,,,,,,
202100899,"Also runs track (100m, 200m)2020: A member of The News-Press/Naples Daily News Big 15.2019: The News-Press first-team all-area selection after playing offense and defense for a Bishop Verott program that went 9-3 and reached the second round of the 3A state playoffs. Also returned four punts and a kickoff on special teams for scores.2018: Played at South Fort Myers where he returned two kickoffs for touchdowns.",,,,,,,,,,,,,,,,
202100901,"Iesa Jarmon is a Cornerback from Cincinnati, OH.",,,,,,,,,,,,,,,,
202100902,"2019: As a junior, helped Holy Cross to a 5-6 record and a first-round playoff appearance in the Louisiana Division I bracket.",,,,,,,,,,,,,,,,
202100903,"2022 (Louisville): Recorded a fumble return against Boston College … Caught one interception with no yards against Florida State … Had one solo tackle in the win against UCF … Appeared in six games for the Cardinals.2021 (Louisville): Redshirted ...  Played in four games ... Recorded four tackles ...  All four stops came in the First Responder Bowl against Air Force.High School: Three-star prospect ... Ranked as the No. 900 player in the 247Sports Composite ... Tabbed the No. 80 cornerback and the No. 116 player in Florida ... Ranked as the No. 122 cornerback and the No. 173 prospect coming out of Florida by Rivals ... Committed to Louisville on 5/22/20 ... Two time team captain ... Played for Gerald Cox at Booker T. Washington High ... Earned all-conference accolades ... Totaled 37 tackles and seven interceptions, with one pick-six as a junior ... Garnered All-Dade County honors and helped Booker T. Washington to the Class 4-A state title ... Had an interception but Booker T. Washington lost 28-12 to Miami Columbus ... Registered two pass breakups in a 20-14 loss to North Miami Beach.",,,,,,,,,,,,,,,,
202100904,"Maximus Gibbs is a 6-6, 330-pound Offensive Tackle from Bellflower, CA.",,,,,,,,,,,,,,,,
202100905,"Omar Burroughs Jr. is a 5-9.5, 156-pound Cornerback originally from Savannah, Ga. He set the IMG Academy interception record in 2019.",,,,,,,,,,,,,,,,
202100906,"Jaleel Davis is an Offensive Tackle from Rockingham, NC.",,,,,,,,,,,,,,,,
202100907,"Jay Jones is a 6-1, 180-pound Cornerback from Demopolis, AL.",,,,,,,,,,,,,,,,
202100908,"Jaydon Collins is a 6-6, 275-pound Offensive Tackle from Greer, SC.",,,,,,,,,,,,,,,,
202100909,"CJ Dippre is a 6-5, 245-pound Athlete from Jermyn, PA.",,,,,,,,,,,,,,,,
202100910,"Armorion Smith is a 6-2, 190-pound Safety from River Rouge, MI.",,,,,,,,,,,,,,,,
202100911,"Jim Bonifas is a 6-5, 255-pound Offensive Tackle from Dubuque, IA.",,,,,,,,,,,,,,,,
202100912,"Ryan Hoerstkamp is a 6-4, 225-pound Tight End from Washington, MO.",,,,,,,,,,,,,,,,
202100913,"Fred Eaford is a 5-10.5, 159-pound Wide Receiver from Pompano Beach, FL.",,,,,,,,,,,,,,,,
202100914,Played at Fairfield (Conn.) College Prep prior to senior season.,,,,,,,,,,,,,,,,
202100915,2020: Participated in the Florida-Georgia All-Star Game.,,,,,,,,,,,,,,,,
202100916,"Branson Yager is a 6-7, 332-pound Offensive Tackle from Grantsville, UT.",,,,,,,,,,,,,,,,
202100917,"Kaden McMullen is a Quarterback from O'Fallon, MO.",,,,,,,,,,,,,,,,
202100918,"James Bohls is a 6-0, 195-pound Running Back from San Clemente, CA.",,,,,,,,,,,,,,,,
202100919,Spring 2021: Ran a 22.71 200 as a senior.Spring 2019: Recorded personal best of 5-10 in the high jump as a sophomore.,,,,,,,,,,,,,,,,
202100920,"2022 Second-Team Freshman All-American (The Athletic, CFN)2022 Second-Team All-CUSA (PFF, PFN)2022 Fourth-Team All-CUSA (Phil Steele)2022 Conference USA All-Freshman (Coaches)2023 (REDSHIRT SOPHOMORE): Played in 11 games in his first season at Arkansas, catching three passes for 26 yards … Caught his first pass as a Razorback vs. Texas A&M (Sept. 30) for two yards … Hauled in a 25-yard pass at Alabama (Oct. 14), including 23 yards after catch.At North Texas2022 (REDSHIRT FRESHMAN): Played in all 14 games for North Texas, starting six, catching 34 passes for 458 yards and five touchdowns to earn Second-Team Freshman All-American from The Athletic and College Football Network, Second-Team All-CUSA from Pro Football Focus and Pro Football Network, Fourth-Team All-CUSA from Phil Steele and Conference USA All-Freshman honors from the league’s coaches … Set single-season school records for a tight end in receptions (34) and yards (458) … His five scores led the league among tight ends and were second-most in a single-season by a tight end in North Texas history … His 458 yards were 15th nationally among tight ends and led Conference USA … Hauled in two passes for 38 yards vs. SMU (Sept. 3) … Found the end zone for the first time as part of a three-catch game with 28 yards vs. Texas Southern (Sept. 10) … Caught two passes, including a 54-yarder, for 71 yards and a score at UNLV (Sept. 17) … Gained seven yards on one reception at Memphis (Sept. 24) … Snagged three passes for 22 yards vs. Florida Atlantic (Oct. 1) … Posted a season-best with four catches for 59 yards and his third touchdown of the season vs. Louisiana Tech (Oct. 15) … Set a career-best with 92 yards at UTSA (Oct. 22), catching three passes and scoring a touchdown … Hauled in two passes for 30 yards at Western Kentucky (Oct. 29) … Scored his fifth TD of the season vs. FIU (Nov. 5), catching a career-high five passes for 42 yards … Caught three passes for eight yards at UAB (Nov. 12) … Three catches for 41 yards vs. Rice (Nov. 26) … Two catches for 13 yards against UTSA in the C-USA Championship Game (Dec. 2) … One catch for seven yards vs. Boise State in Frisco Bowl.2021 (FRESHMAN): Played in three games in his first season at North Texas to preserve his redshirt but did not record any stats … Made his collegiate debut vs. Louisiana Tech.HIGH SCHOOL: Rated a three-star prospect by 247Sports Composite … Rated by 247 as the No. 50 tight end in the class of 2021 and No. 132 prospect in Texas … Had 33 receptions for 506 yards and three touchdowns in nine games during his senior season … Had 678 receiving yards on 45 receptions with seven touchdowns in 23 varsity games played for Dekaney … Also played basketball at Dekaney and earned first-team All-District recognition as a junior after averaging 10.1 points and 11.8 rebounds per game … Named Dekaney High School Homecoming King in 2020 … Chose North Texas over: LSU, Houston, Louisiana Tech, Tulsa, Utah State, Grambling State, Prairie View A&M and Southern University.",,,,,,,,,,,,,,,,
202100921,"HIGH SCHOOL: Consensus three-star prospect according to 247Sports, Rivals and ESPN … Rated the No. 8 player in Missouri by ESPN … Rated the No. 51 outside linebacker in his class … Played both linebacker and running back for head coach William Lowe at Lincoln College Prep … As a senior made 91 tackles, 17.0 tackles for loss, two interceptions with a touchdown and one fumble recovery … Rushed for 441 yards (12.6 ypc) and seven touchdowns, and also had seven catches for 111 yards (15.9 ypc) and a score … His junior season, totaled 150 tackles, 18.0 tackles for loss, 5.0 sacks, an interception and a forced fumble for 12-1 Lincoln College Prep … Named the Ronald Warren Outstanding Linebacker by the Kansas City Football Coaches Association … Offensive coordinator in high school was Donnell Fletcher, a former Arkansas running back (1995-96) … CHOSE ARKANSAS OVER: Iowa State, Kansas State, Kansas, Washington State and others.",,,,,,,,,,,,,,,,
202100922,Multi-sport athlete in football and track and field.Spring 2020: Recorded new 100-meter PR of 11.10 as a junior.Spring 2019: Finished eight at the Arkansas Class 6A state meet in the 100 meters (11.11 PR). Qualified for state in the 200 meters (22.66 PR) and the shot put (44-4 3/4 PR).,,,,,,,,,,,,,,,,
202100923,"Rico Barfield is a 6-0, 190-pound Running Back from Saint Louis, MO.",,,,,,,,,,,,,,,,
202100924,Grew up playing soccer and basketball. Didn't participate in football until the 10th grade.2019: South Florida Sun Sentinel All-County honorable mention after helping Chaminade-Madonna Prep win a 3A state title.,,,,,,,,,,,,,,,,
202100925,2019: Two-way player (WR/DB) as a junior who helped Gaither to a 12-2 record and a Florida 6A state semifinal appearance.,,,,,,,,,,,,,,,,
202100926,"Two-sport athlete in football and track and field (indoor 55 meters, high jump).",,,,,,,,,,,,,,,,
202100927,"Jaden Hicks is a Safety from Las Vegas, NV.",,,,,,,,,,,,,,,,
202100928,The Associated Press named him second-team All-Kentucky offense in 2019. He was named All-Kentucky by Kentucky Sports Radio in 2020.,,,,,,,,,,,,,,,,
202100929,"Jake Chaney is a 6-0, 210-pound Inside Linebacker from Lehigh Acres, FL.",,,,,,,,,,,,,,,,
202100930,"Cam'Ron Stewart is a 6-5, 255-pound Edge from Shillington, PA.",,,,,,,,,,,,,,,,
202100931,2019: Helped Satellite to a 7-4 record as a junior.,,,,,,,,,,,,,,,,
202100932,"Treylan Davis is a 6-5, 215-pound Tight End from Jackson, OH.",,,,,,,,,,,,,,,,
202100933,"A.J.  Campbell is a 6-4, 240-pound Weak-Side Defensive End from Akron, OH.",,,,,,,,,,,,,,,,
202100934,Also plays basketball.,,,,,,,,,,,,,,,,
202100935,"Dino Kaliakmanis is a Wide Receiver from Antioch, IL.",,,,,,,,,,,,,,,,
202100936,"Deshauwn Alleyne is a 6-0, 210-pound Outside Linebacker from Port Saint Lucie, FL. Also a high-level wrestler at the prep level.",,,,,,,,,,,,,,,,
202100937,"Colston Powers is a 6-5, 285-pound Offensive Tackle from Daleville, VA.",,,,,,,,,,,,,,,,
202100938,2019: Played DE and OLB as a junior.,,,,,,,,,,,,,,,,
202100939,"Two-sport athlete in football and track (100 meters, 200 meters, relays).2019: Texas District 6-5A D-II Newcomer of the Year as a junior.",,,,,,,,,,,,,,,,
202100940,"Jalen Williams is a 5-11, 170-pound Cornerback from Lancaster, CA.",,,,,,,,,,,,,,,,
202100941,2019: Led Oak Ridge to an 11-3 record and a CIF Sac-Joaquin Section Division I runner-up finish.,,,,,,,,,,,,,,,,
202100942,"Jordan Moore is a 6-2, 175-pound Wide Receiver from Towson, MD.",,,,,,,,,,,,,,,,
202100943,Competes in club 7-on-7 for PPA (Pro Process Academy).,,,,,,,,,,,,,,,,
202100946,"TJ Guy is a 6-4, 240-pound Weak-Side Defensive End from Mansfield, MA.",,,,,,,,,,,,,,,,
202100947,"Tsion Nunnally is a 6-2, 175-pound Wide Receiver from Santa Rosa, CA.",,,,,,,,,,,,,,,,
202100948,2019: Texas District 5-6A first-team selection at OLB as a junior; helped Denton Guyer to a 14-2 record and a Texas 6A D-II state runner-up finish.,,,,,,,,,,,,,,,,
202100949,"Cyrus Allen is a Wide Receiver from New Orleans, LA.",,,,,,,,,,,,,,,,
202100950,"Jesiah Davis is a 6-2, 170-pound Wide Receiver from Charlotte, NC.",,,,,,,,,,,,,,,,
202100951,2019: Helped Highland Springs to an 11-1 record and a Virginia Class 5 second-round playoff appearance as a junior.,,,,,,,,,,,,,,,,
202100952,"Jaelin Alstott-VanDeVanter is a 6-7, 260-pound Offensive Tackle from Mooresville, IN.",,,,,,,,,,,,,,,,
202100953,"Xavier Coleman is a Running Back from Medford, NJ.",,,,,,,,,,,,,,,,
202100954,"D.J Stepney is a Safety from Macomb, MI.",,,,,,,,,,,,,,,,
202100955,Also runs track. Recorded 11.63 100 and 23.52 200 as a sophomore.,,,,,,,,,,,,,,,,
202100956,"Tamarion Crumpley is a Cornerback from Cincinnati, OH.",,,,,,,,,,,,,,,,
202100957,"Jailen Weaver is a 6-7, 280-pound Weak-Side Defensive End from Antioch, CA.",,,,,,,,,,,,,,,,
202100958,"Anthony Rosas is a 6-4, 270-pound Offensive Tackle from Baldwin Park, CA.",,,,,,,,,,,,,,,,
202100959,"Cameron Junior is a 6-0, 210-pound Outside Linebacker from Middletown, OH.",,,,,,,,,,,,,,,,
202100960,"Krew Jackson is a 6-5, 200-pound Safety from Queen Creek, AZ.",,,,,,,,,,,,,,,,
202100961,"Desmond Igbinosun is a 6-3, 195-pound Safety from Union, NJ.",,,,,,,,,,,,,,,,
202100962,"Maxwell Hairston is a Cornerback from West Bloomfield, MI.",,,,,,,,,,,,,,,,
202100963,"Garner Wallace is a 6-5, 185-pound Safety from Pickerington, OH.",,,,,,,,,,,,,,,,
202100964,"Michael Mincey is a 6-1, 210-pound Inside Linebacker from Waycross, GA.",,,,,,,,,,,,,,,,
202100965,"Andrew Simpson is a 6-1, 215-pound Outside Linebacker from Bellflower, CA.",,,,,,,,,,,,,,,,
202100966,Two-sport athlete in who also plays basketball.,,,,,,,,,,,,,,,,
202100967,"Also competes in track (100 meters, 200 meters, 400 meters).2019: Started at CB as a junior and helped Cherry Creek to a 14-0 record and the Colorado 5A state championship.",,,,,,,,,,,,,,,,
202100968,"Eric McDaniels is a 6-0, 210-pound Athlete from Richmond, VA.",,,,,,,,,,,,,,,,
202100969,Played at Denton Guyer HS as a junior2017: Was named the District 9-6A Defensive Newcomer of the Year as a freshman,,,,,,,,,,,,,,,,
202100970,2019: Unanimous first-team all-district selection as a junior.2018: Named the District 5-5A-I Offensive Newcomer of the Year as a sophomore.,,,,,,,,,,,,,,,,
202100971,"Drew Carter is a 6-3, 195-pound Pro-Style Quarterback and Shooting Guard from Portland, OR.",,,,,,,,,,,,,,,,
202100972,Iverson Celestine is a 2021 RB from Mandeville (La.) Fontainebleau.,,,,,,,,,,,,,,,,
202100973,"Caleb Banks is a 6-6, 255-pound Strong-Side Defensive End from Southfield, MI.",,,,,,,,,,,,,,,,
202100974,"Derrick Harmon is a Defensive Tackle from Detroit, MI.",,,,,,,,,,,,,,,,
202100975,"Two-sport athlete in football and track (100 meters, 200 meters).2020: Played seven games as a senior before suffering season-ending leg fracture.2019: Earned Texas District 8-5A D-I second-team honors at running back as a junior; helped Lufkin to a 9-2 record and Texas 5A D-I first-round playoff appearance.",,,,,,,,,,,,,,,,
202100976,"Marcus Morgan is a 6-1, 160-pound Athlete from Iowa City, IA.",,,,,,,,,,,,,,,,
202100977,"Skyler Bell is a Wide Receiver from Watertown, CT.",,,,,,,,,,,,,,,,
202100978,2019: Primarily played OLB as a junior.2018: Played receiver and safety as a sophomore.,,,,,,,,,,,,,,,,
202100979,"Justin Franklin is a 5-9, 160-pound Wide Receiver from Douglasville, GA.",,,,,,,,,,,,,,,,
202100980,2019: Earned Texas District 7-6A second-team honors at DE as a junior.,,,,,,,,,,,,,,,,
202100981,"Andrew Edson is a 6-3, 240-pound Weak-side Defensive End from Snoqualmie, WA.",,,,,,,,,,,,,,,,
202100982,Two-way player on the offensive line and defensive tackle. Also competes in shot put with personal record of 48-11 in March 2020.,,,,,,,,,,,,,,,,
202100983,"Terrance Butler is a Weak-Side Defensive End from Baltimore, MD.",,,,,,,,,,,,,,,,
202100984,Two-sport athlete in football and basketball.2019: Helped Norman to a 7-4 record and an Oklahoma 6A-I first-round playoff appearance as a junior.,,,,,,,,,,,,,,,,
202100985,"Ty Furnish is a 6-4, 240-pound Offensive Tackle from Roswell, GA.",,,,,,,,,,,,,,,,
202100986,"Two-sport athlete in football and track (100 meters, 200 meters).2019: Texas District 5-5A D-I first-team selection as a junior; helped Frisco Lone Star to a 14-1 record and Texas 5A D-I state semifinal berth.",,,,,,,,,,,,,,,,
202100987,Older brother Clark Phillips was starting corner at Utah and now plays for Atlanta Falcons. Phillips spent a year at Santa Ana JC before signing with Tennessee State in 2021 and was a two year starter before going in to the transfer portal.,,,,,,,,,,,,,,,,
202100988,"Two-sport athlete in football and track and field (triple jump, high jump, relays).2019: Two-way first-team all-district Louisiana 7-3A at receiver and DB as a junior.",,,,,,,,,,,,,,,,
202100989,"Myles Williams is a Defensive End from Calabasas, CA.",,,,,,,,,,,,,,,,
202100990,Also competes in track and field. Ran a 10.85 100 as a sophomore.,,,,,,,,,,,,,,,,
202100991,"Zamajay Duncan is a 5-10, 180-pound Cornerback from San Juan Capistrano, CA.",,,,,,,,,,,,,,,,
202100992,"HIGH SCHOOL: Consensus three-star prospect according to 247Sports, Rivals and ESPN … Rated the No. 4 player in Arkansas by Rivals … Ranked the No. 19 tight end in his class by ESPN … Played tight end for head coach Brad Bolding at Little Rock Parkview … As a senior, made two catches for 90 yards (45.0 ypc) and a touchdown … Missed the majority of the season with a meniscus injury … As a junior, made 48 catches for 721 yards (15.0 ypc) with eight touchdowns … Hauled in 27 catches for 322 yards (11.9 ypc) and six touchdowns as a sophomore … His freshman season made 22 grabs for 331 yards (15.0 ypc) … Little Rock Parkview teammate Landon Rogers is also part of the 2020 signing class … CHOSE ARKANSAS OVER: LSU, Texas A&M, Tennessee, Oregon, Michigan, Michigan State and others.Erin Outley is a 2021 tight end from Little Rock (Ark.) Parkview Magnet.",,,,,,,,,,,,,,,,
202100994,2019: Helped Edna Karr to its fourth consecutive Louisiana 4A state championship as a junior.,,,,,,,,,,,,,,,,
202100997,Two-sport athlete in football and baseball.2019: First-team all-district selection at DB as a junior.,,,,,,,,,,,,,,,,
202100998,"Three-sport athlete (basketball, track)2019: First year playing football at high school level; Participated in the Legend's Football All-Florida Junior Showcase.",,,,,,,,,,,,,,,,
202100999,"Alex Okelo is a 6-6, 217-pound Weak-Side Defensive End from Nashville, TN.",,,,,,,,,,,,,,,,
202101000,"Dylan Flowers is a Cornerback from Westlake Village, CA.",,,,,,,,,,,,,,,,
202101001,"Jacob Coleman is a 6-2, 207-pound wide receiver/tight end from Chesterfield, VA.",,,,,,,,,,,,,,,,
202101002,"TJ Quinn is a 6-1, 200-pound Safety from Valdosta, GA.",,,,,,,,,,,,,,,,
202101003,"Demetrius Hill is a Cornerback from Miami, FL.",,,,,,,,,,,,,,,,
202101004,"Recorded 174 tackles, including 12.0 for loss with 5.0 sacks, five interceptions…also stood out on special teams, averaging 30.1 yards per kickoff return and blocking six kicks…helped Columbia advance to region final round of 6A state playoffs his senior season…earned all-state honorable mention honors after registering 77 tackles, one interception, one fumble recovery, 289 kickoff return yards and two blocked kicks his junior season…helped Tigers win eight games and advance to second round of 6A state playoffs…participated in Legend’s Football All-Florida Junior Showcase…also ran track for Columbia, helping 4×100 relay team reach state championships meet as a sophomore.",,,,,,,,,,,,,,,,
